Index,Text,Grade,Type,bert.2.pred,bert.2.prob.1,bert.2.prob.2,bert.2.prob.3,bert.2.prob.4,bert.2.prob.5
483,"A new section was recently added to the
is a spacecraft that orbits about 225 miles above Earth.
This drawing shows the inside of the Destiny module, or spacecraft. Scientists conduct experiments in the laboratory.
One experiment will test how humans can live in space for long periods of time.
is 28 feet long and 14 feet wide, about the size of a school bus.
weighs 16 tons and cost $1.4 billion to build.
All trademarks and logos are property of Weekly Reader Corporation.
",1,WRLevel3,0,0.6639015674591064,0.22811414301395416,0.07975602895021439,0.01465943455696106,0.013568790629506111
661,"Yuck! A health and safety group recently tested school surfaces for germs and found millions! Drinking fountains had the most germs. A cafeteria tray had more germs than a toilet seat! The testers also found germs lurking on desks and computer keyboards.
Health experts say drinking fountains would have fewer germs if they were cleaned more often.
Kids miss 22 million days of school each year because of colds caught from germs. That number would be much lower if kids would just wash their hands, say health experts.
Not all germs are harmful, but some can make kids sick. ""When you share things in a classroom, you increase the chance that you might get sick,"" the health and safety groups spokesperson, Jerry Bowman, told
""Since we are right in the middle of cold and flu season, we have to be extra careful to wash our hands and cover up [our] coughs.""
Health experts say drinking fountains would have fewer germs if they were cleaned more often.
All trademarks and logos are property of Weekly Reader Corporation.
",1,WRLevel3,2,0.1374419778585434,0.4160902798175812,0.4209500849246979,0.010614132508635521,0.014903645031154156
26,"Two whale sharks named Ralph and Norton are quickly becoming friends. They live in a huge tank at the Georgia Aquarium in Atlanta.
is a building where sea creatures are kept so the public can view them. The Georgia Aquarium opened in November and is the largest in the world. It holds 8 million gallons of water and more than 100,000 sea creatures!
The whale sharks live in the largest tank at the aquarium. That is because whale sharks are the biggest fish in the world. They can grow up to 40 feet long! The aquarium also has hands-on exhibits. The exhibits give visitors achance to touch horseshoe crabs, sea stars, and stingrays. ""We want to be the worlds most engaging aquarium,"" says spokesperson Jeff Swanagan.
All trademarks and logos are property of Weekly Reader Corporation.
",1,WRLevel3,1,0.2520446181297302,0.47151583433151245,0.2540031671524048,0.009770365431904793,0.012665986083447933
187,"Great geysers of water! Thats what scientists recently discovered on Enceladus (en-SEL-ahduhss), one of Saturns moons.
is a spring that shoots water into the air.
An illustration of a geyser on Saturn's moon Enceladus.
Scientists are excited by the news. Water is a key ingredient for life. Life may exist in water beneath the icy surface of Enceladus, say scientists. However, dont expect to hear about the discovery of little green aliens. The forms of life most likely to be found are
A microbe is a simple life-form that can be seen only under a microscope.
The findings are based on images from the spacecraft
which has been studying Saturn and its moons since 2004. The images show geysers shooting water hundreds of miles above the surface of Enceladus.
For now, scientists will have to be patient.
wont get another close-up view of Enceladus until 2008.
All trademarks and logos are property of Weekly Reader Corporation.
",1,WRLevel3,1,0.3516007959842682,0.4345722794532776,0.17770656943321228,0.02315281331539154,0.012967508286237717
462,"Dig this! Archaeologists are preparing to dig up an
, or very old, wooden boat in Egypt. An archaeologist is a scientist who digs up old objects and studies them to learn about the past. Egypt is a country in Africa.
Scientists plan to dig up another Egyptian boat like this one.
The boat is 4,500 years old. It is buried next to the Great Pyramid. That is the largest pyramid in Egypt. Egyptians built the Pyramids thousands of years ago. They are burial places for
The boat is the second one found near the Great Pyramid. Archaeologists dug up the first boat in 1954. It is on display in a museum near the Pyramids.
Experts will begin removing the buried boat this fall to study it. They hope to learn how the Egyptians used the boats.
Theres a lot of [discussion] as to whether these [boats] ever were used, says scientist John Darnell.
All trademarks and logos are property of Weekly Reader Corporation.
",1,WRLevel3,0,0.552422046661377,0.3373505473136902,0.08393482118844986,0.012302493676543236,0.013990156352519989
615,"Are green schools a key to smarter, healthier students?
The Willow School in Gladstone, N.J., is made of more than just bricks. The insides of the walls include denim from blue jeans! Other parts of the building are made of wood from an old toothpick factory.
. That is a school built in a special way to save energy and resources. Green schools also provide a healthy environment for students. Some green schools have rooftop gardens to grow foods for their cafeterias. Others use special window shades to keep the buildings cool on hot days.
Across the United States, more schools are going green. The U.S. Green Building Council is an organization that decides whether schools are green. Representatives for the organization say they have approved about 85 green schools. About 650 more schools are waiting to be considered for green school status.
, or help, students. Some experts say that students who attend green schools are smarter and healthier. One study found that students in classrooms with natural daylight scored 25 percent higher in reading and math than students whose rooms did not have as much natural light.
Another study found that students in schools that have natural light stayed home sick three to four fewer days than kids who study in
Willow School students get plenty of natural light. Each classroom is built with a
, or a window in the roof. ""Sunlight has an impact,"" Kate Burke Walsh, head of the school, told
. ""[The students] have great energy. They're ready to learn.""
How can your school help the environment? Keep reading for some ideas.
Start a recycling program at your school. Everything in your classroom from old papers to art supplies can be recycled.
Ask your teacher if your class can plant an herb garden. The cafeteria can use the fresh herbs in school lunches.
Instead of using paper or plastic bags, pack your lunch in a container you can reuse each day. You'll throw away less trash!
In what ways might green schools help the environment?
All trademarks and logos are property of Weekly Reader Corporation.
",1,WRLevel3,1,0.29605209827423096,0.43100056052207947,0.2479255348443985,0.008637377992272377,0.016384435817599297
739,"Two eyes peer through the thick leaves and branches of a tree. The eyes belong to a 400-pound lowland gorilla that lives in Africa's Congo Basin. That is home to the second-largest rain forest in the world.
The world's entire population of lowland gorillas live in the Congo Basin. Those creatures are among many species of endangered animals living in the rain forest.
The gorilla is one of the endangered animals living in the Congo Basin.
Scientists warn that more than half of the forest could disappear within 50 years. Some people illegally cut down trees and hunt wildlife to sell as meat. Many rain forest animals, like the lowland gorilla, are endangered because of illegal hunting.
Gorillas are plant eaters. They also like to eat insects, such as termites and ants. An adult male eats about 40 pounds of food each day!
Young gorillas love to play. They learn new skills by imitating adult gorillas.
Each gorilla has a unique nose print. Scientists can identify a gorilla by the shape of its nose.
Help is on the way for the rain forest and the animals that live there. The presidents of 10 African countries recently signed a
, or agreement, to protect the rain forest.
""The treaty is important because it shows that the governments are committed to protecting the Congo Basin,"" World Wildlife Fund (WWF) scientist Richard Carroll told
The WWF is a group that protects endangered animals and habitats. The WWF is helping Africa's governments stop illegal hunting and set up parks and protected areas for animals. ""This gives us a great opportunity to save the forest,"" said Carroll.
Do you think people should be responsible for protecting animals and habitats? Why?
All trademarks and logos are property of Weekly Reader Corporation.
",1,WRLevel3,2,0.100881427526474,0.4283543825149536,0.444816529750824,0.010829024016857147,0.015118615701794624
373,"Artist Cynthia Vose believes that hats tell a story. Women have worn different hats throughout history. In honor of Womens History Month, Vose organized an art exhibit about hats. The exhibit is taking place this month at a library in Billerica, Massachusetts.
""Beyond fashion, hats represent the changing roles of women in society.""
In the 1800s, many American women wore bonnets. As women gained rights, they no longer wore hats just for fashion. Women began to wear hats for jobs that were once held by men.
All trademarks and logos are property of Weekly Reader Corporation.
",1,WRLevel3,1,0.30287474393844604,0.38631290197372437,0.28255534172058105,0.011901265941560268,0.01635577343404293
202,"A filmmaker spies on polar bears in the Arctic.
A huge polar bear walks across the ice. Everything around it is quiet. Suddenly, a smaller bear approaches. It swings at the larger creatures chest. The two animals fall to the ground in a playful wrestling match.
Little do they know, theres a camera hidden in the snow nearby. It is capturing the bears every move. The recorder was placed there by John Downer (above). He filmed polar bears in the Arctic. That is the snowy place at the northernmost part of the world.
Downer is giving people a chance to see polar bears as they never have before. He recently shared his footage with the public. [This film helps] you ... understand what it is like to be an animal, Downer told
A polar bear trails behind a camera.
how bears act. To reveal is to show. The cameras recorded rare images, such as newborn cubs leaving a
for the first time. A den is a home.
as ice and snow. To disguise something is to make it look like something else. One recorder is called the snowball cam. It looks like a giant snowball.
Downers cameras did more than just take super shots. They also showed the dangers polar bears face. The sea ice that polar bears stand on to hunt is melting. That makes it harder for the animals to catch food in the water, scientist Geoff York told
York and other wildlife experts hope Downers film will make people want to help the creatures. We [need to act now] so polar bears still have a place to live, York says.
The United States, Canada, Denmark, Finland, Iceland, Norway, Russia, and Sweden have land in the Arctic.
Temperatures in the Arctic can range from -76 degrees to 86 degrees Fahrenheit.
Many people who live in the Arctic are Inuit. They are
, or local, to the area. About 150,000 Inuit live there.
How can people protect polar bears and other threatened animals in the Arctic?
measures published under license with MetaMetrics, Inc.
All trademarks and logos are property of Weekly Reader Corporation.
",1,WRLevel3,1,0.23693802952766418,0.5143680572509766,0.2207622230052948,0.010151135735213757,0.01778048276901245
464,"Scientists find great surprises in the Great Barrier Reef.
Brightly colored fish dart in and out of the Great Barrier Reef. That is a
a continent. A coral reef is a large underwater structure full of plants and animals. Coral is made of tiny sea animals called
. When polyps die, their hard shells become part of the reef.
Scientists recently explored the worlds largest coral reef. They also looked at another reef near Australia. Their search turned up hundreds of animal species. Some of the species may have never been seen before.
Scientists used netted bags to search the reef. They spied big-clawed shrimp and worms shaped like pine trees. They also found about 130 new types of soft coral.
The researchers left behind 36 plastic houses on the ocean floor. The scientists hope the creatures will move into the houses. That will make it easier to study them.
Learning about the creatures may help people protect them. One-third of the worlds coral reefs are threatened by pollution and fishing. Its important to find out whats in the Great Barrier Reef, says scientist Patricia Hendriks. She took part in the
, or trip with a specific goal. If we dont know what is present in the first place, how are we ever going to protect it properly?
What species did scientists spy in the Great Barrier Reef? Here are a few that made a splash.
This green-banded snapping shrimp has a large claw on one side. It looks like a tiny lobster.
This Christmas tree worm rests on a coral reef. It uses its branches to breathe and eat.
The cuttlefish is a boneless animal related to squid. It has eight arms that it uses to catch food.
This gorgonian fan won the hearts of researchers. The soft coral fan stretches more than 3 feet tall.
In what ways can people help protect the Great Barrier Reef?
All trademarks and logos are property of Weekly Reader Corporation.
",1,WRLevel3,1,0.4067384600639343,0.425658255815506,0.1394776701927185,0.014348022639751434,0.013777628540992737
315,"Imagine that you had to play video games for homework. Does that sound too good to be true? At Prairie View Elementary in Cedar Rapids, Iowa, that is exactly what is happening. Prairie View is not alone. More than 4,000 schools across the country are assigning video-game homework!
These are not ordinary video games, however. They are special educational games made for schools. At Prairie View, students borrow the games to take home. The school lends video-game systems to any student who does not already own one.
The games teach students reading, language arts, and math skills. ""[The video games] are about having fun and learning,"" said third grader Hannah Stevens. ""I'm learning to do more math than I used to and more language arts.""
Laurene Lanich, the principal at Prairie View, says students enjoy playing the video games. ""It's high interest for kids. It's very similar to typical children's video games. They can get to different levels,"" she said.
Video-game homework also helps the home-school connection, says Lanich. ""It's an opportunity for children and parents to do something together that focuses on learning.""
Mark Ganzeveld, a third-grade teacher at Prairie View, says the best thing about the games is simple: ""It helps [students] see that learning can be fun.""
Educational video games are just one way to help kids learn.
Read often! Choose a variety of reading materials.
Get organized. Use assignment pads and calendars.
Talk to your parents about your schoolwork.
What are some ways you can improve your reading and math skills?
All trademarks and logos are property of Weekly Reader Corporation.
",1,WRLevel3,2,0.07922378182411194,0.3656887412071228,0.5195767283439636,0.014113244600594044,0.02139759622514248
779,"Each year, 17 million people try to stop smoking. However, only 1 million quit. That's why the American Cancer Society has organized The Great American Smokeout and SmokeScream.
Mark next Thursday, November 16, on your calendars and get ready to scream. That is the day of the SmokeScream. It is a day when kids across the country can scream about the dangers of smoking.
November 16 is also the day of the Great American Smokeout. The goal of the Smokeout is to get people to stop smoking for the day--and maybe forever.
The SmokeScream and the Great American Smokeout is run by the American Cancer Society. The group helps fight
by teaching people about the illness and raising money for medical research. Cancer is an illness that can cause death. Doctors say that smoking can cause cancer and other illnesses that can kill.
The lungs are parts of the body that allow a person to breathe. There is no cure for lung cancer.
About 430,000 people die each year from illnesses caused by smoking. That is more than the total number of deaths each year resulting from AIDS, drug abuse, car accidents, murders, and fires.
All trademarks and logos are property of Weekly Reader Corporation.
",1,WRLevel3,0,0.5199501514434814,0.32118067145347595,0.13604311645030975,0.009299492463469505,0.013526542112231255
307,"Last June, photographs taken of Mars by the
spacecraft showed ditches on Mars. Scientists believe the ditches could have been made by flowing water.
Scientists think the ditches were made when water seeped from underground. There is no water on the surface now. Scientists say it probably froze or turned to a mist. No one is sure when the ditches were created. They could be as old as a million years or as young as one week.
All trademarks and logos are property of Weekly Reader Corporation.
",1,WRLevel3,0,0.6994807124137878,0.21675311028957367,0.06094689667224884,0.011007026769220829,0.011812243610620499
241,"What did Casey Sokolovic decide to do when she learned that sea turtles were in trouble? A lot!
The student from Winterville, N.C., founded a program called Help Them LAST. That stands for Love a Sea Turtle. Casey, 11, raises money for the ocean swimmers. She does everything from selling turtle-shaped cookies to organizing fund-raising events at her school. So far, Caseys program has raised about $2,500 for a local center that cares for sea turtles.
The reptiles are at risk of losing their
or home. People overcrowd the beaches where sea turtles lay their eggs. Some of the animals are killed or
by boats. To be injured is to be hurt.
Casey is always coming up with new ways to help sea turtles. Recently, she teamed up with a coffee company to raise money for the animals. She also hopes to create a sea turtle Web site.
Its good to do something for the sea turtles, Casey told
All trademarks and logos are property of Weekly Reader Corporation.
",1,WRLevel3,1,0.1542515903711319,0.5110796093940735,0.3107227683067322,0.010245670564472675,0.013700416311621666
230,"Explore More    understand punctuation
marks are symbols used in writing. What is the purpose of each of these marks? What would happen if we didnt use punctuation marks?
Thousands of kids put their art skills to the test. They entered the Pier 1/UNICEF/ Weekly Reader greeting card contest. The winners were Adam Carr, 6, from Florida and Anna Hall, 12, from Colorado.
Adams and Annas drawings were made into greeting cards. Money earned from the sale of the cards will be used to help needy kids.
What would Adam and Anna wish for kids around the world? ""I would wish them peace on Earth,"" Adam told Weekly Reader. ""Look at the similarities in people, not the differences,"" says Anna.
All trademarks and logos are property of Weekly Reader Corporation.
",1,WRLevel3,1,0.3618691861629486,0.41693660616874695,0.19424739480018616,0.013170519843697548,0.01377625297755003
372,"The past few months have been busy for Democrat Nancy Pelosi. In January, she became the first female Speaker of the House of Representatives. The House and the Senate are the two chambers that make up the
That branch of government makes the country's laws. ""This is a historic moment for the Congress and for the women of this country,"" says Pelosi.
Pelosi has said that she wants to be judged by her abilities, not by her gender. ""Becoming the first woman Speaker will send a message to young girls and women across the country that anything is possible for them,"" she adds. Pelosi leads the 435 members of the House. She is third in line for the presidency, after the vice president.
All trademarks and logos are property of Weekly Reader Corporation.
",1,WRLevel3,1,0.1508503556251526,0.4523254632949829,0.3724639415740967,0.009913424961268902,0.01444688718765974
292,"Have you ever listened to the sounds that paper makes? To composer Tan Dun, paper is music. He invented instruments made of paper and wrote music to play on them.
This October, a group of fifth graders were among the first to hear musicians perform Dun's piece. The big event was held at the newly opened Walt Disney Concert Hall in California.
Dun wrote the musical piece to celebrate the art of making paper. About 2,000 years ago, the world's first fine paper was invented in China. China is the country in Asia where Dun was born.
""Using your imagination, you can find music around you, even in paper! Music is everywhere if you just look for it,"" Dun told
During the concert, musicians made sounds with the instruments in different ways. They tore, shook, hit, and even sang through the paper. Bet you didn't know paper could be so musical!
All trademarks and logos are property of Weekly Reader Corporation.
",1,WRLevel3,1,0.19157512485980988,0.49025028944015503,0.29606837034225464,0.010417763143777847,0.01168851274996996
771,"How much weight do you carry in your backpack? In October, we asked kids to answer that question. The good news is this: Most of you are not overloaded. The average backpack weighed 7 pounds. But some weighed more than 15 pounds! Ouch!
Doctors advise kids not to carry too much weight in their backpacks. They say most third graders should not carry a backpack that weighs more than about 8 pounds.
All trademarks and logos are property of Weekly Reader Corporation.
",1,WRLevel3,0,0.7403318285942078,0.18943731486797333,0.044611066579818726,0.012881685979664326,0.012738155201077461
653,"Sure, you've heard of horseshoes, but what about dog shoes? This spring, some hounds will be sporting new doggy footwear, but it's not a fashion statement.
About 20 police dogs in Dsseldorf, Germany, will wear blue plastic-fiber shoes when working. Germany is a country in Europe. The shoes
, or stop, the animals from being injured. Police say the dogs cut their paws on broken glass during missions. The Dsseldorf unit includes German and Belgian shepherds.
""I'm not sure they like [wearing the shoes], but they'll have to get used to it,"" says police spokesperson Andre Hartwich.
Police will train the pooches to wear the shoes so the animals are protected. ""Now we just have to teach the dogs how to tie their shoes,"" jokes Hartwich.
All trademarks and logos are property of Weekly Reader Corporation.
",1,WRLevel3,2,0.12172490358352661,0.40970638394355774,0.44287678599357605,0.010708456858992577,0.014983532018959522
143,"Scientists are teaching whooping cranes to fly south.
Dressed in a white costume, scientist Joe Duff pretends to be a whooping crane. He may look silly, but he has an important job to do. Duff is training a flock of whooping crane chicks in Wisconsin to think he is their mother. ""It's like becoming a bird yourself,"" he told
Joe Duff is the team leader of a group called Operation Migration. Members have been teaching ""whoopers"" to
to Florida since 2001. When animals migrate, they move from one place to another.
Operation Migration workers train the young whoopers to follow very light aircraft called
. Each aircraft is flown by a pilot in a whooping crane costume. In six months, the birds will be ready to follow the aircraft and migrate to Florida for the winter.
The whooping crane is an endangered bird. Only one flock of whooping cranes lives naturally in the wild. Those birds migrate between Canada and Texas. Scientists decided that having more than one flock would keep these birds from dying out.
Whooping cranes trained by Operation Migration in the past have remembered the route. They return to Wisconsin each spring and fly back to Florida in the fall.
""We want our birds to pay attention to us for the first year, until we get them down to Florida,"" said Duff. ""After that, we hope they communicate with wild birds and become wild birds themselves.""
In October, pilots will lead the new flock of whoopers south for the winter. The migration route will take them over seven states: Wisconsin, Illinois, Indiana, Kentucky, Tennessee, Georgia and finally Florida.
Joe Duff spends a lot of time pretending to be a whooping crane. If you could be any animal, what would you be? Why?
measures published under license with MetaMetrics, Inc.
All trademarks and logos are property of Weekly Reader Corporation.
",1,WRLevel3,1,0.2330276519060135,0.47503483295440674,0.2679140269756317,0.009160173125565052,0.014863260090351105
11,"A purple octopus is making a splash! It is one of 11
or types, of sea creatures scientists recently found near Canada. That is a country north of the United States. Experts say the animals may be new to science.
Researchers discovered the creatures in the Atlantic Ocean. In addition to the purple octopus, scientists found a sea star and many types of coral and sea sponges.
We found all kinds of beautiful creatures, Ellen Kenchington told
She is one of the scientists who helped find the animals.
Researchers didnt explore the ocean alone, however. An underwater robot gave them a hand. The robot can search areas of the sea that are too deep for people to visit, explains Kenchington.
She and her team are studying their findings. They want to learn more about the oceans plants and animals. Every time we discover a new species, we learn something new about our planet, she says.
All trademarks and logos are property of Weekly Reader Corporation.
",1,WRLevel3,1,0.3428424298763275,0.4897504448890686,0.144222691655159,0.0106341652572155,0.012550332583487034
