Index,Text,Grade,Type,bert.2.pred,bert.2.prob.1,bert.2.prob.2,bert.2.prob.3,bert.2.prob.4,bert.2.prob.5
550,"A filmmaker finds out that elephant families can be comfortable with visitors.
""I started thinking of them as a family almost immediately,"" filmmaker Martyn Colbeck told
He was talking about wild elephants, not his next-door neighbors. For more than 15 years, Colbeck has filmed a family of African elephants in Amboseli National Reserve in eastern Africa.
airs April 1 on the PBS television show
The new film comes after recent studies found that elephants can recognize their reflection in a mirror. That is something only humans, chimpanzees, and dolphins were thought to be able to do. ""These animals are smart,"" Colbeck says. His documentary shows just how intelligent African elephantsthe world's largest land animalsare.
Colbeck's film follows an elephant family led by a 62-year-old female elephant named Echo. In the wild, African elephants live in herds. They roam long distances to find food. The oldest female elephant, called the
leads the herd. Adult male elephants live separately from the females and the young calves.
Echo guides her family to fresh water and food while staying alert for danger. The young elephants are the most
or at risk of being harmed. Colbeck witnessed that danger when he saw another elephant family attempt to kidnap Echo's calf Ebony. Echo gathered the other adult female elephants in her family to come to the rescue. ""Together they plowed into the kidnappers to recover Ebony,"" Colbeck explained. ""It showed forethought and teamwork.""
During his years of filmmaking, Colbeck observed other signs of elephant intelligence. Elephants communicate with each other through low rumbling sounds that people often cannot hear. Family members also make distinct sounds that other members can recognize.
or customs. After an elephant dies, the other family members cover the body with sticks and leaves and linger near the site for days. The animals often return to the site years later.
Amboseli National Reserve covers about 150 square miles in southern Kenya, near the Tanzania border. The Kenyan government protects the nature reserve's elephants from
or illegal hunting. Elephants have been hunted throughout history for the ivory in their tusks. Humans have used ivory to make jewelry and other objects. Today, elephants are an endangered species.
Since strict anti-poaching laws were put into effect in 1968, the number of elephants in Amboseli has risen from 500 to more than 1,200. When Colbeck began filming Echo's family in 1990, the family had only 14 members. Today it has 30 members.
Although the elephants still face some danger from the local Masai tribespeople, the creatures have become remarkably comfortable around human visitors. That makes Amboseli an ideal place for scientists to study elephant behavior.
""The elephants are totally relaxed about having vehicles in amongst the herd,"" says Colbeck. ""Nevertheless, it is still very important to respect the animals and not disturb them.  That respect develops into a trust, and in that way we have been able to document some extraordinary moments in their lives."" That trust has not only allowed Colbeck to film Echo's family, but it has also made him feel like one of the family.
The elephant families in Amboseli National Reserve are organized alphabetically. Echo's family is the ""E"" family, so every member of the family is given a name starting with
Here's how Echo fits in with some of her relatives.
(age 62): Echo is one of the oldest elephants in Amboseli. She is the leader of her family. You can tell that she is old by the length of her tusks. They are almost touching! Wild African elephants live an average of 60 years.
(died at age 34): She was Echo's eldest daughter. Erin died from a spear injury after she wandered too close to a watering hole protected by the local Masai people.
(age 22): As a young calf, Eliot would to run up and rest her head on researchers' vehicles. Now that she has grown up, Eliot keeps her distance from people.
(age 17): When he was born, Ely couldn't walk. The family waited to move until he stood on his own. Now he lives alone. He left the herd at age 12.
(age 25): Edwina is Echo's first known grandchild.
(age 22): Eleanor helped care for Email after Erin died.
(age 6): Email's mother, Erin, died when he was 2. Now the rest of the family takes care of him.
(age 12): Europa is Echo's first known great-grandchild.
(age 8): Elaine is Echo's second great-granddaughter.
(age 8): Elmo is Echo's only surviving great-grandson.
Why might African elephants need to communicate with each other?
measures published under license with MetaMetrics, Inc.
All trademarks and logos are property of Weekly Reader Corporation.
",2,WRLevel4,2,0.06879226118326187,0.1393342763185501,0.6123751401901245,0.04663658142089844,0.13286177814006805
544,"Do you want to check out where the Komodo dragon lives? How about taking part in a national poll just for kids?
Galaxy is a great place for kids. On it, you will find cool information, fun games and acvivities, important links, polls, and a lot more.
Just a few of the cool, exciting areas are these:
Do you think you have a head for geography? This online quiz will see whether you do.
If you liked a particular story, check out this area for updates and additonal information.
Be heard by casting your vote on a variety of important subjects.
How well do you remember what you read? Check yourself here.
Is it an alien? Is it alive? Try to figure it out here.
Before you log on to any site, however, you need to know some ""golden rules of Internet safety."" Just as when you ride a bike, skateboard, or in-line skate, you need to think of safety first.
Here are some do's and don'ts to remember when surfing the Net:
keep all personal information to yourself, unless you have your parents' permssion.
meet with a person you have met online without your parents' permission.
avoid getting into arguments with other people online.
open e-mail or download files from people or sites you don't know.
tell an adult if a message or a site makes you feel uneasy or nervous.
All trademarks and logos are property of Weekly Reader Corporation.
",2,WRLevel4,0,0.4400594234466553,0.2548399865627289,0.22552098333835602,0.031170478090643883,0.048409100621938705
131,"A baby aardvark readies for its television close-up. The animal, nearly 3 weeks old, sniffed the lens of a television camera during its first public appearance at the Henry Doorly Zoo in Omaha, Nebraska. It was the first baby aardvark born at the zoo.
The baby is growing quickly! Although it weighed just 3 pounds at birth, its weight had nearly doubled by the time of its debut. The aardvark is a long-eared, long-nosed, hairless animal that is
, or active at night. In the wild, aardvarks live in Africa.
All trademarks and logos are property of Weekly Reader Corporation.
",2,WRLevel4,1,0.270759642124176,0.3969455659389496,0.2937788665294647,0.017499573528766632,0.021016309037804604
414,"The waters in the San Francisco Bay, off the California coast, are cold, choppy, and infested with sharks. But that didnt stop 9-year-old Johnny Wilson from braving the waves. The fourth grader swam the 1.4 miles between Alcatraz Island and San Francisco in just less than two hours. He swam to raise money for Hurricane Katrina victims.
Although Johnny trained for three months, the water was colder and wavier than he had expected. Johnny made it to the shore by telling himself, ""Im almost there. Im almost there.""
His classmates were waiting on shore, cheering ""Go, Johnny! Go, Johnny!"" When he came out of the chilly water, his father hugged him and said, ""Can you believe it? You did it!""
Johnny successfully made the trek that Alcatraz prisoners had dared to cross years ago. Alcatraz Island housed a prison from 1934 to 1963. In 1962, three prisoners escaped by swimming across the bay. They were never heard from again, so it remains a mystery whether they made it through the frigid waters to land.
Johnny didnt only raise more than $30,000 for his swim. He also reportedly became the youngest person to swim the distance from Alcatraz to San Francisco.
measures published under license with MetaMetrics, Inc.
All trademarks and logos are property of Weekly Reader Corporation.
",2,WRLevel4,2,0.18952469527721405,0.34827443957328796,0.41832759976387024,0.0176237840205431,0.02624945156276226
795,"Experts scramble to keep this world-famous city from sinking.
Venice attracts millions of tourists each year for its beautiful art and architecture. People weave their way through the city on boats because there are no streets. A maze of long
or waterways, takes the place of roads. In fact, there are no cars or trucks in Venice.
Venice is located in northern Italy on the Adriatic Sea. The city was built on a series of small islands in a
or an area of shallow water. During some high tides, water floods the city. For hundreds of years, people have tried to keep water out of the city to save it from sinking. Now a group of scientists has introduced a bold plan to keep the city afloat. And it means adding more water!
Venice is sinking at a rate of 1.57 inches per year, according to scientists. The Italian government has proposed the building of floodgates to control the flow of the sea.
Scientists hope to turn the tide in favor of Venice. They want to pump huge amounts of water into the ground through sturdy pipes. Scientists expect the water will expand the sand underneath and prop up the city. They hope to test the project on a small area over the next few months.
In Venice, a maze of long canals takes the place of roads.
Scientists behind the plan say that the pipes will work along with the floodgates to help save the city. However, other scientists are not as convinced. They warn that the plan could cause parts of the city to crumble if the work isnt carried out in a careful way.
Everyone, however, agrees that saving the sinking city is important. ""If we let Venice fall into the sea, the world would lose tremendous part of [history],"" Melissa Conn of Save Venice, an organization dedicated to helping preserve the city, told reporters.
Venice in Italian means ""city of canals.""
About 1.6 million people live in Venice.
The most famous building in Venice is the Basilica of St. Mark, a church dedicated to the patron saint of the city.
measures published under license with MetaMetrics, Inc.
All trademarks and logos are property of Weekly Reader Corporation.
",2,WRLevel4,2,0.1082138940691948,0.28333184123039246,0.5539385080337524,0.02152828685939312,0.03298744559288025
15,"Car tires have been rolling through the news. The news is that experts believe Firestone tires have a
, or problem, that is causing the tires to burst. Bursting tires may have caused many car accidents.
As a result of the possible defect, 6.5 million Firestone tires are being taken off cars and thrown away. But what happens to old tires?
Each year, Americans throw away 276 million tires. About 70 percent of those tires are
, or made into other things. Many of those tires are shredded and pressed together to make surfaces for playgrounds. Kids could be playing on surfaces made from tires that your family threw away.
Even though most tires are recycled, many are piled up in huge mounds because the tires can't be recycled fast enough. Some experts say between 2 billion and 3 billion tires in the United States are waiting to be recycled.
All trademarks and logos are property of Weekly Reader Corporation.
",2,WRLevel4,1,0.22180594503879547,0.40439265966415405,0.3358692526817322,0.01605762541294098,0.02187461592257023
156,"talks to actor Elijah Wood about playing a penguin.
Penguins are back on the big screen! The new movie
hits theaters on November 17. Elijah Wood stars in the animated movie as a tap-dancing penguin. Wood began his acting career when he was 9. He is known for his role as Frodo in the
caught up with Wood to find out what its like to become a cartoon penguin.
Did you think your first animated movie role would be as a penguin?
[laughs] No, definitely not. Getting to meet and work with George Miller, who directed
was pretty amazing. Im a big fan of his films.
So your character, Mumble, is a penguin that can dance but cant sing?
It was an idea developed by George. Apparently, emperor penguins can recognize each other in a group based on their songs. Mumble is born without the ability to sing. In its place, he has an odd ability to dance.
Ultimately, at the end of the film, the larger penguin community is taught a lesson that having a difference is all right. Everybody feels as though they have to change to fit in sometimes. In school, theres a feeling [that] you have to conform. Its actually our differences that should make us strong.
What do you think of the finished
I love going to animated films, and this one is really unique. It became very musical. The animation is really beautiful.
All trademarks and logos are property of Weekly Reader Corporation.
",2,WRLevel4,1,0.3753742575645447,0.3865879476070404,0.19768542051315308,0.01712060160934925,0.02323177084326744
151,"or the NBA playoffs? The TV-Turnoff Network wants you to do just thatand imagine what you can do instead of watching TV.
As a result, the theme of TV-Turnoff Week is ""Imagine."" The celebration takes place from April 24 to April 30. During the weeklong event, TV-Turnoff officials hope to raise awareness about the harmful effects of too much television.
Each American watches, on average, more than four hours of television per day, according to RealVision and the TV-Turnoff Network. In fact, kids spend more time in front of the television (1,023 hours per year) than in school (900 hours per year)!
Experts say that too much time in front of the TV can have a negative effect on children. Kids dont do as well in school and dont get enough exercise to stay in shape.
Robert Kesten, executive director of the TV-Turnoff Network, hopes that kids will turn off the television and get involved with other interests. ""Turning off the television allows children to see the real world,"" Kesten told
""We think kids will be surprised with the new discoveries they will make if they choose to shut off the TV for a week.""
measures published under license with MetaMetrics, Inc.
All trademarks and logos are property of Weekly Reader Corporation.
",2,WRLevel4,2,0.14316177368164062,0.275735080242157,0.5199498534202576,0.021821776404976845,0.03933150693774223
515,"Where might you find out what the current temperature is at the South Pole? Where might you find out when 'N Sync will be coming to your town?
If you have access to a computer, you can log on to the Internet to find information and go to places without ever leaving home.
The Net also has some sites that aren't so nice. Many stories in the news lately have been about kids who have gotten into trouble because they weren't careful about using the Net.
The number of kids who use the Net has exploded in the past few years. According to studies by eMarketer, an Internet company that studies who uses the Net, the number of U.S. kids between ages 5 and 13 going online at home will grow from 11 million in 1999 to 22 million in 2003.
Not all kids are surfing the Internet safely. Many kids are giving out information that they shouldn't reveal on the Net, such as their real last names, addresses, and phone numbers. Some kids have online conversations with people who mean them harm or could get them into trouble.
According to the Federal Bureau of Investigation (FBI), you can have fun on the Net without putting yourself at risk if you stick to the following rules. The FBI says:
meet someone or have him or her visit you without your parents' permission.
your parents if you get an e-mail that makes you feel uncomfortable.
All trademarks and logos are property of Weekly Reader Corporation.
",2,WRLevel4,2,0.1753329038619995,0.2803477644920349,0.46634212136268616,0.02318134531378746,0.05479593202471733
663,"Why do some books make people angry?
How would you feel if your favorite book was yanked from library shelves? Beginning September 23, the American Library Association (ALA) observes Banned Books Week. When a book is banned, it is removed from a library or a school. Many people say that banning books goes against the First Amendment, which guarantees freedom of speech. People who challenge books often claim that they want to protect others from dangerous ideas. Weve piled up some well-known titles that have been challenged.
Should some books be banned? Why or why not? Write your opinion in a paragraph. Then hold a class debate for or against book banning.
All trademarks and logos are property of Weekly Reader Corporation.
",2,WRLevel4,0,0.3833092749118805,0.3584171235561371,0.21726082265377045,0.01814967580139637,0.022863058373332024
19,"The U.S. Supreme Court is the highest court in the United States. It has nine justices. They are appointed for life by the president and approved by the Senate.
The Supreme Court rules whether federal, state, and local governments are following the written laws of the U.S. Constitution.
The Supreme Court hears only certain cases. Once the Court rules on a case, the decision is final. All other courts in the United States must follow the Supreme Court's decision in similar cases. This helps make sure that all Americans receive equal justice.
All trademarks and logos are property of Weekly Reader Corporation.
",2,WRLevel4,0,0.3659849762916565,0.3403407037258148,0.25223487615585327,0.01714952290058136,0.024289924651384354
651,"Fall is here, and lots of boys and girls are hitting the football field. Playing football can be lots of fun, but it can also be dangerous. Kids need to play safely to make sure they have fun and do not get hurt.
Most kids who play football get minor bruises and scrapes. Some injure their knees and even break bones. Others get head concussions. But a 10-year-old girl died on September 2. Doctors said a football injury probably caused the fatality.
Taylor Davison, who lived in Illinois, liked to play football. She was the only girl who played in a football league of 400 players.
Taylor played full-contact football. During a practice in August, she complained of a headache and fell down. Three days later, she died. Doctors said she died as a result of a severe blow to the head, possibly caused by a tackle.
Doctors do not know how many child athletes are injured on the playing field each year. ""There is a serious lack of data about what types of injuries are occurring, said Dr. Reginald Washington, a doctor of sports medicine.
Although not enough is known about sports-related injuries among children, Washington and other doctors say kids and coaches can follow certain safety tips. Researchers at the University of Pittsburgh give this advice:
Coaches should receive first-aid training. They should also be trained to recognize whether a child athlete has a severe head injury.
Leagues should have rules that require kids to take time off from playing after they have suffered an injury-especially a head injury.
To make sure they are safe, kids should always wear the proper safety equipment when playing any sport.
measures published under license with MetaMetrics, Inc.
All trademarks and logos are property of Weekly Reader Corporation.
",2,WRLevel4,2,0.11894034594297409,0.22061635553836823,0.5866414904594421,0.024745982140302658,0.049055758863687515
339,"Some experts question rewarding reading with pizza.
Everyone loves pizza, but should it be used as a reward for reading?
Should kids be reading for pizza? A nationwide reading program is drawing criticism for putting pizza front and center. Since 1985, the restaurant chain Pizza Hut has been running the Book It program, which rewards students for reading with personal pan pizzas. Now some people are taking a slice at Book It. They say the program promotes poor eating habits and gives Pizza Hut free advertising in public schools.
""It's clear that Pizza Hut's Book It has no place in public schools. ... It promotes junk food,"" says Susan Linn, a cofounder of the Campaign for a Commercial-Free Childhood. The group has called for schools to stop participating in the Book It program.
Nearly 22 million children in 50,000 U.S. schools take part in Book It. Since the program began, more than 200 million pizzas have been given away. Each year, from October 1 through March 31, students read books to meet monthly reading goals set by teachers. When students meet their goal for the month, they get a certificate for a personal pan pizza.
""We're really proud of the program,"" says Leslie Tubbs, the director of Book It. ""We get hundreds of e-mails from [past participants] who praise it and say it helped them get started with reading."" In 1988, President Ronald Reagan honored the program for promoting
But critics say schools can teach students to enjoy reading without the help of a fast-food company. ""Schools need to realize that they are undermining their students' well-being,"" says nutrition expert Jane Levine. She explains that the Book It program is a problem not just because it rewards kids with fast food but also because it makes a large company a regular part of the school day.
All trademarks and logos are property of Weekly Reader Corporation.
",2,WRLevel4,2,0.09437794983386993,0.21205051243305206,0.6084661483764648,0.024398602545261383,0.06070670858025551
566,"This map might not lead to a pot of gold, but officials at the Library of Congress consider it very valuable. The Library of Congress recently paid $10 million for the first map to name America. Printed in 1507, the map is the only copy of its kind left in the world.
Officials said the map is the most expensive item that the library has ever purchased. The library raised most of the money from Congress and other groups.
America was named after Amerigo Vespucci, an Italian explorer. The map showing America was kept in a castle in Germany for 350 years and was rediscovered in 1901.
For the last century, U.S. officials have been trying to buy the map. It has been called the ""crown jewel"" of the library's map collection.
All trademarks and logos are property of Weekly Reader Corporation.
",2,WRLevel4,2,0.1906260848045349,0.3791726529598236,0.38416746258735657,0.017895951867103577,0.02813791297376156
789,"Richard Rodriguez recently set a new world's record for riding a roller coaster. He rode a coaster for 2,000 bone-rattling hours. That's about 22,655 miles.
To set the record, Rodriguez (front) rode a roller coaster at Blackpool Pleasure Beach, an amusement park in England, for 22 hours a day for 90 days. After setting the record, Rodriguez said, ""It was a small step for me, but a giant roller coaster ride for mankind.""
Setting records for riding roller coasters isn't new to Rodriguez. He set his first record in 1977, when he rode a coaster for 103 hours and 55 minutes. He has broken that record many times in the last 23 years.
All trademarks and logos are property of Weekly Reader Corporation.
",2,WRLevel4,1,0.22407063841819763,0.42035698890686035,0.31706851720809937,0.016368595883250237,0.022135259583592415
111,"Tsunemi Kubodera stands before a giant squid on Display at National Science Museum in Tokyo.
A team of Japanese scientists snapped the first photographs of one of the deep sea's most mysterious creaturesa giant squid. It was the first time a giant squid was photographed in the wild! The researchers took more than 500 pictures of the sea creature off the coast of the Bonin Islands in Japan.
How did scientists nab pictures of the 26-foot-long sea monster? They tracked down the squid by following the only creatures that feed on itsperm whales. Once they determined where the whales dined, the scientists attached a robotic camera to a fishing line with bait. Then they took pictures of the purplish-red squid attacking its prey nearly 3,000 feet beneath the ocean's surface. The squid became caught on the camera but eventually swam away after one of its tentacles broke off. Squid have eight arms, two tentacles, and two huge eyes that can each grow to the size of a volleyball!
All trademarks and logos are property of Weekly Reader Corporation.
",2,WRLevel4,1,0.2414930909872055,0.422087699174881,0.29899701476097107,0.01736702211201191,0.020055141299962997
430,"told you that kids are not getting enough sleep. Now a new report shows that kids are not alone.
About two-thirds of U.S. adults say that they do not get eight hours of sleep a night, according to the 2001 Sleep in America Poll by the National Sleep Foundation (NSF). Those adults also said that they often are not fully awake when they drive and that they find it hard to stay awake while at work. According to the report, more than half of adults drive while drowsy, and nearly two out of ten say they have fallen asleep at the wheel.
""There is an epidemic of sleepiness in our society,"" said James Walsh, vice president of the NSF. ""People may be getting sleep, but it is at school, at work, and behind the wheel.""
measures published under license with MetaMetrics, Inc.
All trademarks and logos are property of Weekly Reader Corporation.
",2,WRLevel4,2,0.15158380568027496,0.3330490291118622,0.4697999656200409,0.018788710236549377,0.026778409257531166
