Index,Text,Grade,Type,bert.2.pred,bert.2.prob.1,bert.2.prob.2,bert.2.prob.3,bert.2.prob.4,bert.2.prob.5
177,"Sometimes a force is produced as a
A book on a table has a downwards force (its
This downwards force, pushing on the table, produces an upwards force called
The weight and the reaction of the surface are the same size, and in opposite directions.
an interaction pair, because the weight of the book is caused by the
Put down that pen and listen to some additional Science audio.


",4,BitGCSE,4,0.01598578318953514,0.010287259705364704,0.015915459021925926,0.26650717854499817,0.6913043856620789
41,"An electronics product can be thought of as a
with inputs, processes and outputs. The most common method of manufacturing electronic products is the batch method - though one-off production and continuous-flow production are also important.
ICT is used extensively in electronics manufacturing. The use of machines that are controlled by computers is called computer-aided manufacture or CAM.
Electronics systems diagrams are used to show how the parts of a product work together. Many electronic products are made up of a number of standard system circuits (circuits that are common to many different products), such as sensors, amplifiers, timers, counters and output devices.
System diagrams usually take the form of a
in which each part of the electronic system is represented by an input, a process or an output.
The block diagrams below shows two types of system.
has no feedback mechanism, so the accuracy depends on how well the system was set up before hand.
electronic systems use sensors to provide feedback. This means that if the output is not satisfactory, the inputs or processes can be altered.
Post ideas and discuss Design and Technology here.
Give your revision some visual style with a Bitesize revision map!


",4,BitGCSE,4,0.026394398882985115,0.024604519829154015,0.03979148343205452,0.08178187161684036,0.8274277448654175
5953,"Download (click), print and complete an exam paper.
Now download (click) the corresponding marking scheme.
: If you cannot open the exam paper/marking scheme, download Adobe Reader (free). For more information and help, visit
: GCSE Bitesize is not a real exam board. We cannot guarantee the grade you achieve will accurately reflect your mark in the real exam.
Use your maths knowledge to climb the career ladder!


",4,BitGCSE,4,0.04011717811226845,0.03600121662020683,0.05499083548784256,0.13323643803596497,0.735654354095459
2534,"Sikhs believe that wealth is only acceptable if it is used for other people such as giving them work or food. It is the responsibility of the rich to look after the poor.
Blessed is the godly person and the riches they possess because they can be used for charitable purposes and to give happiness.
A place in Gods court can only be attained if we do service to others in this world.
is a very important part of Sikh teachings because equality and
A deep human emotion prompted by the pain and suffering of others.
are essential for a spiritual life. All religions and all nations must be helped to live a good and peaceful life.
is also essential for a Sikh - begging or not working is lazy and selfish.
Charity begins with caring for the family. Sikhs have followed this teaching in their social policies, building hospitals, care homes, special schools and hospices. Many Sikhs also take part in charity work all over the world; they are involved in
) is essential to the life of a Sikh. They should be prepared to give up some of their time and energy to help others. For a Sikh it is a privilege and a duty to provide
(Sikh place of worship) for the whole congregation after the weekly service of worship. The
is part of the act of worship and a very fundamental aspect of Sikh life.
(the first Guru) wanted everyone to be able to eat the same food in the
, to share the tasks of preparation, cooking, serving and cleaning.
Post ideas and discuss Religious Studies here.
Get some direction with a Bitesize revision map
Understand the beliefs of others and develop your own opinion.


",4,BitGCSE,4,0.039101824164390564,0.04131265729665756,0.05672401934862137,0.07852598279714584,0.7843354940414429
7184,"among the working class population. The electoral system was corrupt and unrepresentative, and the poor had to endure harsh working conditions with low pay. In response to these problems a movement called Chartism developed.
Who were the Chartists and what did they want?
The poor - these women wait to enter the workhouse
By 1830, working-class people in Britain were unhappy. There was a
between the rich and the poor. People had been demanding change since the end of the French Wars. Their working conditions were bad and wages were low. Poor people often had to choose between starvation or the shame of entering the
A place where the poor and homeless would be given shelter in exchange for work.
in 1830, so they had no control over the MPs making laws that could improve their lives. Even when people did vote,
The rich - these women socialise at a ball
The system of parliamentary elections that existed before 1832 was corrupt.
and represented towns and boroughs that they controlled. Working-class people took bribes, worked for and often lived in houses owned by their MP. The voting process took place publicly and
there were too many constituencies in rural areas
By 1832, people from the middle and working classes had started to
in most of the major industrial areas. MPs became scared that a revolution might occur in Britain and that the working class would execute the nobility. People in Britain desperately needed
and saw political power as a way to achieve this.
By 1830, the British government was worried that a revolution would take place in Britain, so it passed the
. The act gave one in five men who owned property and earned more than 10 the vote. It also gave MPs to new industrial towns such as Birmingham and removed MPs from rotten boroughs. There was a mixed reaction to the new political changes.
The middle class was happy about the changes, but the working class could not vote. Elections were still corrupt and the country was still run by the rich. In 1838, a group of working-class men formed the
with the aim of making changes to the voting system by publishing the
. People supporting the demands were called
The Six Points of the People's Charter
for every man over 21 years of age.
MPs do not have to own property.
- only 700,000 extra people got the vote.
- the 1833 Factory Act failed to achieve the 10-hour day and many workers were annoyed.
Bitterness towards the 1834 Poor Law Amendment Act
- unemployed men were treated harshly by the act; poverty became a crime; New Union Workhouses were being built and; trade depression and high unemployment left many believing that Chartism was the only answer.
- trade unions existed, but they had limited power. Working-class people thought Chartism appeared more effective.
- the years 1838-1848 were years of high unemployment and left people looking for an answer, so Chartism became popular.
Use the information in this Revision Bite to create a spider diagram explaining why people in Britain were so upset during the 1830s; why most political movements in Britain only began during times when people were unhappy and; how living and working conditions allowed Chartism to develop in 1838.
As part of your revision, think about the
the British political system was like during the 1830s.
the government passed the 1832 Reform Act.
the working class felt about the 1832 Reform Act.
",4,BitGCSE,4,0.03989759460091591,0.04028226435184479,0.08128844946622849,0.04757063463330269,0.790960967540741
4272,"Listen to the voices in your head and revise English audio.


",4,BitGCSE,4,0.024104982614517212,0.0205658171325922,0.032490964978933334,0.1563413143157959,0.7664968967437744
6002,"There are already ways in which we can reduce the air pollution caused by the burning of fuels, and others may be developed in the future. New applications that result from scientific research are subject to official regulations and laws.
Coal is an example of a fossil fuel
The fossil fuels include coal, natural gas and the products from the fractional distillation of crude oil, such as petrol and diesel. When any fossil fuel is burned, one of the combustion products is carbon dioxide.
amounts of fossil fuels have been burned each year. This has led to an increase in the percentage of carbon dioxide in the air. Many scientists believe this is causing
Global warming refers to the rise in the average temperature of the Earth's surface. In the last 100 years it is believed to have risen by 0.6 degrees C. There are estimates that in the next 100 years, the global temperatures could rise by as much as 1.4 to 5.8 degrees C.
One way to reduce the amount of carbon dioxide in the air is to burn
fossil fuels. Unfortunately, we depend on the burning of fossil fuels for heating, electricity generation and transport. If we are to burn less fossil fuels, we will need alternatives for these essential activities.
Clouds of smoke and other combustion products are emitted from chimneys
Fossil fuels, such as coal, gas and oil, are mined from the earth. They are formed from broken down animals and plants that died a very long time ago. Fossil fuels are burnt to produce energy. Often they are used to create electricity. As they can only be used once, these are called finite fuels.
to produce electricity are one of the main contributors of carbon dioxide in the air.
One way to reduce the air pollution caused by power stations is to
. Some ways to do this are:
turning off lights when you leave a room
using a microwave instead of an electric oven
from 2006 about saving energy in the home.
Power stations give out sulfur dioxide which is a cause of
Acid rain is rain that contains a high level of acids. These acids can contaminate drinking water, damage plants and water creatures and buildings. It is believed to be caused by pollution and, maybe, natural activity such as volcanic eruptions.
. The amount of sulfur dioxide given off by a power station can be reduced by:
removing sulfur from natural gas and fuel oil
removing sulfur dioxide from the flue gases emitted by coal-burning power stations
Coal-powered stations give off solid particulates. These can also be removed from the flue gases.
Atmospheric pollution caused by the exhaust gases given out by motor vehicles can be reduced by:
Exhaust gases given out by motor vehicles causes atmospheric pollution
burning less fuel by having more efficient engines
using catalytic converters, which convert nitrogen monoxide to nitrogen and oxygen, and carbon monoxide to carbon dioxide
adjusting the balance between public and private transport, with more people using buses and trains instead of cars
setting legal limits on exhaust emissions which are enforced through MOT tests
",4,BitGCSE,4,0.03518538922071457,0.03540205955505371,0.06612581014633179,0.047679353505373,0.8156073689460754
5973,"William Blake: The Little Boy Lost / The Little Boy Found
is about a boy walking with his father through marshy land at night. He becomes separated from his father and is obviously in danger. Even the
that might have provided him with some light disappears, so he is left alone in total darkness.
is about the finding of the lost boy, who has been following a 'wandr'ing light'. God appears and leads him back to his mother, who has been searching for him. Strangely, she was searching for him in the dale, not the fen. This could be interpreted as meaning she was in the wrong place and would not have found him without God's help.
Back to William Blake: The Little Boy Lost / The Little Boy Found index
Read the full text online and make your own notes.
Get creative, get published and get expert writing advice at BBC Blast.


",4,BitGCSE,4,0.029567908495664597,0.030969617888331413,0.04611760377883911,0.08102217316627502,0.8123226761817932
2848,"Warnings such as 'Smoking can cause a slow and painful death' are used to deter people from smoking
About 114,000 people die every year as a result of smoking-related illnesses. All cigarettes sold now carry a prominent health warning.
Smoking during pregnancy is very dangerous. It reduces the amount of oxygen available to the growing foetus. This leads to an increased risk of
Cigarettes contain about 4,000 different chemicals, many of which are harmful to the body.
Nicotine is the addictive substance in tobacco smoke. It reaches the brain within 20 seconds and creates a dependency so that smokers become addicted.
the red protein found in red blood cells that transports oxygen round the body
reduces the ability of the blood to carry oxygen
. This puts extra strain on the circulatory system, and can cause an increased risk of heart disease and strokes.
. Tobacco smoke contains many carcinogens, including tar. Smoking increases the risk of lung cancer, mouth cancer and throat cancer.
The images above compare a healthy lung to a smokers lung. Tar deposits can be seen clearly in the smokers lung.
Losing your way? Make a Bitesize revision map!


",4,BitGCSE,4,0.02338036522269249,0.0260548684746027,0.049419891089200974,0.06315328925848007,0.8379916548728943
5230,"Blues began as songs sung by black slaves in the mid-19th century southern United States, taking elements from African, European and American folk music.
developed from the Blues in the early 20th century, again in the southern US.
Blues songs were so called because of their often sombre content, reflecting the unhappiness of slaves' lives. They became a national craze in 1920s America.
Jazz was first developed around 1902 in the red light district of New Orleans, by the cornet player Buddy Bolden and other musicians.
Blues and Jazz were both the result of a rich mix of other musical traditions, including:
- work songs - in which phrases from a lead singer are answered by the others.
- very popular in America. (The composer
, and invented a special bass instrument for marching called the 'sousaphone'.)
A combination of notes played at the same time to create a chord.
. Black slaves' religious ceremonies were often performed in places where there weren't any instruments, so the congregation sung
) - a piano style made famous by
. Ragtime used a steady, march-like bass part and a
To alter a rhythm by accenting a weak beat.
right hand. Ragtime composers wrote out the music in full and the performer was not expected to improvise at all.
Get some direction with a Bitesize revision map
Find out more about making music and send us your performances.


",4,BitGCSE,4,0.02945171296596527,0.028630081564188004,0.05306929722428322,0.07627653330564499,0.8125723600387573
1546,"What is it? How do you know?
What type of publication do you think text 2 is? A comic? A newspaper? A magazine? A web page? A business document?
This one isn't so easy, so let's rule some things out...
: No. Comics are generally brightly coloured and full of cartoons. This isnt!
: No. Newspapers generally use narrow columns, black and white print and the pages are very full when you look at them.
: No. There are no giveaway clues such as 'click here', 'contact us', 'print this page' - so it cant be a web page.
: No. In a magazine, one would expect to see more writing and pictures on each page. This layout is too spacious.
: You are pretty close - text 2 comes from the Environment Agency. This is from the booklet the organisation would give to members of the public if they asked for information about what the Government is doing to protect and improve the environment.
Give your revision some visual style with a Bitesize revision map!
Get creative, get published and get expert writing advice at BBC Blast.
North East Wales Institute of Higher Education English Resources


",4,BitGCSE,4,0.03746074438095093,0.03998095914721489,0.06139082461595535,0.07712571322917938,0.7840417623519897
1622,"Climate means the average weather conditions in a particular location. The climate in a particular part of the world will influence its vegetation and wildlife. Global climate zones with similar
Flora refers to all the different types of plant species that live in a specific area.
describes the condition of the atmosphere. It might be sunny, hot, windy or cloudy, raining or snowing.
Temperature is how hot or cold something is, for example the atmosphere or the sea. Use a thermometer to see how many degrees Celsius/centigrade it is above or below freezing point (0 degrees C) .
Precipitation is the term given to moisture that falls from the air to the ground. In the UK, the most common form of precipitation is rain, but snow, hail, sleet, drizzle, fog, and mist are also precipitation.
Humidity is the amount of water vapour in the atmosphere. Air can only hold a certain amount of water before condensation and precipitation occurs. Humidity is measured as a percentage, relative to the saturation point where the air can hold no more water vapour (ie 100 % humidity).
Atmospheric pressure is the weight of air resting on the Earth's surface. Pressure is shown on a weather map with lines called isobars. Low pressure occurs when air is warm and rises. High pressure occurs when air becomes colder and sinks.
of the part of atmosphere (air) closest to the surface of the earth.
The weather is constantly changing as temperature and humidity change in the atmosphere. Landmasses, such as the British Isles, experience constantly changing weather conditions.
is the average weather conditions - temperature, pressure, precipitation and humidity - expected for a certain place. Climate is based on the average weather experienced over 30 years or more.
Climate refers to what is expected to happen in the atmosphere rather than the actual conditions. It is possible for the weather to be different from that suggested by the climate.
Climatic conditions in an area can be affected by the landscape, relief and activities taking place (both human and natural). Climate can alter over time and space.
Within a climatic region, the climate may vary from place to place - eg the top of a hill, the sunny side of a hill, the shaded side of a hill and the bottom of a hill. These areas with their small variations are called
The science of monitoring and studying the atmosphere and predicting its weather and climate is called
. People who study the weather and climate are known as meteorologists.
Deliver key Geographic sound bites direct to your ear!
Understanding the weather - from sunstroke to snowstorms!


",4,BitGCSE,4,0.024295449256896973,0.021620193496346474,0.033699244260787964,0.0729866549372673,0.8473985195159912
1945,"How information is passed through the nervous system
How information is passed through the nervous system
Neurons carry electrical signals, and are connected by synapses.
Neurons carry signals from one place to another, around the many parts of the nervous system. They connect sense receptors to the central nervous system and also connect one part of the nervous system to another, for example in the brain and spine. They also
from the nervous system to effector organs, such as muscles and glands.
When neurons are stimulated they transmit an
The diagram below shows a motor neuron. It has a
The central part of an atom. It contains protons and neutrons, and has most of the mass of the atom.
The living substance inside a cell (not including the nucleus).
. The cytoplasm forms a long fibre that is surrounded by a cell
. The axon carries the electrical impulse and is protected by a fatty sheath - a bit like the plastic coating around an electrical wire. The fatty sheath increases the speed at which the nerve impulse is transmitted. The nerve ending is branched to make good contact with other neurons or the effector organ.
Two neurons do not make direct contact. Where they meet, there is a very small gap called a
a tiny gap at the junction between two nerve cells which nerve signals must cross
. The signal needs to cross this gap to continue on its journey to, or from, the
Central Nervous System (brain and spinal cord).
. This is done by means of chemicals which
across the gap between the two neurons.
Read on if you are taking the
Put down that pen and listen to some additional Science audio.


",4,BitGCSE,4,0.024358754977583885,0.022748876363039017,0.03035731241106987,0.13085728883743286,0.7916777729988098
5869,"Jane is excited about returning to Thornfield and Mr Rochester, even though she believes he is married to Blanche Ingram. It is obvious when they meet that Rochester is delighted to see her, too.
What follows is ""a fortnight of dubious calm"", in which Jane expects to hear about the marriage but nothing is said.
On midsummer eve, Jane goes into the garden after Adele has gone to bed. She finds Mr Rochester there. The scene is described in extraordinary detail, as it moves to his proposal.
He is perhaps teasing or testing Jane as he talks of her having to move on, claiming to have found her a new position in Ireland. Eventually, however, he proposes, revealing that any chance of a relationship with Blanche ended when he pretended to have less money than she considered acceptable.
Rochester talks frequently of what he is doing as being wrong, but claims his love and care for Jane will atone for it. As readers, we think there could be something sinister behind this. However, Jane does not pick up on more than his emotion as they go into the house.
Jane is blissfully happy, but still aware that Mrs Fairfax seems shocked. So she asks Mr Rochester to speak to her the following day. Her congratulations, when they come, seem very subdued, fuelling our suspicions.
Jane decides she will not abandon her previous path. She refuses expensive gifts and spends a lot of time with Adele. Mr Rochester is eager to be with her, but allows her to dictate terms in this way in the four weeks leading up to the wedding.
Then we hear of a very bizarre episode. Mr Rochester has had to go away. When he returns, Jane describes having been woken by someone in her room. She describes the woman in hideous terms, and explains that her wedding veil was ripped in two, so it could not have been a dream. Mr Rochester encourages her to continue to blame Grace, and insists she shares Adele's room the night before the wedding.
The wedding morning arrives. Mr Rochester is possessed by tension and a desire that everything should be done quickly. Even Jane is encouraged to hurry.
There are no family present at the wedding. Perhaps for this reason, Jane notices two men, apparently waiting for the ceremony, enter the church before them.
When the priest asks if there is any impediment to the marriage, one of the men, Mr Briggs - a lawyer - explains that Rochester is already married to the sister of Mr Mason, who comes forward at this point.
Clearly, there can be no marriage. Mr Rochester takes them back to Thornfield to see his wife, Bertha, a dangerous lunatic, and Grace, her keeper. Bertha attacks Mr Rochester, but he is able to restrain her. Even though
The crime of marrying one person while still being married to another.
is a serious crime, it becomes easy to understand what drove him.
Before Briggs and Mason depart, we learn that it was a chance connection between Jane's uncle in Madeira and Mr Mason that brought Briggs and Mason to stop the marriage. We also learn that Jane's uncle is on his death-bed.
Jane spends a long time numb with shock at what has happened. She eventually meets with Mr Rochester and he tries everything in his power to keep her with him. He explains how he was trapped by his family into the marriage, and how he spent time in Europe seeking, in vain, some kind of escape.
He asks Jane to come away with him, but she is controlled by conscience and cannot allow herself to be loved by a married man. She knows she cannot stay with him and keep her resolution, so says she will leave.
Read the full text online and make your own notes.
Get creative, get published and get expert writing advice at BBC Blast.


",4,BitGCSE,4,0.05913598835468292,0.07325239479541779,0.12900474667549133,0.1036510020494461,0.634955883026123
865,"The three main causes of population change are:
- usually measured using the birth rate (number of live births per 1000 of the population).
- usually measured using the death rate (number of deaths per 1000 of the population) .
- the movement of people in and out of an area.
of population change. The difference between the birth rate and the death rate of a country or place is called the
. The natural increase is calculated by subtracting the death rate from the birth rate.
natural increase = birth rate - death rate
The rate of natural increase is given as a percentage, calculated by dividing the natural increase by 10.
For example if the birth rate is 14 per 1000 population, and the death rate is 8 per 1000 population, then the growth rate = 14 - 8 = 6
Deliver key Geographic sound bites direct to your ear!
News, issues and opinions from all around the UK.


",4,BitGCSE,4,0.03251722827553749,0.028349900618195534,0.04226265475153923,0.1108873188495636,0.7859828472137451
