Index,Text,Grade,Type,bert.2.pred,bert.2.prob.1,bert.2.prob.2,bert.2.prob.3,bert.2.prob.4,bert.2.prob.5
28,"Utterson represents the standards of conventional society and the law. Like Lanyon, he does not have the imagination to understand what Jekyll is doing.
That is why Jekyll cannot confide in him about what is happening, even though they are old friends. It is also why, throughout the novel, Stevenson makes Utterson come to all the wrong conclusions. The law blinds him to the truth. It is because Utterson is a lawyer that he constantly suspects Hyde is blackmailing Jekyll or has some other criminal purpose.
The ultimate failure of Utterson (and therefore the law) is built into the
The way a text is built and shaped. Chapters, plot, acts and scenes, stanzas, narrative, verse-form, rhyme and rhythm - all these (and many more) are aspects of structure.
of the novel. At the end of Chapter 8,
, Utterson promises the servant, Poole: ""I shall be back before midnight, when we shall send for the police."" But neither he nor the police (the other arm of the law) are heard of again. Their silence is like the death of Lanyon; they have no power to deal with the unexplained that Jekyll has unleashed.
Back to Dr Jekyll and Mr Hyde index
Read the full text online and make your own notes.
Get creative, get published and get expert writing advice at BBC Blast.


",4,BitGCSE,4,0.038787052035331726,0.0404263436794281,0.06759245693683624,0.14012329280376434,0.713070809841156
3890,"information without context, eg a list of students with numbers beside their names is data, when it's made clear that those numbers represent their placing in a 100 metre race, the data becomes information
safe. Many individuals, small businesses and major companies rely heavily on their computer systems.
If the data on these computer systems is damaged, lost, or stolen, it can lead to disaster.
When an application or operating system no longer responds. Crashes can be caused by software and hardware.
a device used to store vast amounts of data, the data is stored on a disk
corrupted as a result of faulty disks, disk drives, or power failures
lost by accidentally deleting or overwriting files
a small program written to cause harm to a computer
if a computer has been hacked, someone has gained unauthorised access to it
into by unauthorised users and deleted or altered
destroyed by natural disasters, acts of terrorism, or war
deleted or altered by employees wishing to make money or take revenge on their employer
Back to Data, information and databases index
Post ideas and discuss ICT and DiDA here.
ICT Dictionaries and Encyclopaedias - Webopedia: Online Computer Dictionary for Internet Terms


",4,BitGCSE,4,0.05475683882832527,0.04914546012878418,0.09886451810598373,0.08043625205755234,0.7167969346046448
4881,"Victor has a very happy childhood, brought up by a wealthy and caring family in Geneva, Switzerland. He adores, and is adored by, his foster sister, Elizabeth, and has another great friend in Henry Clerval.
However, tragedy strikes when his mother dies of fever just before he leaves to study at the University of Ingolstadt. His father insists he should still go, and while at university Victor's earlier interest in science becomes an obsession - in particular, he wants to discover the secret of life itself.
Read the full text online and make your own notes.
Get creative, get published and get expert writing advice at BBC Blast.


",4,BitGCSE,4,0.038133639842271805,0.036219771951436996,0.05764608457684517,0.16609391570091248,0.7019066214561462
5139,"Most tasks allow you to write or talk about how language is used in the play. So imagine your title is: 'How does Beatrice change during the course of
?' There are all sorts of references you can make to language:
When we first meet Beatrice, she seems to be a clever, independent woman. She speaks openly, not waiting to be asked, and seems to like making fun of Benedick in particular. She compares him with ""a disease"", and her repartee makes even the messenger afraid of her. Throughout the play she uses puns, such as saying Claudio is ""civil as an orange"". This shows her witty nature, because she plays on the similarity between ""civil"" and ""Seville"": he is either polite or bitter (just like the oranges from Seville).
This combines much of what we have covered so far. It starts to answer the question without filling up the page with irrelevant facts, plot details and fancy technical terms. Remember, you do not have to tick off the language terms like a trainspotter. Instead, show you appreciate some of the techniques Shakespeare used, and the effects they have on his audience.
Back to Much Ado About Nothing index
Read the full text online and make your own notes.
Get creative, get published and get expert writing advice at BBC Blast.


",4,BitGCSE,4,0.029866347089409828,0.030177270993590355,0.05260733887553215,0.15045684576034546,0.7368921637535095
2234,"All animals and plants are made of cells. Animal cells and plant cells have features in common, such as a nucleus, cytoplasm, cell membrane, mitochondria and ribosomes. Plant cells also have a cell wall, and often have chloroplasts and a permanent vacuole. Note that cells may be specialised to carry out a particular function.
Dissolved substances pass into and out of cells by diffusion. Water passes into and out of cells by osmosis.
Function of cells which animal and plant cells have in common
contains genetic material, which controls the activities of the cell
most chemical processes take place here, controlled by enzymes
controls the movement of substances into and out of the cell
most energy is released by respiration here
contain chlorophyll, which absorbs light energy for photosynthesis
filled with cell sap to help keep the cell
having turgor; enlarged and swollen with water
Make sure you can label diagrams of animal and plant cells, like these:
Get some direction with a Bitesize revision map


",4,BitGCSE,4,0.04326087608933449,0.03791997581720352,0.06870847195386887,0.10192488133907318,0.7481857538223267
5428,"You need to go to the exam with strategies that will help you work well under pressure. Here are some suggestions:
You are usually given 5 minutes to read through the paper before the tape starts. Use this to your advantage by looking right through the paper so see what kind of tasks there are.
Look closely! Should you listen for precise information (like train arrival and departure times)? Or should you be listening to the whole passage, in order to draw a conclusion (for example, name the girl who has the best relationship with her parents)?
As you read the question, try to predict the sort of information that may be in the passage. It will help focus your mind.
Look at the title of the question or section very carefully. Make sure you understand
to give your answer. If there is an example, look closely at the answer given - it will show you whether you need to write a single letter, a single word, or more than one word.
Have a good look at any illustrations. They could give important clues as to what is coming.
word - there is probably a lot of 'redundant' language you don't need. Be positive. Concentrate on what you do understand. Sometimes the passage can be difficult, but the questions are easy.
Use your knowledge of grammar. For example, it may be important to know whether someone is talking about the past, the present, or the future.
Use your knowledge of Spanish-speaking countries. For example, if you hear someone was on holiday in Madrid, it is unlikely they spent time on the beach.
Don't just listen to the words. The tone of someone's voice may also be helpful - for example in telling you if they are making a statement or asking a question.
If you have to write answers in Spanish, remember you will not be penalised for minor spelling mistakes.
Don't just read it, practise your Spanish with downloadable audio bites.
Get some direction with a Bitesize revision map
Real Spanish, real drama from BBC languages.


",4,BitGCSE,4,0.026365896686911583,0.023978689685463905,0.03671968728303909,0.18708902597427368,0.7258467674255371
177,"Sometimes a force is produced as a
A book on a table has a downwards force (its
This downwards force, pushing on the table, produces an upwards force called
The weight and the reaction of the surface are the same size, and in opposite directions.
an interaction pair, because the weight of the book is caused by the
Put down that pen and listen to some additional Science audio.


",4,BitGCSE,4,0.03414866328239441,0.026939844712615013,0.04599148780107498,0.23605892062187195,0.6568610072135925
2503,"If tourism is to be sustainable then the impacts on local people, the economy and the environment need to be balanced. To achieve this there needs to be cooperation between different interest groups. In The Lake District, this includes:
The National Trust (who own a proportion of the land).
Possible strategies to achieve sustainable tourism could be:
Restricting the number of cars and visitors  although this would have an impact on income from tourism.
Fundraising to repair damage done to the natural environment and footpaths  but who should pay?
Education of local people and tourists about sustainable tourism  but who will pay for this?
Underpinning any sustainable strategy is the successful involvement of the local people. With their cooperation, positive outcomes are far more likely.
Back to Glacial landscapes and processes index
Deliver key Geographic sound bites direct to your ear!
News, issues and opinions from all around the UK.


",4,BitGCSE,4,0.055618591606616974,0.05713040754199028,0.09070955961942673,0.12371829897165298,0.6728231310844421
6661,"This Revision Bite will give you practice in creating and structuring a presentation about a famous person in five key sections: introduction, past, present, future and concluding opinion.
In your presentation exam you should speak for about one minute in Irish on a topic you have prepared, then you will be asked questions in Irish about what you have said. You are usually allowed to take a prompt card into the exam with you with five brief points on it and as many pictures as you like, to help you remember what to say.
A good way to structure your presentation so you include a variety of tenses plus an opinion is to start with
('tomorrow' - the future), before finishing off with
For his presentation Samus has written five paragraphs about Peter Canavan, but the order of the paragraphs has been jumbled up. Can you work out which paragraph is the introduction, which is about Peter Canavan's past, present and future, and which is the concluding opinion? It will help you to look out for uses of different tenses.
Is minteoir scoile  fosta ach n bheidh s ag obair sa scoil i mbliana. Beidh s ag obair leis an pheil i mbliana. Deir daoine nach mbeidh s ag imirt peile ar an bhliain seo chugainn. Nl s iontach g agus sleann daoine go bhfuil s measartha aosta anois. Is fidir go n-ireoidh s as an pheil mar go bhfuil s aosta.
Is as Tr Eoghain m agus is bre liom Peadar  Ceannabhin. Beidh s ag imirt ar fhoireann Thr Eoghain ars i mbliana agus bainfidh s Sam Maguire ars fosta. Tr Eoghain Ab!
Is peileadir iontach maith  agus t suim mhr aige sa pheil Ghaelach. T s sciliil agus dograiseach. Bonn s ag traenil go minic - gach l agus gach oche. Is duine cainteach cairdiil  fosta.. Imronn s peil le foireann Earagail Chiarin agus le Tr Eoghain.
T suim mhr agam sa sprt agus is bre liom sacar agus galf. Is fearr liom peil Ghaelach, fach, agus beidh m ag caint ar imreoir peile sa chur i lthair seo. Imronn Peadar  Ceannabhin ar fhoireann Thr Eoghain. Is fear beag  ach t s iontach lidir. T s ina chna i gContae Thr Eoghain agus t s psta.
Bhain Tr Eoghain Sam Maguire den chad uair anuraidh. Bh Peadar  Ceannabhin ag imirt ach bh s gortaithe fosta. D'imir s in adan Ard Mhacha sa chluiche ceannais i bPirc an Chrcaigh. Bh s mar chaptaen ar an fhoireann.
You could summarise the presentation under the following five headings:
- sport and especially Gaelic football; favourite player (Peter Canavan); description (age, appearance, home, marital status, children, etc.).
- All-Ireland Final last year against Armagh; Tyrone won and Peter was captain; how he played and what he scored; Sam Maguire and celebrations.
- very fit and he loves Gaelic football; Errigal Ciaran and Tyrone; very good footballer - skillful and dedicated; training every day.
- P.E. teacher in a secondary school in Co. Tyrone; may not be teaching this year because of work with football; he may not play for Tyrone next year because he may be too old.
- excellent footballer; I was so happy when he lifted Sam Maguire; Come on Tyrone!
In the exam the prompt card can usually have five bullet points of what you want to say. These bullet points can be in Irish. You can prepare the card well in advance of the exam so make sure you check vocabulary, gender and pronunciation thoroughly. If in doubt ask your teacher.
This is how Samus's prompt card might look in Irish:
- sprt agus peil Ghaelach, Peadar  Ceannabhin (33, beag, tana, lidir, psta, trir clainne).
- Cluiche ceannais anuraidh in adan Ard Mhacha; Bhain Tr Eoghain; captaen; d'imir s go maith; cpla pointe; Sam Maguire, cisir mhr.
- acla; suim mhr sa pheil; Earagail Chiarin agus Tr Eoghain; peileadir iontach maith, sciliil; dograiseach; ag traenil gach l.
- minteoir corpoideachais, menscoil i gCo. Thr Eoghain; N bheidh s ag teagasc i mbliana; obair leis an pheil; an bhliain seo chugainn; r-aosta.
- peileadir den scoth; an-ssta, Sam Maguire; Tr Eoghain ab!
This is a very good presentation. Samus has included lots of information about his chosen famous person and has used the past, present and future tenses effectively. He has introduced his topic well with detailed background information and has used structures and vocabulary already known to him from his description of himself. He has also chosen a topic which he is genuinely interested in, therefore making it easier for himself to adopt an enthusiastic approach to the subject. He has concluded by offering a range of opinions, all of which he has explained and for which he has given reasons. His presentation has a clear start, middle and end and offers the listener a well-structured presentation on his chosen topic.
Sa chur i lthair seo beidh m ag caint ar Pheadar  Ceannabhin. T Peadar  Ceannabhin tr bliana is trocha d'aois. T s measartha beag agus tana ach t s iontach lidir. T a chuid gruaige gairid agus t a shile gorm. T s ina chna i mBaile U Dhlaigh i gContae Thr Eoghain i dtuaisceart na hireann. T s psta agus t trir clainne aige.
Is duine iontach acla  agus t suim mhr aige sa pheil Ghaelach. Imronn s peil Ghaelach d'fhoireann Earagail Chiarin agus d'fhoireann Thr Eoghain. Is peileadir iontach maith . T s iontach sciliil agus dograiseach. Bonn s ag traenil gach l agus t s ag ir nos fearr.
D'imir s sa Chluiche Ceannais anuraidh in adan Ard Mhacha agus bhain Tr Eoghain. Bh thas an domhain ar Pheadar  Ceannabhin an l sin. D'imir s go measartha maith an l sin agus fuair s cpla ciln. I ndiaidh an chluiche thg s Sam Maguire agus bh s iontach ssta. Thug s Sam Maguire ar ais go Tr Eoghain agus bh cisir mhr aige.
Is minteoir corpoideachais  fosta. Bonn s ag teagasc i menscoil i gContae Thr Eoghain. N bheidh s ag teagasc i mbliana, fach, mar t a ln oibre aige leis an pheil. Is fidir nach mbeidh s ag imirt peile ar an bhliain seo chugainn. Sleann s go n-ireoidh s as an pheil mar beidh s r-aosta.
Slim gur peileadir den scoth  agus bh m an-ssta nuair a thg s Sam Maguire. Tr Eoghain Ab!
In this presentation I will be talking about Peter Canavan. Peter Canavan is thirty-three years of age. He is fairly small and thin but he is very strong. His hair is short and his eyes are blue. He lives in Ballygawley in County Tyrone in Northern Ireland. He is married and he has three children.
He is a very fit person and he has a big interest in Gaelic football. He plays Gaelic football for the Errigal Ciaran team and for the Tyrone team. He is a very good footballer. He is very skillful and dedicated. He trains every day and he is getting better.
He played in the Final last year against Armagh and Tyrone won. Peter Canavan was extremely happy that day. He played quite well that day and he got a couple of points. After the match he lifted Sam Maguire and he was very happy. He brought Sam Maguire back to Tyrone and he had a big party.
He is a P.E. teacher also. He teaches in a secondary school in County Tyrone. He will not be teaching this year, however, because he has a lot of work with the football. It is possible that he will not be playing football next year. He thinks that he will retire from football because he will be too old.
I think that he is an excellent footballer and I was very happy when he lifted Sam Maguire. Come on Tyrone!
After your presentation you will have to answer questions on it. Think about the kinds of questions you could be asked on this topic and prepare answers to them.
You are usually allowed to take a card in with you with five reminders of what you want to say. These should not be in complete sentences but might contain, for example, headings for each part of your talk or unusual words which you need.
Remember to learn the vocabulary you need to describe other people (especially famous people, sports stars and musicians), including how to talk about special features and aspects of their lives and careers. Make sure you can explain why you chose this topic and why you are interested in it.
",4,BitGCSE,4,0.035371728241443634,0.037292469292879105,0.06608995050191879,0.12475331872701645,0.7364924550056458
1569,"yourself on 16th - 18th Century dance
yourself on 20th - 21st Century dance
",4,BitGCSE,4,0.06504188477993011,0.055638935416936874,0.11918388307094574,0.15197187662124634,0.6081633567810059
1345,"This Revision Bite will give you practice in how to form adverbs in French.
Adverbs are words that add meaning to the verb and describe actions. They usually tell you
To form an adverb, you need to add
But when the masculine singular adjective ends in a
",4,BitGCSE,4,0.04669572040438652,0.04304661601781845,0.06972414255142212,0.22847063839435577,0.612062931060791
6135,"What to look for in your comparison
Both poems are written from a personal viewpoint.
Both express love. Shakespeare writes to his mistress, Hopkins writes about a much-loved landscape.
Shakespeare mocks the common cliches that poets use about their mistresses - lips redder than coral, breasts whiter than snow, etc - to emphasise the reality of his love. Hopkins also wants to get away from the cliched use of language - by inventing words, like rollrock and twindles, to pinpoint his meaning.
Both poems are written from a personal viewpoint, and both express danger as well as beauty.
However, in Clarke's poem man has caused the destruction already (cutting hay kills the field mouse; war is taking place in Bosnia) - Hopkins' poem is a plea to stop man from causing destruction.
Images or things (usually physical, like a flag) that stand for or represent something else - usually abstractions, like a nation. A crucifix is a symbol of Christianity.
to convey their message. The central image for Clarke is the field mouse, which represents all the innocent, vulnerable people in the world who are killed or injured. Inversnaid represents all areas of wet and wilderness in the world that mankind could jeopardise.
Both poems describe watery river scenes, but while Perch is purely a vivid word-picture, Inversnaid contains more of an explicit 'message'.
The language in Perch has many similarities with the Hopkins poem: combination words and word-plays (alder-dapple, finland of perch) dialect and obsolete words (grunt, slub, runty, adoze) and lots of sound devices. The unorthodox grammar of on hold / In the everything flows and steady go of the world (where the last 8 words make up a giant compound noun) is very like Hopkins.
While the Hopkins poem is full of movement, and ranges over the landscape, the Heaney poem stays very still and focused on the almost motionless fish, adoze in the current.
How does the rhythm and rhyme scheme of Perch compare with that of Inversnaid?
Both poems are written from a personal viewpoint, describing an experience which is for the poet is intensely present.
Both poets use an extended image to put their point across. The canary-yellow cotton jacket is the central image in Homecoming. A row over the jacket caused the family row; the reconciliation is likened to putting the jacket back on. For Hopkins, the darksome burn represents all areas of wilderness in the world that could be vulnerable to man.
language to help us 'hear' events in the poem - Temper, temper... Blue murder. Hopkins uses different techniques -
Words strung together with repeated (often initial) consonants, eg Max made many men mad.
Words that sound the same through the use of similar vowels or consonants, eg hot and slop or fold and filled.
The pattern of stressed and unstressed syllables in a line of poetry.
- to help us hear the sound of the rushing water.
The way a text is built and shaped. Chapters, plot, acts and scenes, stanzas, narrative, verse-form, rhyme and rhythm - all these (and many more) are aspects of structure.
In poetry, the use of words which have the same or a similar sound - eg 'flow' and 'bow' - to form a pattern of sound.
scheme than Armitage. What is the effect of this?
Hopkins writes from personal experience whereas Duffy's poem is a dramatic
An extended speech performed by one person only
Both express love, Anne Hathaway of her dead husband, Inversnaid of a place.
Vivid 'word pictures' used by a writer to conjure up a mental image of something.
is very vivid - The bed we loved in was a spinning top. She uses startling
Descriptions of one thing in terms of another - implicitly comparing the two, but without using 'as' or 'like'. 'Sea of troubles', and 'drowning in debt' are metaphors. Things that represent other things.
to show the intensity of the love, while Hopkins invents words or uses dialect (a windpuff bonnet of fawn-froth) to convey his feelings.
Anne Hathaway's love of Shakespeare is confident and will last forever - I hold him in the casket of my widow's head - while Hopkins' is more tentative - he fears for the future and asks What would the world be? without the wilderness his poem evokes.
Back to Gerard Manley Hopkins: Inversnaid index
Read the full text online and make your own notes.
Get creative, get published and get expert writing advice at BBC Blast.


",4,BitGCSE,4,0.03105367347598076,0.025874778628349304,0.05028536915779114,0.1612088829278946,0.7315773367881775
1173,"This modern story about conflict between a mother and her teenage daughter was published in 1991. The mother is the narrator of the story, so we only see things from her point of view.
""You're not here any longer so how can I speak to you?""
A woman who is deeply upset lies in her daughter's darkened bedroom. She clutches a pair of new white trainers that were a present for her daughter.
In the first sentence, we discover that the narrator is telling the story to another character - the daughter - but the daughter is not there to hear it. This style of writing is sometimes called a
An extended speech performed by one person only
, because there is only one character speaking or thinking.
Her 15-year-old daughter has run away from home. The woman worries that her daughter may have to beg for food to survive, or that she has been forced to become a prostitute.
We are told there was an argument between the father and daughter. Bad language was used on both sides.
The doctor has signed the narrator off work; she is taking medication. The mother aims to pretend to the outside world that everything is okay, but fears her daughter may be dead, or at least living on the streets.
We learn more about the argument. The daughter is brought home drunk at 3am. The father calls her a 'dirty slut'.
Get some direction with a Bitesize revision map
Get creative, get published and get expert writing advice at BBC Blast.


",4,BitGCSE,4,0.03777272254228592,0.03995818272233009,0.07761649042367935,0.11746326088905334,0.727189302444458
