Index,Text,Grade,Type,bert.2.pred,bert.2.prob.1,bert.2.prob.2,bert.2.prob.3,bert.2.prob.4,bert.2.prob.5
473,"Everyones favorite fur ball is back on the prowl in a new movie.
is about the adventures of a fighting
as he tries to protect the world from an evil couple. A feline is a cat. Chris Miller directed the film, which hits the big screen October 28.
student reporter Kaitlyn Rentala recently spoke with the filmmaker about his pet project.
Puss in Boots fights his way into theaters.
Kaitlyn Rentala: Why did you want to direct
I love the character. ... Hes the coolest. Hes the most fun. Hes got this huge heart, but hes also a bit of a troublemaker. I always liked that about him.
KR: How do you decide which actors voices to use?
It can be [hard]. ... We know what the character should look like, so we take a picture of it and we put it on a TV screen. Then we play different actors voices ... and imagine the voice coming out of that character.
KR: What do you hope kids take away from the new movie?
[I hope they learn] that its never too late to do the right thing in life. ... Its a good film about friendship too.
All trademarks and logos are property of Weekly Reader Corporation.
",1,WRLevel3,0,0.38366857171058655,0.38310331106185913,0.18351490795612335,0.021195070818066597,0.02851809374988079
534,"as just another film! In the new movie, a girl with magical hair
or escapes, from a tower. Byron Howard and Nathan Greno direct the film, which is based on Rapunzel.
student reporter Adithi Ramakrishnan spoke with the filmmakers.
Adithi Ramakrishnan: What was challenging about making this film?
One of the biggest challenges for animation ... is hair. And honestly, theres no way to get away from hair if youre making a movie about Rapunzel. [Her] hair is 70 feet long!
AR: What advice might Rapunzel give to kids?
I think she would say follow your dreams. ... And anything you want to do, you can do.
AR: How does Rapunzel compare with other Disney princesses?
Shes not a normal princess. ... Shes not waiting around to be rescued. ... Rapunzel is a girl whos going to take matters into her own hands.
All trademarks and logos are property of Weekly Reader Corporation.
",1,WRLevel3,1,0.3607850968837738,0.4281395673751831,0.16948579251766205,0.017834562808275223,0.023754950612783432
414,"Are you ready for a vacation thats out of this world? Officials in Russia recently announced plans to build a hotel in space.
The four-room hotel will be designed to
or fit, up to seven guests at a time. Rooms will have large windows so people can look down at Earth. The hotel will most likely open for business by 2016, according to Alexander Derechin. He works for the company that will build the space hotel.
Several other businesses are also working to put more people in space. A British airline company is building a shuttle to take visitors into space. It expects the aircraft to be completed by 2012.
That and other shuttles will keep the space hotel busy, says Derechin. Spaceships [for the public] are being built around the world, he says. They will need to fly somewhere.
Theres no hotel in the world like this one!
All trademarks and logos are property of Weekly Reader Corporation.
",1,WRLevel3,1,0.20253169536590576,0.4327496588230133,0.3286365568637848,0.016013747081160545,0.0200683381408453
284,"Meet five females who are changing the world.
Danica Patrick doesnt let anything stop her. When shes in her race car, she puts the pedal to the metal and flies. Last spring, she became the first woman to win an event in the Indy Racing League.
Patrick wasnt the only woman to race into the record books last year. Women around the country pulled off
Hillary Clinton set her sights on the White House. In 2008, she was the first woman to be a presidential candidate on every state ballot. Now she is the U.S. secretary of state.
Michelle Obama had her own fantastic first. The former lawyer became the countrys first African American first lady. Her husband, Barack Obama, was elected president on November 4.
was out of this world. An achievement is an accomplishment. The astronaut was the first woman to command the International Space Station. She finished her job on the floating lab last April.
Ann Dunwoody also had a major achievement. In November, she became the first female four-star general in the U.S. military. That is the second-highest
in the U.S. Army. A rank is a position.
The achievements of those and other women can encourage girls. Ive heard from moms and dads who see [my accomplishment] as ... hope for their daughters, Dunwoody says. Anything is possible through hard work.
Danica Patrick and the other women didnt get to where they are alone. Heres a look at some of the women who helped make their achievements
first lady. Her husband, George Washington, was president from 1789 to 1797.
was the first woman to cast a ballot after U.S. women were granted the right to vote in elections in 1920.
became the first woman to qualify for a major car race, in 1977. She placed ninth in the Indianapolis 500 race in 1978.
became part of the U.S. Army in 1943. More than 17,000 women served overseas during World War II.
blasted off in 1983 to become the first U.S. woman in space. Her two space shuttle missions lasted about 343 hours.
What would you like to be the first person to accomplish? Why?
All trademarks and logos are property of Weekly Reader Corporation.
",1,WRLevel3,1,0.3388577401638031,0.4395827054977417,0.17832627892494202,0.02187405712902546,0.021359125152230263
254,"Scientists in Greenland are going ducky over their latest experiment. Theyre using toy ducks to study ice! Greenland is a large island in Europe. It is near the North Pole.
The scientists recently set loose 90 rubber ducks in the Jakobshavn (yah-cuhb-SAH-ven) Glacier on Greenland. A glacier is a large sheet of ice that moves slowly over land. Scientists dropped the ducks into tunnels in the glacier called
Melting ice on the glacier flows into the moulins. Some experts say
is causing the ice to melt. Global warming is the slow rise of Earths temperature.
Where the water ends up is a mystery. Thats where the ducks come in. Scientists have labeled the toys with an e-mail address. They hope fishing crews will find the ducks and contact them. That will help scientists learn where the melting water travels.
Scientist Alberto Behar is waiting to hear some of the duck tales.
We havent heard back, but it may take ... time, he told reporters.
All trademarks and logos are property of Weekly Reader Corporation.
",1,WRLevel3,1,0.2985471487045288,0.4385279417037964,0.22577227652072906,0.017284680157899857,0.019868027418851852
613,"Each sentences subject(who or what the sentence is about) must agree in number with its verb. Circle five verbs on this page and underline their subjects. For example,
Scientists have discovered fossils of an ancient sea crocodile with a head like a dinosaurs. It most likely lived in the Pacific Ocean about 135 million years ago, during the Age of the Dinosaurs.
The ancient crocodile was a top ocean
A predator is an animal that feeds on other animals. The creature was 13 feet long and had 4-inch teeth! Scientists nicknamed the creature ""Godzilla,"" after the film monster.
Fossils of the creature were found in 1996 in Argentina. That is a country in South America. Scientists spent years studying the fossils before reporting their giant find.
measures published under license with MetaMetrics, Inc.
All trademarks and logos are property of Weekly Reader Corporation.
",1,WRLevel3,1,0.3279531002044678,0.40816786885261536,0.22754263877868652,0.018018387258052826,0.018317917361855507
226,"A new glass walkway will allow visitors to step out over the Grand Canyon.
Brave visitors will soon have a birds-eye view of the Grand Canyon in Arizona. Plans are being made to build a glass walkway. It will jut out 70 feet from the canyons edge. Looking down, visitors will be able to see the Colorado River flowing 4,000 feet below.
is a deep, narrow valley with steep sides. It is cut into the earth by running water. The Grand Canyon was carved by the Colorado River over millions of years.
If all goes as planned, the walkway will open in January. It is being built on land owned by a Native American tribe called the Hualapai. ""Its a whole new way to experience the Grand Canyon,"" says spokesperson Sheri Yellowhawk.
All trademarks and logos are property of Weekly Reader Corporation.
",1,WRLevel3,1,0.26607951521873474,0.41802629828453064,0.2776850163936615,0.017701122909784317,0.020508063957095146
380,"Can the endangered Bengal tiger be saved? Wildlife officials in India, a country in Asia, certainly hope so. They recently began counting Bengal tigers to see how many are left. The
or official count, is part of a plan to save the animal from becoming
There is a high demand for tiger body parts in Asia.
People are the major threat to the tigers. With new roads, homes, and farms being built, the tigers habitat is being destroyed. Illegal hunting is also a problem. There is a high demand for tiger body parts in Asia. Clothes and rugs are made from the tigers coat. In China, some people use tiger bones and other parts to make medicine.
Can the tigers be saved? ""Yes, but its not a sure thing,"" tiger expert James L. David Smith told
He says that people who live closest to the tigers need to help protect them.
All trademarks and logos are property of Weekly Reader Corporation.
",1,WRLevel3,1,0.22425220906734467,0.4114648997783661,0.3289486765861511,0.015389170497655869,0.01994507387280464
79,"Floodwater recently exploded from Glen Canyon Dam in Arizona. The water gushed down the Colorado River and into the Grand Canyon. A
is a long, narrow valley with high cliffs on each side.
Scientists released water from the dam to move 1 million tons of
down the Colorado River. Sediment is sand and soil carried by water. Scientists hope the sediment will collect on beaches and
to save endangered fish and plants. Sandbars are ridges of sand formed by moving water.
Glen Canyon Dam is a wall that people built across the Colorado River. It was made to store water and generate electricity. When it began operating in 1963, it stopped the flow of river water and most of the sediment.
Glen Canyon Dam is located in Arizona.
Without new sediment, beaches and sandbars started washing away. Plants growing along the beaches began to die off. Many young fish that depend on sandbars to survive started to die off too.
During the next two years, scientists will study the effects of the flooding. ""The Grand Canyon is one of the unique natural areas in the world,"" scientist Denny Fenn told
. ""It deserves protection. Anything we can do to save it, the better off we'll be.""
What might happen if Glen Canyon Dam were removed? Why?
All trademarks and logos are property of Weekly Reader Corporation.
",1,WRLevel3,0,0.35332372784614563,0.3495543301105499,0.2581569254398346,0.01624154858291149,0.02272343821823597
298,"On August 14, millions of people were left in the dark. There was a blackout, or loss of electricity. It was the largest in U.S. history. The blackout affected eight states and some parts of Canada.
failure. A power grid is a system that controls the flow of electricity. In many places, the electricity was out for 48 hours.
The power came back on, but the problem is not over. Experts say a future blackout is possible. They say that the grid is carrying more electricity than it can handle.
President George W. Bush called the power failure a ""wake-up call."" He said that the power system is old and needs to be fixed.
Officials are trying to come up with ways to solve the problem. One idea is to build new power lines. Another idea is to update the old system. The goal is the same: to prevent future blackouts.
All trademarks and logos are property of Weekly Reader Corporation.
",1,WRLevel3,1,0.19649775326251984,0.3861504793167114,0.3795154392719269,0.015834862366318703,0.022001462057232857
279,"People need clean drinking water to live. In poor countries, millions of people dont have clean water. Their water is filled with
that can make people sick. Germs are living things that can be seen only with a microscope. About 6,000 people, mostly children, die each day because of unsafe drinking water.
To help solve the problem, a company has invented a special straw. It makes unsafe water clean for drinking. The invention is called LifeStraw. It is a plastic tube with filters to block many types of germs.
the lives of many people around the world, especially children,"" LifeStraw spokesperson Brian Hollingsworth told
means ""to improve."") The company hopes the straw will be available as soon as 2007.
All trademarks and logos are property of Weekly Reader Corporation.
",1,WRLevel3,1,0.2524683475494385,0.41339874267578125,0.2971210181713104,0.016328640282154083,0.02068326622247696
623,"Theres a bookworm in the White House. Its U.S. President Barack Obama. He wrote a new book for kids. The book is called
Of Thee I Sing: A Letter to My Daughters.
The picture book goes on sale November 16. It tells the stories of 13 important Americans, including baseball player Jackie Robinson. He was the first African American to play major-league baseball since the late 1800s.
Obama was excited to pen the book. Its a great
for me to speak to young people, he said in an interview on Sirius XM Radio. An opportunity is a chance.
The inspiring tales already have two young fansObamas daughters, Malia and Sasha. There is a drawing of them walking their dog on the cover. The girls were among the first people to review the book. I asked them to read it, [to] see what they thought, Obama says. They approved!
President Barack Obama and his daughters walk the family dog.
All trademarks and logos are property of Weekly Reader Corporation.
",1,WRLevel3,1,0.25779998302459717,0.4130343496799469,0.2911960184574127,0.016773799434304237,0.021195845678448677
776,"This summer, cats will try to take over the world. That's the
or story, of the upcoming summer movie
To tell the story, the film uses animals, puppets, and computer animation. Tobey Maguire and Susan Sarandon are among the actors whose voices will be used for the film's animals.
All trademarks and logos are property of Weekly Reader Corporation.
",1,WRLevel3,0,0.4955279231071472,0.3025228679180145,0.1597922146320343,0.021138610318303108,0.021018382161855698
569,"Wiffle ball has become a favorite backyard game through the years. This year, the famous plastic ball turns 50!
The Wiffle ball was invented in 1953. A few years later, the yellow plastic bat became part of the game.
A Connecticut man got the idea for the Wiffle ball after watching his son play ball with a friend. ""He decided he wanted to make a ball that would make it easier for us to pitch,"" said his son.
The Wiffle ball is hollow and has eight holes on one side. In the air, the ball dips and curves. That makes it hard for a batter to hit.
How did the ball get its name? When a kid swung at a ball and missed, kids used to say he or she had whiffed, said the inventor's grandson.
All trademarks and logos are property of Weekly Reader Corporation.
",1,WRLevel3,1,0.31533053517341614,0.3912486433982849,0.25624048709869385,0.01676609180867672,0.02041414938867092
492,"You turn on the TV and see your favorite cartoon character. But wait a minutethats not a show; it is a commercial for junk food!
Cartoon characters are being used to sell junk foods on TV. How does that affect you?
Thats wrong, says the Institute of Medicine, which advises the nation on health issues. The group says that kid-friendly characters should promote only foods that are good for you.
The group recently reported that food ads on TV have astrong influence on what kids under the age of 12 eat. ""Our eating habits and preferences form early in our lives,"" the groups spokesperson, Christine Stencel, told
Advertisers know kids have spending power. ""American kids spend about $200 billion each year. Foods high in sugar and fat are among the top 10 items,"" says Stencel. ""Kids also influence what their parents buy.""
Junk foods such as candy bars, sugared cereals, and potato chips are high in
A calorie is a measure of the amount of energy a food can provide. The body needs food as fuel. However, people gain weight when they take in more calories than they use up through activity.
Millions of people in the United States are
or severely overweight. Being overweight can lead to serious health problems.
""The committee thinks it is time people should take steps to reduce the problem of obesity,"" says Stencel. ""That includes making changes in what foods are marketed to kids and how they are promoted.""
Foods that are high in nutrition help people stay healthy. Good choices:
foods with whole grains, such as whole-wheat breads and pastas
a variety of fruits and vegetables in a rainbow of colors
calcium-rich, nonfat or low-fat foods, such as milk, cheese, and yogurt
What are some other ways advertisers get kids to buy their products?
measures published under license with MetaMetrics, Inc.
All trademarks and logos are property of Weekly Reader Corporation.
",1,WRLevel3,1,0.22587962448596954,0.3719843327999115,0.3628033399581909,0.016671057790517807,0.022661691531538963
352,"You shrink down in the chair, looking nervously at the door. As the doorknob turns, your knees start to shake. You look for somewhereanywhereto hide.
Does that sound like your last trip to the dentist?
Checkups for your chompers may not be scary for much longer. Experts in England have come up with a gel that can fix common tooth troubles without a drill.
, or rot. That occurs when bacteria create tiny holes in your teeth. The gel fills those holes. It helps the teeth rebuild themselves. [The gel] is ... pain-free, says scientist Jennifer Kirkham. She helped invent the gel.
Researchers say the new product could end up in dentists hands in a few years. Now thats something to smile about!
All trademarks and logos are property of Weekly Reader Corporation.
",1,WRLevel3,1,0.34673088788986206,0.3990722894668579,0.21564269065856934,0.019037170335650444,0.019516954198479652
628,"What's the recipe for having fun with math and nutrition? Learn to cook!
More children are in the kitchen thanks to a kid-friendly cooking world. TV chefs, such as Emeril Lagasse, show that cooking can be cool. His recipes always end with a ""Bam!""
Cooking classes for kids have also become popular. What makes those classes such a hit? The secret ingredient is that kids learn to safely use real
, or cooking tools. The young chefs say that their favorite part of class is that they get to munch on their own meals!
All trademarks and logos are property of Weekly Reader Corporation.
",1,WRLevel3,0,0.5468829274177551,0.29860225319862366,0.10866458714008331,0.026432424783706665,0.01941785402595997
652,"Say good-bye to French fries and hello to fresh fruit. The U.S. Congress is considering new rules to make school lunches healthier.
, or lawmakers, plan to discuss the Child Nutrition Act this fall. That law, passed in 1966, requires schools to make sure lunches have enough healthy foods such as fruits and vegetables.
Health experts say Congress may chew on changes to the law. For example, legislators may ask schools to serve only low-fat milk and to use less salt in lunches.
Some schools are already on the right track. Many have traded in hot dogs for baked chicken tenders. Others serve whole-wheat bread.
Students can help, too, explains Margo Wootan. She is an expert on nutrition. Eat the fruit and vegetables that come with the [school] meal, she says. Seeyour mom was right!
All trademarks and logos are property of Weekly Reader Corporation.
",1,WRLevel3,1,0.2859150767326355,0.42507144808769226,0.25189411640167236,0.01648768037557602,0.020631685853004456
758,"Some criminals call them double trouble. Their names are Lucky and Flo. They are black Labradors. Recently, the dogs found 1.6 million
DVDs. To pirate means to copy something without permission. The dogs found the DVDs in Malaysia. That is a country in Asia. The pups are the world's first dogs trained to find DVDs. They
or recognize, them. They do this by picking up the scent of chemicals found in DVDs. Dogs have a strong sense of smell. It is much stronger than the human sense of smell.
Thanks to the animals, 26 people were arrested. ""What they have helped us achieve in such a short time is remarkable,"" says an official from Malaysia, S. Veerasingham.
All trademarks and logos are property of Weekly Reader Corporation.
",1,WRLevel3,1,0.21928004920482635,0.4454963505268097,0.2933539152145386,0.017822202295064926,0.0240474883466959
677,"People arent the only ones packing on the pounds. A new report shows animals are gaining weight too!
species, such as cats and dogs. A mammal is a warm-blooded animal that feeds its babies milk. Experts found that all the species have become heavier over time.
Some creatures owners may be partly to blame for their pets increase in size, say researchers. People may feed their animals more unhealthy foods today than they did in the past.
Other animals extra pounds, however, are harder to explain. Animals some scientists study, such as mice and rats, have also grown bigger. [Those creatures] have been getting almost the exact same type of food over the past few [years], scientist David Allison told
Experts will continue to research the animals to learn more. This study lays out a puzzle, says Allison. There may ... be other important causes of obesity that we do not usually consider.
What has this kitty tipping the scales?
All trademarks and logos are property of Weekly Reader Corporation.
",1,WRLevel3,1,0.20107965171337128,0.40518882870674133,0.3570706844329834,0.01635904423892498,0.020301874727010727
394,"Who will face Barack Obama in the race for U.S. president?
Being president of the United States isnt easy. Ask Barack Obama. Every day he faces huge problems, such as trying to create work for unemployed Americans.
Who would want such a hard job? Many people! There are 10 Republican
They want to run against Obama in the 2012 presidential election. A candidate is a person who runs for something. Obama is a Democrat.
Republicans and Democrats are the two main U.S.
Those are groups of people who share beliefs about how a nation should be run. Each party
The main Republican candidates are Michele Bachmann, Herman Cain, Newt Gingrich, Jon Huntsman, Gary Johnson, Ron Paul, Rick Perry, Buddy Roemer, Mitt Romney, and Rick Santorum. When
went to press, Romney and Gingrich were leading in polls of Republican voters.
AP Images; NBC Universal/Getty Images; Scott Olson/Getty Images; Polaris/Newscom; Brooks Kraft/Corbis; Zuma Press/Corbis; Justin Sullivan/Getty Images
Romney was the governor of Massachusetts. If elected, he says, he will create jobs. About 9 percent of Americans are unemployed. My number-one job will be to see that America ... is number one in job creation, Romney says.
Gingrich was elected to the U.S. House of Representatives in 1978. Today he works as a political speaker. I believe we can return America to ... full employment, Gingrich says.
Election Day is almost a year away, but Republicans are hard at work. Beginning in 2012, they will hold special votes. They will narrow down their choices for a candidate.
Who will Obama face to be our next president? The voters will decide.
There are only three requirements to serve as the nations president, according to the U.S. Constitution.
How might Republicans decide which candidate to nominate?
Brain Builders: Road to the White House
Brain Builders: Road to the White House
measures published under license with MetaMetrics, Inc.
All trademarks and logos are property of Weekly Reader Corporation.
",1,WRLevel3,1,0.2592713236808777,0.40577906370162964,0.29046016931533813,0.019666507840156555,0.02482295036315918
229,"Coral reefs are important because they supply food and shelter to ocean creatures.
Thousands of volunteers are getting ready to take the plunge to protect the world's waters. Dive In To Earth Day is a worldwide celebration. During the week of April 22, volunteers will participate in activities to
or save, the world's water and sea life. Water makes up about threefourths of Earth's surface.
Some people will clean beaches, and others will go on dives to clean polluted water. Dive In volunteers have removed about 190 tons of trash from coastal areas since 2000. Trash left in the sea can harm
Coral reefs are made of tiny sea animals called
As polyps die, they leave behind hard shells. Other polyps grow on top of the shells. Polyps form coral reefs over many years. Coral reefs are important because they supply food and shelter to ocean creatures.
""Communities across the globe are taking part in activities to safeguard our oceans and coral reefs,"" says actor and Dive In official Susan Sarandon.
measures published under license with MetaMetrics, Inc.
All trademarks and logos are property of Weekly Reader Corporation.
",1,WRLevel3,2,0.21021699905395508,0.3502757251262665,0.3987046480178833,0.016675686463713646,0.024126941338181496
