Index,Text,Grade,Type,bert.2.pred,bert.2.prob.1,bert.2.prob.2,bert.2.prob.3,bert.2.prob.4,bert.2.prob.5
417,"The United States is sometimes called a ""melting pot."" It got this nickname because people from all over the world have come here to live. A recent government report says more people from Latin American and Asian countries are living in the United States than ever before.
The U.S. Census Bureau counts all the people who live in the United States every ten years.
The world map shows the areas where the most immigrants who live in the United States came from between 1990 and 1999, according to the Census Bureau.
The Census Bureau's report shows that about 11 million Asian people live in the United States today. The report also says that 31 million Latin American people live in the United States.
Latin American people are from the countries south of the United States in Central and South America. People
or move from their homeland to another country, for many reasons. Some people leave their homeland to be with family members. Other people emigrate because life in their homeland has become too hard or dangerous. More people also emigrate today because traveling to other countries is faster, less expensive, and safer than ever before.
The Census Bureau says that the main reason people emigrate to the United States to start a new life.
Many neighborhoods have signs and billboards written in other languages. How else might a neighborhood change with the arrival of people from other countries?
All trademarks and logos are property of Weekly Reader Corporation.
",1,WRLevel3,1,0.2695906460285187,0.4426270127296448,0.24194379150867462,0.020999977365136147,0.02483862265944481
373,"Artist Cynthia Vose believes that hats tell a story. Women have worn different hats throughout history. In honor of Womens History Month, Vose organized an art exhibit about hats. The exhibit is taking place this month at a library in Billerica, Massachusetts.
""Beyond fashion, hats represent the changing roles of women in society.""
In the 1800s, many American women wore bonnets. As women gained rights, they no longer wore hats just for fashion. Women began to wear hats for jobs that were once held by men.
All trademarks and logos are property of Weekly Reader Corporation.
",1,WRLevel3,1,0.25361159443855286,0.4440414309501648,0.25439244508743286,0.021405210718512535,0.026549309492111206
264,"Why do some plants and animals die out?
Venice is a famous city in Italy. It is built on small islands. To get around the city, people travel by boat. Over the years, Venice has been sinking slowly into the sea. Water levels are rising and causing flooding. The city needs help to stay above water.
The government of Italy has a plan to save the city from floods. Government officials want to build a system of gates. The gates would block the seawater from flooding the city.
The gates would take about ten years to complete. If the plan is a success, Venice will be saved from being swallowed by the sea.
All trademarks and logos are property of Weekly Reader Corporation.
",1,WRLevel3,0,0.46897560358047485,0.3487333357334137,0.10588297247886658,0.04848562926054001,0.02792244218289852
69,"How does the government want to protect polar bears?
Polar bears are on thin ice. Their home in Alaska is in trouble. The animals could become
. That means to be at risk of dying out completely.
To help the big bears, some U.S. officials want to set aside more than 200,000 square miles in Alaska. The area would be a protected habitat. It would have special rules to help keep polar bears safe.
About 3,500 polar bears live in northern Alaska. That area is part of the Arctic. The Arctic is the northernmost place in the world. About 25,000 polar bears live there.
Some people are worried that the number could fall, though. Alaskas polar bears face dangers in their home. Some companies drill for oil off the states coast (right). People use oil to heat their homes. However, an oil spill could hurt the animals, some experts warn.
By creating a protected habitat for polar bears, the U.S. government could
drilling there. To limit is to control. Some Alaskans dont want the habitat, though. They say the bears dont need protection. Plus, drilling is important for the state, says Alaskas governor, Sean Parnell.
Melting sea ice is another problem for the polar bears. The animals stand on the ice while hunting for food. Some scientists say the ice is melting because of
. That is the slow rise of Earths temperature.
Its important to protect polar bears habitat, wildlife expert Kassie Siegel told
656,424 square miles (Alaska is the largest state. It is more than twice the size of Texas.)
, or usual, January temperature is 11 degrees Fahrenheit. The average July temperature is 47 degrees Fahrenheit.
What are some ways you can help protect endangered animals?
measures published under license with MetaMetrics, Inc.
All trademarks and logos are property of Weekly Reader Corporation.
",1,WRLevel3,1,0.315830796957016,0.44952675700187683,0.18872006237506866,0.022595012560486794,0.023327352479100227
784,"? It may sound like a tongue twister, but it is actually a new species of dinosaur. Scientists recently finished a
were discovered in 1998 in South America. Fossils are ancient remains of plants or animals. Scientists spent almost six years cleaning the bones and putting them together. After studying the fossils, scientists learned that the dinosaur lived about 225 million years ago. It was one of the first two-legged plant-eating dinosaurs on Earth!
Scientists say the new species is related to dinosaurs that lived in what is now Europe. The discovery supports the idea of a supercontinent called
(pan-JEE-ah). Scientists believe that when dinosaurs first appeared on Earth, all land was joined together and that it later split into continents.
All trademarks and logos are property of Weekly Reader Corporation.
",1,WRLevel3,0,0.413418710231781,0.39243412017822266,0.12680953741073608,0.042480695992708206,0.024856898933649063
214,"On March 27, hundreds of colorful kites will fill the sky over the National Mall. That is a park in Washington, D.C., where a kite festival will be held. Nearly 25,000 people attend the popular event each year. This year's theme is ""Kites Around the World.""
""Kites are something people celebrate all over the world,"" event organizer Brandi Rose told
. ""The festival is a way to bring all of the
together in one place,"" she said. The culture of a group of people refers to their way of life, ideas, and traditions.
Some people have built their own kites for the festival. ""I chose to build a Japanese fighter kite,"" said Mike Van Meers. ""In 17th-century Japan, the kites were built with bamboo and paper. I'm building one with modern materials.""
Experts think kites were first made in China more than 2,000 years ago. Legend has it that a Chinese farmer invented the kite. On a very windy day, he tied a string to his hat. He held the string to keep his hat from blowing away.
Traders from China spread kite flying to other parts of the world. ""Kites come in all different shapes and sizes,"" said Van Meers. ""Every culture is unique, and every culture has a different style.""
The kite gets its name from a bird of the same name. Kites are graceful, soaring birds with long, narrow wings. These birds were once common in England. In the 1600s, kids in England made toys that sailed through the sky when pulled with a string. When the toys moved, they looked like the gliding birds.
Why is learning about different cultures important?
measures published under license with MetaMetrics, Inc.
All trademarks and logos are property of Weekly Reader Corporation.
",1,WRLevel3,1,0.17134051024913788,0.43152713775634766,0.3511922061443329,0.02015409991145134,0.025786111131310463
58,"Imagine diving into a world filled with giant starfish and yellow sea lilies. That is what scientists from New Zealand recently did. New Zealand is an island country near Australia.
Scientists spent five weeks studying sea life in the Ross Sea. That is a body of water near Antarctica. Antarctica is the southernmost place on Earth.
The team used special cameras to see all the way down to the seafloor. They collected more than 30,000
, or samples. They found eight types of fish that may be new to scientists.
, or sea, creatures the scientists found are bigger than similar creatures in other parts of the world. The starfish, for example, are 2 feet wide. Some starfish in other seas are less than 1 inch wide.
The scientists say they hope their discoveries will teach people about Antarcticas marine creatures. These results contribute to our understanding of how ... [the sea life in] this area is connected, says scientist Niki Davey.
All trademarks and logos are property of Weekly Reader Corporation.
",1,WRLevel3,1,0.26021450757980347,0.5070407390594482,0.18733689188957214,0.021848974749445915,0.02355886995792389
329,"Which famous African American do you most admire?
asked some third graders at Tamarac Elementary School in Holtsville, New York, that question. Here's what they said:
Jackie Robinson in a Kansas City Monarchs Uniform.
I admire Jackie Robinson. It must have been tough being the first African American to play major-league baseball. He wasn't treated equal. Instead of getting angry, Jackie Robinson showed how good he was. He made the Hall of Fame!
Rosa Parks was a very brave woman. She refused to give up her seat on a bus to a white person. She helped change the laws in our country by standing up for what she believed in.
Hockey player Anson Carter is whom I admire. He has proved to be a decent power forward for the New York Rangers. He always gives 100 percent. That will help the Rangers make their drive for the playoffs.
All trademarks and logos are property of Weekly Reader Corporation.
",1,WRLevel3,1,0.38512831926345825,0.4272730350494385,0.13296827673912048,0.02881382405757904,0.025816526263952255
544,"One fish, two fish, red fish ... see-through fish? Researchers in Japan recently produced a goldfish so
, or light in color, you can see its insides (below). Japan is a country in Asia.
The fishs gills and muscles can be seen through its light-colored body. Several other
can also be seen, including the heart, stomach, and brain. An organ is a body part.
The see-through goldfish gives experts and students a new way to study the animals, says researcher Yutaka Tamaru. They can see how the fishs organs work without hurting it.
The creature is expected to live up to 20 years. It could grow to be 10 inches long and weigh about 5 pounds. As the goldfish grows bigger, you can watch its whole life, Tamaru told
All trademarks and logos are property of Weekly Reader Corporation.
",1,WRLevel3,1,0.3418382704257965,0.44585925340652466,0.15885356068611145,0.02937420830130577,0.02407471090555191
707,"After years of protection, bald eagles and other endangered animals are making a comeback.
The future looks bright for some endangered animals! Thanks to tough laws and hardworking scientists, many of these animals are doing well.
The bald eagle is one success story. The bird became the symbol of the United States in 1782. At that time, about 100,000 bald eagles lived in the lower 48 states. By 1963, only 417 nesting pairs remained.
Hunting and loss of habitat contributed to the
or drop in number. However, the biggest threat came from DDT, a chemical used for farming. DDT made the birds eggshells so thin that chicks couldnt survive.
or not allowed. In 1973, the Endangered Species Act was created. That law protects threatened plants and animals. Bald eagles soon gained protection under this law.
Today, there are more than 7,100 bald eagle nesting pairs in the lower 48 states. Plans are under way to take the birds off the endangered species list. If that happens, they will still be protected by other U.S. laws.
""It is a good endangered species success story,"" spokesperson Nicholas Throckmorton of the U.S. Fish and Wildlife Service told
""Caring citizens have brought our national symbol back from the brink of extinction.""
The bald eagle isnt the only endangered species doing well. Here are some other success stories.
in and around Yellowstone National Park were endangered as a result of hunting and habitat loss. By 1975, only 220 to 320 bears lived in Yellowstone. Today, there are more than 600.
Scientists counted only 67 nesting females in 1973. Now the number of nesting females has jumped to more than 400.
of California were once killed by pollution and fishermen. In 1938, there were only 700 otters off the coast of California. Today, there are more than 2,500.
Why was the bald eagle chosen as a national symbol?
All trademarks and logos are property of Weekly Reader Corporation.
",1,WRLevel3,1,0.1915893703699112,0.4337722957134247,0.32976317405700684,0.02023029327392578,0.024644870311021805
604,"Author Angela Johnson takes readers on a journey in her new book,
She writes about the Tuskegee Airmen. They were the first African American pilots in the U.S. military. The group learned to fly airplanes in Tuskegee, Alabama. The Tuskegee Airmen served during World War II (19391945). They
or guided, U.S. fighter planes during the war.
Johnson says the story of the Tuskegee Airmen can encourage people to follow their dreams. ""There will always be people who want to keep you from doing something,"" she told
""You just have to go on and do absolutely everything you can.""
All trademarks and logos are property of Weekly Reader Corporation.
",1,WRLevel3,1,0.2500174641609192,0.4633173942565918,0.2417142689228058,0.021054107695817947,0.023896748200058937
525,"Should peanut butter be kicked out of school?
When Sam Roffwarg was 18 months old, someone on an airplane gave him a snack pack of peanuts. Sam ate a few of the nuts. Suddenly, he was throwing up and gasping for air because he couldnt breathe.
It turned out that Sam, now 8, has a peanut
. An allergy is a bad reaction to something. Today, the third grader from Jackson, Miss., is careful about what he eats. I always read the ingredients, Sam told
Staying away from peanuts is hard when Sam goes to school, though. When other kids eat peanut butter, Sam has to be sure not to sit near them. Just touching a peanut could make him sick. A
, or strong, allergic reaction could be life threatening.
To protect kids, some schools are limiting or banning peanuts. A survey of about 1,200 school districts found that 18 percent of schools had some type of peanut ban in 2007.
Some officials say the bans are needed to protect kids with allergies. About 400,000 school-age children have peanut allergies, and experts say that number is growing.
Still, most kids are not allergic to peanuts. Some people say banning peanuts is not fair. Plus, they say, keeping track of what every kid eats is impossible. You just cant monitor whats in every persons lunch pail, says Janet Mitchell, a school district representative in Georgia.
Food is not the only thing that can cause allergic reactions. Here is a
, or close-up, look at some other
, or things that may set off allergies.
Tiny dust mites live in the dust found on furniture and in carpets. They are invisible to the naked eye, but they cause asthma and breathing problems for some people.
This allergen is often found in moist, damp areas, such as basements and bathrooms. Mold gives off a type of
, or germ, that can trigger allergy symptoms.
Plants create pollen. It is carried through the air by wind and travels into peoples noses. That can cause people allergic to pollen to sneeze and their eyes to tear.
Should schools limit or ban peanuts? Why or why not?
All trademarks and logos are property of Weekly Reader Corporation.
",1,WRLevel3,1,0.38427314162254333,0.4143625497817993,0.14534041285514832,0.032329950481653214,0.023693935945630074
641,"Workers clean the Gulf of Mexico after an oil spill.
At a busy aquarium in New Orleans, Louisiana, a sea turtle splashes about in clean, clear water. Its hard to imagine that just weeks ago the animal was covered in greasy oil.
Experts wash a bird rescued from the oily water.
the sea turtle from an oil spill in the Gulf of Mexico. That body of water is south of the United States. To rescue something is to save it.
Until recently, oil had been spilling into the gulf for months. The oil
miles of sea and beaches. To damage something is to harm it. Thousands of animals were trapped in the sticky stuff.
The spill began in April. Workers were drilling from on top of an
in the gulf. That is a building in the sea. It is used to collect oil. Suddenly, the oil rig exploded. The accident caused an oil well at the bottom of the gulf to leak.
Since then, experts have been trying to stop the oil from spreading. They recently plugged the well with cement. Workers are also cleaning the water. The cleanup could take years, experts say.
The work is starting to make a difference, though. Officials recently reopened part of the gulf to fishing. That is good news for people who live near the gulf.
We love the land, Alma Robichaux told
She lives in Louisiana. We cant go anywhere else.
The oil spill isnt the first big trouble for the Gulf Coast. Hurricane Katrina hit the area in August 2005. The huge storm killed more than 1,300 people in five states.
New Orleans, Louisiana, was one of the worst-hit areas. Even today, parts of the city look as if the hurricane just happened. Many peoples homes are still damaged from the storm.
A group of kids works to repair houses. To repair is to fix. The group is called Beacon of Hope.
Student Emma Ridenhour recently lent a hand. After five years, theres still a lot of work to be done, she told
It means a lot that I could ... help.
How might the oil spill affect people in other parts of the country? Why?
measures published under license with MetaMetrics, Inc.
All trademarks and logos are property of Weekly Reader Corporation.
",1,WRLevel3,1,0.30722954869270325,0.4759044647216797,0.16572777926921844,0.025707995519042015,0.02543017268180847
94,"Four words from this issue are listed below. Choose the word that means about the same.
All trademarks and logos are property of Weekly Reader Corporation.
",1,WRLevel3,0,0.42480742931365967,0.36621084809303284,0.15311376750469208,0.027844956144690514,0.02802302874624729
273,"Nicole the shark set a world record for her swim distance and speed.
A great white shark named Nicole has taken a bite out of the record books. She swam farther than any other known sharkmore than 12,400 miles!
Great whites are endangered. They are often hunted for their teeth and fins.
The great white shark swam from South Africa to Australia and back within nine months. That is also the fastest
of any ocean animal. When an animal migrates, it moves from one region to another.
The map shows Nicoles route between South Africa and Australia.
Nicole was one of 25 great whites that scientists tagged in 2003. The tags record information such as time and speed. Scientists are using what they learn to find ways to protect these endangered animals.
""Its clear that we have only uncovered the tip of the iceberg; there is still much to learn,"" says lead researcher Ramn Bonfil.
are words used in place of nouns. Some examples of pronouns are
. Find six pronouns on this page. What noun or nouns does each pronoun replace?
All trademarks and logos are property of Weekly Reader Corporation.
",1,WRLevel3,1,0.26025864481925964,0.4676145613193512,0.21802645921707153,0.022034859284758568,0.032065536826848984
386,"Say hello to the strawberry crab! A scientist in Taiwan recently discovered a species of crab (below) that looks more like a sweet berry than it does a sea creature. Taiwan is part of China, which is a country in Asia. Fab Crab
Scientist Ho Ping-ho found the crab off the coast of southern Taiwan. The critter is dark pink with small white bumps on its shell.
The crab is also a shrimpin size, that is. Its shell is only about 1 inch wide, Ho says. Most crabs are at least 4 inches wide.
or animals without backbones. There are more than 5,000 crab species in the world. Ho says his bright-colored find looks similar to a type of crab found near Hawaii.
The crab looks like a ... red strawberry, Ho told
I thought [it was] a wonderful crab when I found it.
All trademarks and logos are property of Weekly Reader Corporation.
",1,WRLevel3,1,0.37754926085472107,0.43103790283203125,0.1342703104019165,0.03506692871451378,0.022075526416301727
469,"Scientists hope that an allergy-free peanut will one day replace the common peanut.
Many kids love peanut butter. Americans eat millions of pounds of it each year. But not all kids can enjoy this food. For some, peanuts can be harmful. About 100 people, mostly kids, die each year from peanut allergies.
A peanut allergy is one type of food allergy. A food allergy is when the body has a strong reaction to a certain food. Eleven-year-old Chris Conetta is allergic to peanuts. If he eats peanuts, he gets very sick. ""My face and my tongue swell up, and I can't breathe,"" he said.
Kids like Chris can have an allergic reaction from eating just a tiny amount of peanuts or a food made with peanut oil. Even smelling or touching peanuts can make some kids sick.
About 7 million Americans have food allergies. These eight foods are the cause of most food allergies:
tree nuts (such as walnuts and cashews)
Help may soon be on the way for kids with peanut allergies. A team of scientists tested 300 kinds of peanuts. They recently found one that is special. It is missing one of two major allergens. An allergen is something that causes an allergic reaction.
The peanut hunt is not over yet. Now scientists are looking for a peanut missing the other allergen. Once they find it, they will try to create an allergy-free peanut.
Scientists hope an allergy-free peanut will one day replace the more common peanut. That would make kids with peanut allergies very happy. ""Chris always has to be careful of everything he eats,"" said his mom. ""If he didn't have to do that, it would be wonderful!"" Chris agrees. ""I could have a peanut butter and jelly sandwich. I miss them.""
In what ways does science improve people's lives?
All trademarks and logos are property of Weekly Reader Corporation.
",1,WRLevel3,1,0.3086704909801483,0.4484722912311554,0.19560940563678741,0.023859821259975433,0.023388035595417023
292,"Have you ever listened to the sounds that paper makes? To composer Tan Dun, paper is music. He invented instruments made of paper and wrote music to play on them.
This October, a group of fifth graders were among the first to hear musicians perform Dun's piece. The big event was held at the newly opened Walt Disney Concert Hall in California.
Dun wrote the musical piece to celebrate the art of making paper. About 2,000 years ago, the world's first fine paper was invented in China. China is the country in Asia where Dun was born.
""Using your imagination, you can find music around you, even in paper! Music is everywhere if you just look for it,"" Dun told
During the concert, musicians made sounds with the instruments in different ways. They tore, shook, hit, and even sang through the paper. Bet you didn't know paper could be so musical!
All trademarks and logos are property of Weekly Reader Corporation.
",1,WRLevel3,1,0.23775552213191986,0.46783900260925293,0.25210726261138916,0.019881166517734528,0.022417107596993446
299,"Talk about lost and found! A team of scientists recently discovered some tiny critters in Indonesia. They are called pygmy tarsiers (PIG-mee TAWR-see-uhrss). Indonesia is a country in Asia.
Pygmy tarsier: Sharon Gursky-Doyen; Map: Leigh Haeger
Scientists thought this little creature was lost forever.
, or completely gone. Thats because no one had seen the animals alive for about 70 years.
. Primates are an animal group that includes humans, apes, and monkeys. The little fur ball is less than 4 inches long. It weighs about 2 ounces. It has wide eyes, big ears, and a long tail.
Scientists caught three pygmy tarsierstwo males and one female. They attached radio collars to their necks. Then they released the animals. When scientists return to Indonesia, they will track the collars to find and study the creatures.
Professor Sharon Gursky-Doyen helped find the critters. She told
, Its very exciting knowing that the animal does still exist.
All trademarks and logos are property of Weekly Reader Corporation.
",1,WRLevel3,1,0.2552591562271118,0.4721944332122803,0.22938306629657745,0.02004997804760933,0.02311333455145359
562,"Scientists recently made an amazing discovery. They found that the tiny island of Sri Lanka is jumping with frogs!
Sri Lanka is located in the Indian Ocean. Scientists discovered more than 100
, or kinds, of frogs living on the island.
quite a bit. ""[The frogs] range in size from about an inch to 4 inches and come in all colors,"" said one scientist. Some of the frogs live in trees. Others live on the leaf-covered ground.
The frog discovery is good news. It leads scientists to believe there may be more frog species in other places around the world.
All trademarks and logos are property of Weekly Reader Corporation.
",1,WRLevel3,0,0.4256264567375183,0.40728914737701416,0.11571380496025085,0.027334684506058693,0.024035949259996414
