Index,Text,Grade,Type,bert.2.pred,bert.2.prob.1,bert.2.prob.2,bert.2.prob.3,bert.2.prob.4,bert.2.prob.5
506,"The map shows how many Black Bears live in some states.
In which state so 50 to 150 black bears live?
About how many black bears live in Alaska?
In which state would you not find black bears?
About how many black bears live in Florida?
In which state dod 3,000 to 6,000 black bears live?
All trademarks and logos are property of Weekly Reader Corporation.
",0,WRLevel2,0,0.5709854364395142,0.29588770866394043,0.06898945569992065,0.03832187503576279,0.025815457105636597
293,"The Bowler family of England took a trip back in time last year. The Bowlers moved into a house that did not have electricity or a telephone. The Bowlers lived for three months as a family would live in the year 1900.
The family even had to wear clothes from the year 1900. The clothes were not comfortable. The girls wore long dresses that they often tripped on.
For fun, the Bowlers played card games. They also built a puppet theater and put on puppet shows.
TV cameras took pictures while the Bowlers lived in the old house. Those pictures were made into a TV program called
These are just a few of the rules the Bowlers had to follow while living in the 1900 house:
All meals had to be cooked using recipes from 1900. They seldom ate eggs or bananas because they were expensive.
The family had to use toothbrushes from 1900. They were made of pig and horse hair.
The family lived on the amount of money a 1900 family earned--about $36 per month.
All trademarks and logos are property of Weekly Reader Corporation.
",0,WRLevel2,0,0.4557383060455322,0.37250685691833496,0.11524973809719086,0.02886076085269451,0.027644343674182892
372,"Turn down the music! A new study shows that many young people have hearing damage. Health experts say one likely cause is MP3 players. Why? The music players send loud sounds straight into the ears.
They are tiny nerve endings in the inner ear. If a sound is loud enough, the damage can be
How can you tell whether your music is too loud? While listening to music, you should be able to hear someone talking from a few feet away. You can also ask friends whether they can hear music from your earphones. If they say yes, turn it down.
What else can you do to protect your hearing?
All trademarks and logos are property of Weekly Reader Corporation.
",0,WRLevel2,0,0.585002601146698,0.2820294499397278,0.06346982717514038,0.042553286999464035,0.026944752782583237
340,"Scientists recently studied black bears in Alaska. The bears hibernated for about six months. During that time, the bears breathing slowed down. Their heartbeats slowed too.
What barely changed? The bears body temperature! It dropped only a few degrees. That surprised scientists. Most animals that hibernate have a large drop in temperature.
As body temperature drops, the body slows down and uses less energy. It was surprising that hibernating bears were able to save so much energy without a large drop in body temperature, says Oivind Toien. He is the scientist who led the study.
A black bear hibernates in a den.
All trademarks and logos are property of Weekly Reader Corporation.
",0,WRLevel2,0,0.4801299571990967,0.3327300250530243,0.08962032198905945,0.06808240711688995,0.029437270015478134
17,"What begins with the words We the people? It is the Constitution of the United States. That is a written plan. It tells the
The Constitution is 221 years old. It was signed on September 17, 1787. At that time, the United States was a new country. It was made up of only 13 states. A group of leaders wanted to make the country better. That is why they worked together to write the Constitution.
Why is it important to have laws?
All trademarks and logos are property of Weekly Reader Corporation.
",0,WRLevel2,0,0.5673710107803345,0.2878517806529999,0.08025063574314117,0.03391628339886665,0.030610302463173866
138,"Many kids are excited about new toys that teach both Spanish and English. Many of the toys talk. Some toys also sing. There are dolls, games, and books. Toy companies think they will become more and more popular.
Hablas espaol? (Do you speak Spanish?) More kids are looking for toys that teach both Spanish and English.
spoke to toy expert Adrienne Citron. She said that kids of all
are interested in Hispanic television characters such as Dora and Diego. Culture is the way of life of a group of people.
""Any family can have fun with these new toys,"" says Citron. ""The toys are great. They let everyone be a part of the Hispanic culture!""
All trademarks and logos are property of Weekly Reader Corporation.
",0,WRLevel2,0,0.4940963685512543,0.33331266045570374,0.09600166231393814,0.0486576221883297,0.02793174982070923
62,"is one type of sea creature that lives in the oceans. When the porcupine fish is in danger, it swallows water and swells like a balloon. It then becomes too large and prickly for an enemy to eat. How do other sea creatures protect themselves?
Oceans are home to some of the most colorful animals in the world. Each sea creature uses a different skill to survive.
Angelfish usually swim in schools to protect themselves. That makes it hard for enemies to harm one fish in a group.
(uh-NEH-muh-neez). Those are poisonous ocean plants. Clown fish have a slimy coating on their bodies that protects them from the plants poison.
to hide from enemies. Animals that use camouflage change color or shape to blend in with their surroundings.
Mimic octopuses take on the color, shape, and behavior of other, more dangerous animals. The amazing task can be done in just seconds. To stay safe, this mimic octopus pretends to be a starfish.
Jellyfish are soft, clear sea creatures. Some jellyfish have long, poisonous arms called
Earth Day is April 22. This day reminds us to care for our planet.
Sometimes oil spills onto beaches and into oceans. People help sea birds by scrubbing their feathers clean of the oil.
It is important to keep beaches and oceans free of pollution. Pollution can harm animals and humans.
Garbage, like plastic rings from soft drink cans, can harm animals. Animals can get trapped in the rings holes.
What are some things you can do to protect oceans?
measures published under license with MetaMetrics, Inc.
All trademarks and logos are property of Weekly Reader Corporation.
",0,WRLevel2,0,0.4788065254688263,0.29070228338241577,0.09006495773792267,0.10093249380588531,0.03949378803372383
489,"Who do you think is the most important person in the world?
All trademarks and logos are property of Weekly Reader Corporation.
",0,WRLevel2,0,0.5076743960380554,0.32919445633888245,0.1004859134554863,0.03334979712963104,0.02929536998271942
184,"In the state where Whiskers lives, stores take back empty bottles and cans and pay the person 5 cents for each. Whiskers's class recycled cans and bottles by collecting and returning them. Read the word problems and write the correct answers on the lines.
Squeaky collected 10 cans in the park. How much money did he get when he returned them?
Quacker found 5 bottles and 10 cans in the playground. How much money did she get when she returned them?
Whiskers's neighbors gave him their cans and bottles. He got 72 in all! If he got 12 bottles, how many cans did he get?
Mr. Ross had kids recycle their cans and bottles. There were 525 in all. If 220 were bottles, how many were cans?
Why might it be a good idea to start a recycling program at school or at home?
All trademarks and logos are property of Weekly Reader Corporation.
",0,WRLevel2,0,0.5292914509773254,0.30143576860427856,0.07528059184551239,0.0636230930685997,0.030369093641638756
45,"China is a country in Asia. Study the maps to learn more. Then answer the questions below.
 What is the capital of China?
 What are the names of two rivers in China?
 Which ocean borders China on the east?
All trademarks and logos are property of Weekly Reader Corporation.
",0,WRLevel2,0,0.5861217975616455,0.2837350070476532,0.06854480504989624,0.034482404589653015,0.027116019278764725
47,"All trademarks and logos are property of Weekly Reader Corporation.
",0,WRLevel2,0,0.4517442584037781,0.33946001529693604,0.13424283266067505,0.04215367138385773,0.03239918872714043
620,"The United States government recently said it will clean up the Everglades. The Everglades are
in southern Florida. A wetland is an area of wet and spongy soil. Both pollution and construction have hurt the Everglades. A new law will now clean up and protect the Everglades. Over the next 36 years, the government will spend $8 billion to clean up pollution in the Everglades.
 The Everglades take up about 2,344 square miles. That's about the size of Delaware.
 The Everglades are the only place in the world where both crocodiles and alligators live.
 Other animals that live in the Everglades are snakes, turtles, birds, fish, deer, and the rare Florida panther.
All trademarks and logos are property of Weekly Reader Corporation.
",0,WRLevel2,0,0.42777955532073975,0.3839598596096039,0.13325172662734985,0.028433071449398994,0.02657577022910118
296,"Read about a monarch butterfly's life below. Then choose the correct answer to each question.
A female monarch lays an egg on the leaf of a milkweed plant.
A larva hatches from the egg. A larva is a caterpillar.
After a few weeks, the larva grows into a pupa. It forms a hard shell called a chrysalis.
In 10 to 14 days, a butterfly comes out of the chrysalis.
 Where does a female monarch lay eggs?
 on the leaf of a milkweed plant
 What does the pupa do in the chrysalis?
All trademarks and logos are property of Weekly Reader Corporation.
",0,WRLevel2,0,0.5838260054588318,0.27662962675094604,0.060059960931539536,0.052806828171014786,0.02667747251689434
63,"Mount Rushmore is a mountain in South Dakota. The faces of four U.S. presidents are carved on it. Now a special model is being made of Mount Rushmore.
What will make the model so special? It will be shown on a computer in 3-D! That makes pictures look more like the real object, instead of looking flat.
People are making the 3-D model for an important reason. If Mount Rushmore is ever damaged, it will need to be fixed. The 3-D model will show people what the carving looked like.
Mount Rushmore shows the faces of George Washington, Thomas Jefferson, Theodore Roosevelt, and Abraham Lincoln. Each face is as tall as a six-story building!
A landmark is a building or place that is special to an area. Americans want to make sure that Mount Rushmore will be here for a long time.
Why might people want to protect famous landmarks?
All trademarks and logos are property of Weekly Reader Corporation.
",0,WRLevel2,0,0.5080183148384094,0.3288643956184387,0.08613038808107376,0.048690102994441986,0.02829684130847454
462,"The sound of drums fills the air. People start to sing and dance. A
has begun. A powwow is a festival. It celebrates Native American life.
People sing songs in Native American languages. Some of the songs are old. Other songs are new. People sing to the beat of a drum. Dancers move to the beat. The drum is an important part of the powwow.
Dancers wear special clothes at a powwow. The clothes are made by hand. As the dancers get older, they add pieces to the clothes. Some of the pieces are gifts from family and friends.
People sell arts and crafts at some powwows. The artists make each item by hand. The arts and crafts often include beadwork, baskets, and pottery.
Fry bread is often found at powwows. The bread is sometimes used to make special tacos. People put meat, lettuce, tomatoes, cheese, and hot peppers on top of the bread. Then they roll it up and eat it.
Is it important to learn about Native American life? Why or why not?
measures published under license with MetaMetrics, Inc.
All trademarks and logos are property of Weekly Reader Corporation.
",0,WRLevel2,0,0.5805163979530334,0.27438145875930786,0.07426465302705765,0.039796579629182816,0.031040888279676437
127,"Scientists have never seen a living giant squid. They want to learn more about this huge animal that lives deep in the ocean.
Scientists believe giant squids live about a mile down in the ocean. They live in the coldest, darkest part of the ocean.
Recently, scientists traveled in submarines to look for the giant squid. Even with the light from the submarine, they could not see the huge giant squid.
The sperm whale is the giant squid's only enemy. Scientists attached video cameras to the heads of some sperm whales with suction cups. They hoped the cameras would take pictures of giant squids swimming. The cameras filmed other types of squids, but not the giant squid. For now, the giant squid remains a mystery.
What Does a Giant Squid Look Like?
A giant squid has eight arms and two
. A tentacle is like an arm, except it is much longer.
A giant squid can be 60 feet long and weigh 1,000 pounds.
A giant squid has huge eyes, as big as a kid's head.
A giant squid has a beak that looks somewhat like a parrot's beak.
Debra Ingrao works at Mote Marine Laboratory in Florida. Last year, Debra flew to New Zealand to bring back a dead giant squid to study. She talked to
I love the ocean and want to learn more about the sea animals living in it.
What do you love most about your job?
I enjoy studying sea animals in their natural habitats. [A
is the place where an animal lives.]
Why is studying the giant squid important?
Everything we learn helps us understand the deep sea better.
Should we be afraid of the giant squid?
Its large size is scary! But giant squids don't live where people swim.
What does a giant squid's skin feel like?
The skin is very smooth and a bit slimy.
Do you want to go on a search for a living giant squid in the future?
If I got to go on a search, it would be my wildest dream come true!
All trademarks and logos are property of Weekly Reader Corporation.
",0,WRLevel2,0,0.4766824543476105,0.3457117974758148,0.10131053626537323,0.048752136528491974,0.02754305861890316
283,"Look at the map of the Arctic. Then read the sentences. If a sentence is correct, choose
. If a sentence is incorrect, choose
Part of Alaska is inside the Arctic Circle.
The North Pole is inside the Arctic Circle.
All of Europe is outside the Arctic Circle.
The Arctic Ocean is inside the Arctic Circle.
Canada is part of the continent of North America.
All trademarks and logos are property of Weekly Reader Corporation.
",0,WRLevel2,0,0.6051487326622009,0.2663731276988983,0.0607367604970932,0.040588781237602234,0.027152573689818382
428,"Kids are helping keep track of monarchs. The kids are putting tags on the butterflies. The tags are tiny stickers. Each tag has a number on it. The number shows when and where each monarch was found.
Scientists look for monarchs with the tags. They want to keep track of them. Why? The number of monarchs is getting smaller. People are cutting down plants and trees where the butterflies live. Scientists want to learn more about monarchs so they can save them.
Why might scientists want to save monarch butterflies?
All trademarks and logos are property of Weekly Reader Corporation.
",0,WRLevel2,0,0.575928270816803,0.2789742946624756,0.057038791477680206,0.058184362947940826,0.029874268919229507
157,"An amphibian is an animal that lives part of its life in water and part on land.
The pickerel frog often lives near cool streams.
Frogs live on every continent except Antarctica. They can be found in many different places. Most frogs live near ponds and other wet places. They can be found in rain forests and deserts. Some live in caves. Some even live high in the mountains.
When frogs are hungry, they hunt for food. Whats on the menu? Almost anything that moves! Frogs eat insects, worms, snails, and other small animals.
A green tree frog catches a hawk moth.
using their sticky tongues. Prey are animals eaten by other animals. Frogs dont chew. They swallow their prey whole.
A frog hides in a pond filled with a water plant called duckweed.
water through their skin. To absorb is to take in. Although frogs have lungs, they also breathe through their skin. They can do that only when their skin is moist.
Frogs can become prey. Snakes, birds, and other animals eat them. Frogs often use their colors to stay safe. Some frogs hide with the help of
(KA-muh-flahzh). Their colors, patterns, or shapes help them match their surroundings. That is why many frogs are brown or green.
The strawberry poison dart frog is only about an inch long.
Other frogs are brightly colored. That warns animals to stay away. Bright colors mean that the frogs may taste bad or be poisonous.
Why might most frogs live near water?
measures published under license with MetaMetrics, Inc.
All trademarks and logos are property of Weekly Reader Corporation.
",0,WRLevel2,0,0.5057762861251831,0.3006186783313751,0.08217223733663559,0.07837606221437454,0.03305673599243164
492,"A new study shows that hibernating animals are less likely to die out. Why? Earths weather has been changing over time. Scientists say animals that sleep or hide are able to
the changes better. To survive is to stay alive.
Animals that sleep or hide are protected from nature, says scientist Bill Toone. That helps them survive.
A chipmunk hibernates during the cold days of winter.
Snakes will often hibernate next to one another to stay warm.
All trademarks and logos are property of Weekly Reader Corporation.
",0,WRLevel2,0,0.5585715174674988,0.31314149498939514,0.07057756930589676,0.03266342356801033,0.02504599839448929
446,"Students recently planted trees in Brechtel Park. It is in New Orleans, Louisiana. The park lost thousands of trees in 2005. A big hurricane hit the area then. Its name was Hurricane Katrina.
The students worked hard. They raised money to buy the trees. How? They sold T-shirts and had an art fair. The group planted about 100 trees.
The event was a great success, says Brad Philipson. He is a teacher at Metairie Park Country Day School. One day, these kids will come back and see how the trees have grown.
Courtesy of Metairie Park Country Day School
All trademarks and logos are property of Weekly Reader Corporation.
",0,WRLevel2,0,0.5175279974937439,0.316615492105484,0.08357539772987366,0.05475560575723648,0.02752554789185524
227,"The table shows our last five presidents, the years they served, and their political parties. Study the table. Then choose the correct answer to each of the questions.
How many of the past five presidents were Republicans?
Bill Clinton is one president who is a Democrat. Who was another?
In which year did George H. W. Bush become president?
George W. Bush Is Running for President
All trademarks and logos are property of Weekly Reader Corporation.
",0,WRLevel2,0,0.5434021949768066,0.3030496835708618,0.07835517078638077,0.04629693552851677,0.028896087780594826
214,"2008 is the Chinese Year of the Rat.
February 7 is Chinese New Year! The celebration lasts 15 days. Each Chinese year is named after one of 12 animals. This is the Year of the Rat.
People prepare for the holiday before the actual day. They clean their homes and decorate them with flowers and poems. The poems are happy messages of good luck. People also put out bowls of tangerines, oranges, dried fruits, and candy to wish visitors a sweet new year.
On the first night of the celebration, families and friends gather for a special meal. Many people wear new red clothing. They eat foods such as dumplings, fish, and long noodles. Sweet, sticky rice cakes are a favorite treat.
The Chinese New Year celebration ends with the Lantern Festival. It includes music, dancing, and fireworks. Kids carry lanterns in a parade under the light of a full moon. The highlight of the parade is the dragon dance. Dancers carry a long dragon made of silk, paper, and bamboo through the streets. The dragon may stretch more than 100 feet!
measures published under license with MetaMetrics, Inc.
All trademarks and logos are property of Weekly Reader Corporation.
",0,WRLevel2,0,0.4845340847969055,0.31651943922042847,0.12587621808052063,0.03362777829170227,0.03944244235754013
91,"Gnawing on wood helps keep a beaver's teeth trimmed.
Like people, animals have different teeth with special jobs. Some animals have sharp teeth, some have curved teeth, and some have round teeth. Open wide, and look inside to learn about different ways teeth are helpful.
Teeth are important for many reasons. They help animals chew food. Many animals need their teeth for survival.
has 42 to 44 teeth. It likes to eat plants. A hippo has round, flat back teeth to grind its food. When a hippo is angry, it opens its mouth and shows its big teeth.
have nearly 5,000 razor-sharp teeth. They lose thousands of teeth during their lifetime and grow new sets of teeth every two weeks.
has about 20 teeth. It uses its four strong, curved front teeth for gnawing trees and wood. It uses its back teeth for chewing food. A beavers front teeth never stop growing. Gnawing on wood helps keep its teeth trimmed.
has 30 teeth, which are not made for chewing. It has four large, pointed teeth that are used to capture and hold its food. Once the lion catches its food, it tears the meat and swallows it whole.
You will have 32 teeth by the time you are an adult. There are four different types of teeth. Each has a special job.
Brushing twice a day and flossing regularly will help keep your teeth healthy. It is also important to visit a dentist twice a year. A dentist is a doctor who cares for teeth.
In what ways do you use your teeth?
All trademarks and logos are property of Weekly Reader Corporation.
",0,WRLevel2,0,0.5579301714897156,0.24908432364463806,0.07432781904935837,0.08580813556909561,0.032849546521902084
301,"It's Thanksgiving time! Each fall, Americans celebrate this holiday on the fourth Thursday in November. This year it takes place on November 22.
The first Thanksgiving feast took place in 1621. The Pilgrims and Native Americans had a feast to celebrate the
. A harvest is a gathering of food that has been grown.
That harvest feast helped start the American tradition of Thanksgiving. Today, people still share food with their families and friends on this special day.
All trademarks and logos are property of Weekly Reader Corporation.
",0,WRLevel2,0,0.506978452205658,0.3396693468093872,0.09385938942432404,0.03394792601466179,0.025544898584485054
311,"second graders voted for their favorite dinosaurs. The graph below shows the number of votes the top five dinos recieved. Use the graph to answer the questions. Choose the correct answer to each question.
All trademarks and logos are property of Weekly Reader Corporation.
",0,WRLevel2,0,0.557549238204956,0.29915204644203186,0.08598645031452179,0.029144687578082085,0.028167665004730225
546,"About 47 million American kids went back to school in September. Some live in cities that do not have big enough schools for all the kids. Some of those cities do not have space or money to build new schools.
That is why some cities are turning empty shopping malls into schools. Stores become classrooms, and restaurants become lunchrooms. Making a mall into a school is faster and costs less than building a new school.
All trademarks and logos are property of Weekly Reader Corporation.
",0,WRLevel2,0,0.5302518606185913,0.3062686324119568,0.0995880588889122,0.036969173699617386,0.026922157034277916
560,"The first modern Olympics were held in Athens, Greece, in 1896. Some of the sports that year included golf and tug-of-war.
The symbol for the Olympics is five joined rings. At least one of the colors of the rings, including the white background, can be found in the flag of every country in the world.
The Olympic torch is lit in Greece. The flame is taken to the country where the Olympic Games are being held. The torch is then carried through that countrys major cities. Many different people take turns carrying the torch. Once the Games are over, the flame is put out.
All trademarks and logos are property of Weekly Reader Corporation.
",0,WRLevel2,0,0.4427874982357025,0.372957706451416,0.13016732037067413,0.0284410510212183,0.02564641460776329
493,"Our solar system is made up of the sun and eight
. A planet is a large ball made of rock or gas. Each planet
, or travels around, the sun. The sun is at the center of the solar system.
The planets in our solar system are all different sizes.
is a star. It is a ball of hot gas. It gives off light and heat. Why does the sun look different from other stars? The sun is the star closest to Earth.
is the closest planet to the sun. It is also the smallest. It has mountains and
. Craters are holes in the ground that were made when space rocks crashed into it.
is the hottest planet. It is hot enough to melt a rocket ship. Venus is about the same size as Earth.
is our home. It is also the only planet with oceans. In fact, Earth is covered mostly with water. That is why it is called the Blue Planet.
is called the Red Planet. It has reddish dirt. It also has mountains, volcanoes, ice caps, and
. A canyon is a deep, narrow valley with steep sides.
is the largest planet. It is made of thick gases. Very strong winds blow on this planet.
is the second-largest planet. It has rings around it. The rings are made of rock, dust, and ice.
was the first planet to be discovered using a telescope. It is cold and windy here.
is the coldest planet because it is farthest from the sun. The planet is made of gases.
measures published under license with MetaMetrics, Inc.
All trademarks and logos are property of Weekly Reader Corporation.
",0,WRLevel2,0,0.5038117170333862,0.2812662124633789,0.07758289575576782,0.10089711844921112,0.03644207492470741
