Index,Text,Grade,Type,bert.2.pred,bert.2.prob.1,bert.2.prob.2,bert.2.prob.3,bert.2.prob.4,bert.2.prob.5
144,"Nine-year-old Ben Duskin is reaching out to kids who have a serious disease called cancer. Ben invented a video game for kids about fighting cancer.
Ben, who is from California, is no stranger to the disease. He learned that he had a type of cancer called leukemia when he was five years old.
Why did Ben invent the video game? When he was in the hospital, he relied on video games to take his mind off being sick. That inspired him to help other kids who have cancer.
The result is ""Ben's Game""--named after its creator. The game takes place inside the body and stars a boy hero who moves around the screen on a skateboard. The boy is modeled after Ben. The object of the game is to blast cancer cells.
Thanks to the Make-A-Wish Foundation, Ben's idea became a reality. The foundation helped Ben work with a software designer to create his video game. Ben's game is now available free online. To play, visit
measures published under license with MetaMetrics, Inc.
All trademarks and logos are property of Weekly Reader Corporation.
",2,WRLevel4,2,0.1517614871263504,0.35810595750808716,0.4317616820335388,0.02332192473113537,0.035049039870500565
492,"On March 22, Kelsey Penfield, age 9, was working at her desk at Maplehurst Elementary Schook in Norwalk, Ohio. She was also chewing her pen cap. Suddenly, she swallowed the cap.
The pen cap became lodged in Kelsey's throat, and she began choking on it. She tried coughing up the cap, but the cap wouldn't move. Unable to breathe, Kelsey began pointing at her throat.
Kelsey's classmate Elizabeth Muirhead, age 9, realized that Kelsey was choking. Elizabeth immediately sprang into action and performed the Heimlich maneuver on her classmate, saving her life.
Elizabeth had learned the Heimlich maneuver in an issue of
caught up with the two girls to ask them about that fateful day.
: What happened the day that Kelsey started choking?
We were in class doing our grammar work. That's when Kelsey started choking. There was a boy between us, but he didn't know what was going on. Kelsey was pointing to her neck. I asked her if she was choking, and she nodded. That's when I ran over to her and did the Heimlich maneuver.
What were your thoughts? Were you scared?
: I was really scared. The first time I tried the Heimlich, I didn't do it that hard. I was afraid of hurting Kelsey. The second time, I squeezed a little harder. Then the third time, the pen cap just flew out. All the time I was thinking that Kelsey is my best friend and I'm not going to let her die.
How did you know how to perform the Heimlich maneuver?
: We read about it in an issue of
. Mrs. Moore put us in groups of two, and we practiced doing it.
: Kelsey, What was this experience like for you?
: I was really scared. I was chewing on a pen cap, and all of a sudden it slid down my throat. I couldn't breathe. I'm not going to chew on pen caps anymore. You shouldn't really chew on anything. You never know when you can accidentally choke.
1. Stand behind the choking victim and wrap your arms around his or her waist.
2. Make a fist and hold it against the victim's stomach, about halfway between the belly button and the rib cage.
3. Grab your fist with your other hand. Press it in with an upward thrust. Repeat until victim stops choking.
All trademarks and logos are property of Weekly Reader Corporation.
",2,WRLevel4,2,0.1533791720867157,0.3114358186721802,0.4572996497154236,0.030066631734371185,0.04781874269247055
735,"Kids say things on the Internet that they would never say face-to-face
When 13-year-old Katie recently went online, she couldn't believe that some classmates were making fun of her. The seventh grader from New Jersey discovered mean and hurtful comments written about her in an online Web journal.
""It was really offensive and upsetting to me because I knew everyone could see it online,"" Katie told
. ""There was nothing I could do to take it down.""
Katie's story is not unusual. She is one of the many victims of
. ""Cyberbullying is when a child torments, humiliates, or tries to frighten another child using interactive technology,"" online safety expert Parry Aftab told
Instead of teasing or picking on kids in the school yard, bullies have new territorycyberspace. The explosion in technology, such as computers, cell phones, and interactive games, gives bullies more places to do their dirty work.
Cyberbullies use e-mail, instant messages, text messages, and online journals to spread nasty rumors, post embarrassing photos, and tease other kids. Breaking into others' e-mail accounts and sending out mean messages to their buddy lists is a common practice for cyberbullies. Cyberbullies also run up other kids' cell phone bills with text messages. Some kids have even conducted online votes for the ugliest person in class.
For many kids like Katie, online bullying has become part of everyday life. Most cyberbullies are between the ages of 9 and 14. Studies show that about 55 percent of kids in grades 4 through 8 have had mean or hurtful remarks made to them online. ""Cyberbullying is a huge problem in fourth, fifth, and sixth grades,"" said Aftab.
Why is cyberbullying such a growing problem? For starters, kids spend a lot of time online at both home and at school. Nearly two-thirds of American kids have computers in their homes, according to the U.S. Census Bureau.
Online experts say being mean online is easier because computers give kids a sense of being
, or not being known. Kids say things on the Internet that they would never say face-to-face.
Some kids also don't realize that they're cyberbullies because they don't see the consequences of their actions. ""In face-to-face communication, we see when we've gone too far,"" she says. ""We lose all those visual cues online.""
To address the problem, more schools and communities are educating kids about online etiquette and are holding anti-bullying seminars. Aftab trains groups, called TweenAngels and TeenAngels, to become safe and responsible cybercitizens who share their knowledge with others.
TeenAngel Kendall, 12, experienced cyberbullying when kids at school blocked him out of gaming sites. His advice for dealing with a cyberbully: ""Don't be afraid to tell your parents, teachers, or whomever you trust the most.""
, or fight, cyberbullying, is to take a stand against it. ""The only way cyberbullying will stop is if kids protect each other,"" says Aftab. ""If you stand by and let someone else hurt someone, you're part of the problem. You need to be part of the solution.""
Online safety experts offer the following tips to protect yourself from cyberbullying:
Don't give out your passwords or any private information to anyone, even close friends.
Don't post any information online that you don't want others to read.
Don't answer a mean or threatening e-mail, block the person who sent you the offensive message, and tell a trusted adult. That person can help you take action.
Don't react to a mean message. Walk away from the computer and do something else that you enjoy for a few minutes.
Run your name through search engines, such as Google, to check whether there is information that you don't want on the Internet. Some search engines let you set up alerts that send you an e-mail if a new posting includes your name.
How is face-to-face communication similar to or different from sending a message by e-mail or IM?
measures published under license with MetaMetrics, Inc.
All trademarks and logos are property of Weekly Reader Corporation.
",2,WRLevel4,2,0.07989031821489334,0.13800747692584991,0.5561926960945129,0.05900145694613457,0.16690798103809357
745,"William Jefferson Clinton is the 42nd president of the United States. He has been the president since 1993. He will leave office when the next president takes the oath of office on January 20, 2001. Recently, Bill Clinton answered questions from
What were the most important accomplishments of your presidency?
I think that one of the most important things I've accomplished was helping to strengthen our economy so that more Americans have jobs and more families can afford to buy homes and send their kids to college.
I'm particularly proud of a new program created in 1993 called AmeriCorps, which gives young people a chance to serve their communities while earning money for college.
What advice would you give the new president?
A president has tremendous responsibilities-- from keeping our economy growing to working with foreign leaders and commanding our armed forces. The president is the leader, but he or she can't do the job alone. So my advice is build a strong team, stay focused on your priorities, and make every day count.
Why should kids be proud to be Americans?
We should all be proud to be Americans because this truly is a land of opportunity. Regardless of your background, you can work hard and achieve your dreams. You may face challenges or obstacles along the way, but if you set your sights high, work hard, and stick to your priorities, you can achieve your goals.
What has been the best part of being president?
The best part of being president has been having the opportunity to make America a better place. Every day, I have the chance to make a difference in people's lives.
After being president for eight years, what will you do now?
The first lady and I recently bought a new home in Chappaqua, N.Y., and I look forward to spending more time there. I also plan to spend time in Arkansas putting together my presidential library and launching a new public policy center. I'm sure I'll be very busy, but I also hope to spend more time with my family and friends and to simply relax after what has been eight of the most incredible years of my life.
William Jefferson Blythe IV was born on August 19, 1946, in Hope, Arkansas.
In 1962, when Clinton was a senior in high school, he was chosen to go to Washington, D.C., to participate in Boys Nation, a special youth conference. There he met President Kennedy. After that, he said, he knew he wanted to make a difference in the lives of Americans by becoming a U.S. president.
Clinton went to Georgetown University, after which he studied at Oxford University in England. He then went to law school at Yale University.
In 1976, Clinton was elected attorney general of Arkansas. He later was elected governor of Arkansas.
In 1991, Clinton decided to run for president of the United States.
measures published under license with MetaMetrics, Inc.
All trademarks and logos are property of Weekly Reader Corporation.
",2,WRLevel4,2,0.11944900453090668,0.18786495923995972,0.3826945126056671,0.06357251852750778,0.2464190423488617
462,"Where does famous TV puppet Howdy Doody belong? That was the question that a court in Hartford, Connecticut, had to answer. The court recently decided that Howdy belongs to a museum in Detroit, Michigan.
, the first children's TV show seen across the country. The show was aired between 1947 and 1960. It featured host Buffalo Bob and his sidekick puppet, Howdy Doody.
When watching the show, kids saw Howdy on their TV screens, but they never saw the man who controlled the puppet--Rufus Rose. When the show ended, Rose kept Howdy. After Rose died, his children held on to Howdy.
However, officials at the Detroit Institute of Arts said that Rose had promised to donate the puppet to the museum. Rose's family didn't want to give up the puppet, and the two sides asked a court to decide Howdy's fate.
The court decided that Rose promised to donate Howdy to the museum. Soon, adults can be kids again when they visit with their old friend Howdy Doody.
All trademarks and logos are property of Weekly Reader Corporation.
",2,WRLevel4,2,0.1505705863237381,0.3172335922718048,0.4718259572982788,0.02350698970258236,0.036862898617982864
645,"A new fashion trend has hit some public schools across the country. More schools are requiring students to wear uniforms or are enforcing stricter dress codes.
Students at Lakeside Elementary School in Cincinnati, Ohio, said good-bye to jeans, T-shirts, and oversized, baggy clothes this school year. Instead, they must wear tan, navy, or black pants and shirts with a collar. Girls are also allowed to wear jumpers or skirts.
The students in Ohio are not alone. From California to New York, an estimated 11 million public schools
, or require, dress codes for students.
Some people support the idea of dress codes. School officials say that dress codes often improve discipline and lessen teasing and bullying. Students focus on schoolwork instead of fashion.
""I like uniforms,"" Brittany, a student at Lakeside, told
. ""No one judges you, because you are wearing the same thing that they are.""
Some parents say that another benefit of wearing uniforms is that it saves money. They think uniforms are less expensive than designer clothes.
Not all people are in favor of dress codes. Some parents say that dress codes
, or go against, kids' freedom of expression. That right is guaranteed in the First Amendment to the U.S. Constitution.
These students do not have to follow a dress code.
Others argue that dress codes take away their kids' creativity by preventing them from choosing what to wear. Maggie, a student at Lakeside, told
that she doesn't like to wear a uniform, because ""all the outfits are the same.""
Some parents don't agree that buying uniforms is less expensive. They say it can be costly to purchase clothes to meet dress codes.
Should public schools have dress code policies?
All trademarks and logos are property of Weekly Reader Corporation.
",2,WRLevel4,2,0.1181710958480835,0.21775782108306885,0.5863649845123291,0.025154395028948784,0.052551716566085815
625,"Pilot whales are members of the dolphin family.
A happy ending took place off the southern coast of Florida in August. Five pilot whales were released back into the ocean. Pilot whales are members of the dolphin family.
Rescue workers had nursed the whales back to health after the creatures had become stranded in shallow water in April. Their return to the water marked the first time in history that five whales stranded at the same time were returned to the ocean together.
Using a crane, volunteers lowered the whales headfirst into the water. The whales had been fitted with special devices for scientists to track their progress. As the whales swam away, many volunteers cheered. Some were moved to tears.
Later in the day, people in a helicopter spotted the whales swimming together. Rescuers hoped that the five would join a larger group of nearby whales.
""Walt Disney couldn't write a story better than this,"" said one animal-care worker.
All trademarks and logos are property of Weekly Reader Corporation.
",2,WRLevel4,2,0.14628763496875763,0.36191728711128235,0.43714138865470886,0.021979790180921555,0.03267381340265274
248,"Weekend meals for thousands of hungry U.S. children
Each Friday, 8-year-old Cody Lozano and his older sister, Cherokee, 9, carry heavy backpacks home from school. Their backpacks are not stuffed with books and supplies. Instead, they are loaded with nutritious food.
The two siblings are members of the BackPack club at Douglas Elementary School in Tyler, Texas. Before they head home on Fridays, students in the club are given backpacks stuffed with donated food for the weekend. The goal of the program is to help kids who face hunger. ""This BackPack club is great for Cherokee and Cody,"" their mother, Karen Lozano, told
""The kids dont have to go hungry.""
Cody and Cherokee are among the nearly 14 million children in the United States whose families dont have enough money to buy food, according to the U.S. Department of Agriculture. Free school meal programs help some of those kids during the week, but they still need to eat on the weekends.
Thats where the BackPack program lends a hand. ""We purchase the backpacks and the food, and volunteers [stuff] the backpacks and distribute them,"" says Robert Bush, the executive director of the East Texas Food Bank in Tyler. BackPack programs operate in 39 states to help thousands of hungry children.
Although the BackPack program is one way to help, people are looking for solutions to end
(Poverty is the state of being poor.) About 38 million Americans go hungry each year, and many of those are children. With Thanksgiving around the corner, many people will be thinking about what they can do to help.
of U.S. families cant afford enough food to eat.
children in the United States lives in poverty.
, USDA, Second Harvest, U.S. Census Bureau
To find out how you and your classmates can help the BackPack club, visit
All trademarks and logos are property of Weekly Reader Corporation.
",2,WRLevel4,2,0.103805772960186,0.273125559091568,0.5538466572761536,0.02362220361828804,0.0455998033285141
155,"Report Points to Mice As Asthma Cause
17 million Americans suffer from asthma. About 5 million kids suffer from asthma.
Each year, more than 3 million kids visit the doctor's office because of asthma attacks.
When you run hard and play hard, you may have trouble catching your breath. Some kids, however, lose their breath even when they're not running or playing. Those kids have
, a disease that makes it hard to breathe.
For many years, scientists have known that cigarette smoke, dog and cat
, dust mites, and cockroaches can trigger asthma attacks. Dander is tiny bits of fur and skin. Now scientists have added a new culprit to that list--mouse dander.
Scientists studied dust samples from 608 U.S. homes with children ages 4 to 9 who suffered from asthma. The scientists found many things in the dust, including evidence of mice. About 95 percent of the homes had at least one room that had mouse dander.
The scientists then tested the kids in each of the homes to see if mouse dander triggered asthma attacks in them. The dander triggered attacks in 18 out of every 100 kids.
As a result of those tests, Dr. Robert Wood of Johns Hopkins University concluded that mice trigger many asthma attacks. In fact, he said, the ""mouse is second in line [after the cockroach in causing asthma attacks].""
Mouse dander was found in many of the houses, even though not all of them had mice. Sometimes, kids tracked dander from mice and other animals into their homes when they came in from outside. Sometimes, the dander was from mice that had been in the home in the past.
Daniel, who lives in Clarksville, Maryland, suffers from asthma. Last year, scientists collected and studied dust from his home. The scientists found cat dander in the dust, even though his family didn't own a cat. It was cat dander that was triggering Daniel's asthma attacks, said Daniel's doctor.
To keep cat dander out of their home, Daniel and his mother frequently wash the floors, walls, and other surfaces. As a result, Daniel's mother said Daniel hasn't had an asthma attack in the last year.
Many kids who suffer from asthma might be able to breathe more easily if they could find ways to keep the dander of mice, cats, and other kinds of animals out of their homes.
measures published under license with MetaMetrics, Inc.
All trademarks and logos are property of Weekly Reader Corporation.
",2,WRLevel4,2,0.07580873370170593,0.17613442242145538,0.6117783188819885,0.0371084064245224,0.0991700068116188
658,"On August 13, after finishing basic training, more than 1,100 men and women marched into West Point, New York. They are now students at the United States Military Academy - part of the ""long gray line"" of students that stretches back 200 years.
The long gray line is what all the students who have ever attended West Point are called. The term refers to the color of the uniforms that the
, or military students, wear. It also reminds the cadets that they are part of a long tradition, which celebrates its 200th anniversary this year.
On March 16, 1802, President Thomas Jefferson founded a school to train military officers and teach engineering. The school was established at West Point, which had been used as a fort.
The school's first class of students was smaller than the one that entered this year. In 1802, only two students were enrolled at the school. The youngest was 10 years old!
When West Point was founded, the United States was much smaller than it is today. The country extended from the Atlantic Ocean to the Mississippi River.
Until 1817, West Point did not have a set course of study. In that year, Sylvanus Thayer was appointed the superintendent of West Point. He developed the school's curriculum and turned West Point into one of the best schools in the United States. George Woodbridge, who graduated from the school in 1826, explained Thayer's accomplishment, saying, ""His object was to make [us] gentlemen and soldiers.""
The officers who graduated from West Point helped build and defend the United States. They explored the vast areas west of the Mississippi River. They designed the roads, bridges, dams, railroads, and canals that the United States needed as it grew. They also helped design some of our greatest buildings and monuments. For example, they worked on the Capitol, the Washington Monument, the Lincoln Memorial, and the base of the Statue of Liberty.
Many of the school's graduates have gone on to play important roles in U.S. history. They have been famous generals and U.S. presidents. Both President Ulysses S. Grant and President Dwight D. Eisenhower were generals and graduates of West Point. Jefferson Davis, the president of the Confederate States of America during the Civil War, also graduated from West Point.
Even though all West Point graduates serve America in different ways, they all share important lessons learned at the academy. For example, they learn about taking responsibility for one's actions. They also share the school's motto. ""Always there echoes and reechoes in my ears [the motto]: Duty. Honor. Country,"" said General Douglas MacArthur, a West Point graduate.
George Washington Whistler graduated from West Point in 1819. He spent most of his career building railroads. He also built steam locomotives.
While building his first locomotive, Whistler also built the first American train whistle. He placed his whistle on top of the locomotive. He called his locomotive the Whistler. The sound of Whistler's whistle can still be heard on old steam locomotives.
All trademarks and logos are property of Weekly Reader Corporation.
",2,WRLevel4,2,0.0944017842411995,0.16020426154136658,0.53148353099823,0.055885303765535355,0.15802507102489471
391,"Michelle Wie has gone pro! She is the fourth woman and the youngest person ever to play on the Professional Golf Association tour. Just days before her 16th birthday, she announced her decision to become a pro golfer.
Michelle was born in Hawaii and began playing golf at the age of 4. She practiced at least three hours a day after school and seven to eight hours on weekends.
The following professional women golfers have won the most major championships. Who knows how Michelle might eventually stack up?
How many championships have Patty Berg, Mickey Wright, and Louise Suggs won altogether?
All trademarks and logos are property of Weekly Reader Corporation.
",2,WRLevel4,1,0.30108508467674255,0.44568508863449097,0.20440702140331268,0.02066059224307537,0.028162231668829918
115,"Who gets burger bragging rights? A meaty battle is sizzling among three states over the history of the hamburger. In Texas, lawmaker Betty Brown proposed a bill declaring Athens, Texas, the home of the hamburger. Wisconsin has also jumped into the food fight. State Representative Tom Wilson argues that Seymour, Wisconsin, is the place where the famous sandwich was invented.
Not so fast, say the owners of Louis' Lunch in New Haven, Connecticut. Established in 1895, the restaurant is maintaining its claim as the burger birthplace. ""It's a well-known and established fact that New Haven is the home of the hamburger,"" says New Haven Mayor John DeStefano Jr. ""In fact, New Haven's claim to the hamburger is even supported and documented in the Library of Congress.""
All trademarks and logos are property of Weekly Reader Corporation.
",2,WRLevel4,2,0.16691845655441284,0.3656049072742462,0.41516125202178955,0.02125704474747181,0.03105834499001503
