Index,Text,Grade,Type,bert.2.pred,bert.2.prob.1,bert.2.prob.2,bert.2.prob.3,bert.2.prob.4,bert.2.prob.5
17,"What begins with the words We the people? It is the Constitution of the United States. That is a written plan. It tells the
The Constitution is 221 years old. It was signed on September 17, 1787. At that time, the United States was a new country. It was made up of only 13 states. A group of leaders wanted to make the country better. That is why they worked together to write the Constitution.
Why is it important to have laws?
All trademarks and logos are property of Weekly Reader Corporation.
",0,WRLevel2,0,0.760039746761322,0.17002470791339874,0.036897242069244385,0.01859382726252079,0.014444530010223389
274,"Winter brings many holidays, they are celebrated in different ways. Bright lights are a part of each one. Read below to learn more!
Cast a glow on winter's dark nights.
Ramadan lanterns burn bright as can be,
All of the holiday lights have good reason,
U.S. Department of Health and Human Services
Hanukkah is a Jewish holiday that lasts for eight nights.
Hanukkah is a Jewish holiday. It is celebrated for eight nights. On each of the eight nights, a candle is lit in a special candleholder called a
Christmas is a Christian holiday. It is celebrated in most places on December 25. People sing carols, set up mangers, and decorate trees with ornaments and strings of lights.
Las Posadas is a Hispanic holiday. This holiday is celebrated for nine nights. On the last night, people carry candles to light their way while walking in a special parade.
U.S. Department of Health and Human Services
Kwanzaa lasts for seven nights and is a celebration of family, community, and culture.
Kwanzaa is an African American holiday. It lasts for seven nights. Each night, people eat special foods and light candles in a special candleholder called a
Ramadan is an Islamic holiday. It is celebrated for one month. During this holiday, children carry a special lantern called a
Diwali is a Hindu holiday. This holiday is celebrated for five days. At night, people light candles and oil lamps called
to brighten their houses and the streets.
How do you celebrate the winter holidays with bright lights?
All trademarks and logos are property of Weekly Reader Corporation.
",0,WRLevel2,0,0.7485072612762451,0.1770562082529068,0.04587574675679207,0.013651722110807896,0.014909015037119389
345,"The table shows how many medals the United States won in past Olympic Winter Games. Choose the answer to each question.
How many medals did the United States win in 1980?
In which year shown did the United States win 11 medals?
In which two years did the United States win the same number of medals?.
How many total medals did the United States win in 1980 and 1984?
In which year shown did the United Staes win the fewest medals?
How many more medals did the United States win in 1980 than in 1984?
All trademarks and logos are property of Weekly Reader Corporation.
",0,WRLevel2,0,0.7794909477233887,0.15300795435905457,0.04195587709546089,0.012209218926727772,0.013336083851754665
371,"The map below shows the continent of South America. Use the map and the key to answer the questions below.
South America is bordered on the east by the __________ Ocean.
The rain forest __________ covers the northern part of South America.
All trademarks and logos are property of Weekly Reader Corporation.
",0,WRLevel2,0,0.7684453725814819,0.16517676413059235,0.03903057053685188,0.01399655919522047,0.013350744731724262
319,"People often confuse spiders with insects. The chart below shows some of the differences between spiders and insects. Use the chart to correctly answer each question.
How many legs does an insect have?
All trademarks and logos are property of Weekly Reader Corporation.
",0,WRLevel2,0,0.8046720623970032,0.13110525906085968,0.03745650127530098,0.012761135585606098,0.014005158096551895
406,"November 4 is Election Day. On that day, Americans will vote for the person to be the countrys top leader. They will
, or choose, the next president of the United States. John McCain and Barack Obama are running for president. Learn more about them below.
McCain with wife and dogs: courtesy of JohnMcCain.com
John McCain and his wife, Cindy, sit with their two dogs, Coco and Sam.
He is married to Cindy McCain. They have four sons and three daughters.
If John McCain wins, he will be the oldest person to become president.
John McCain has many petsthree parakeets, two dogs, two turtles, a cat, a ferret, and 13 fish. He loves watching sports. His favorites are basketball, football, and baseball.
Barack Obama, his wife, Michelle, and their daughters, Malia and Sasha, wave to a crowd.
He is married to Michelle Obama. They have two daughters.
If Barack Obama wins, he will be the first African American to become president.
Barack Obama is left-handed. He loves hot sauce. His favorite meal to cook is chili. He exercises every morning. He likes to jog and play basketball.
Why is it important for people to vote?
All trademarks and logos are property of Weekly Reader Corporation.
",0,WRLevel2,0,0.6281997561454773,0.2686234414577484,0.07932288944721222,0.010365858674049377,0.01348807755857706
236,"Our world is filled with wild and weird creatures. Scientists say that there are millions of creepy crawlers for each person on Earth. Take a look at some of those creatures.
Arachnids and insects are two types of creepy, crawling creatures.
(ah-RAK-nidz) have eight legs. Scorpions and spiders are arachnids.
have fangs and stingers. Some scorpions' skin can glow in certain types of light. Many scorpions live in deserts around the world.
are yellow. That helps them stay hidden. The spiders wait on the inside of flowers. They hide there to catch insects for food.
have six legs. Goliath beetles and katydids are two kinds of insects.
can grow to be 6 inches long. The beetles are so large that some people say they sound like helicopters when they fly.
are covered in spikes and horns. They may look scary but are harmless. Their look is meant to scare other insects away.
Both arachnids and insects are invertebrates (in-VEHR-teh-brayts). They are animals with no backbone! Here are two more invertebrates that squirm and wiggle.
have a body part that makes a slimy liquid. As the slugs wiggle, the slime helps them slide and squirm along.
have about 230 legs and many body sections. Together, the legs and body sections help millipedes wiggle around.
All trademarks and logos are property of Weekly Reader Corporation.
",0,WRLevel2,0,0.7590206861495972,0.1671418994665146,0.04069455340504646,0.01928994432091713,0.013852961361408234
381,"Stay safe while having a super summer.
Grab your beach towel and sunglasses! Summer is just around the corner. It starts on June 21. For most kids, that means more time to play outside. Experts say that more injuries occur during summer. Follow these tips to make sure you have a safe summer.
Many kids will spend hours playing outside in the summer sun. Be careful, though. The suns rays can be harmful. They can cause damage to your skin and eyes.
If you are out in the sun, be sure to wear sunscreen. Experts say it should have a
(SPF) of 30 or higher. The SPF number lets you know how much the sunscreen protects your skin from the sun. Make sure you rub it in everywhere your skin is showing.
You should also wear a hat and sunglasses. They protect against the suns harmful rays. Better yet, play in the shade!
What is one way to beat the heat? Splash in a pool! Just be sure to follow water-safety rules. Always swim with a grown-up watching you. You should also swim with a buddy. A buddy can tell others if someone needs help. If you dont know how to swim, stay in the
end. Something that is shallow is not deep.
Biking and in-line skating are great ways to get exercise. To stay wheel safe, always wear a helmet. It protects your head and brain if you fall. If you are in-line skating, also wear wrist guards, elbow pads, and kneepads.
What other ways can you stay safe this summer?
measures published under license with MetaMetrics, Inc.
All trademarks and logos are property of Weekly Reader Corporation.
",0,WRLevel2,0,0.7404332160949707,0.18497079610824585,0.04676024615764618,0.014493430964648724,0.013342268764972687
553,"Can dogs help children read? Two dogs are doing just that at a library in New Jersey! Children read aloud for 20 minutes as furry friends Emma and Sophie listen. Emma is an English Labrador, and Sophie is an English sheepdog.
or listeners, for beginning readers who may feel nervous. ""We hope that children find the program fun and that they want to come back,"" Ann Woodrow, youth services librarian, told
. She also said she hopes children connect reading with fun.
All trademarks and logos are property of Weekly Reader Corporation.
",0,WRLevel2,0,0.6871429085731506,0.22271215915679932,0.06581642478704453,0.01029349397867918,0.014034970663487911
205,"invented in 1906 by Frank Henry Fleer
invented in 1948 by George de Mestral
People have been inventing things for years. Paper was invented about 2,000 years ago. The wheel was invented more than 5,000 years ago. What would life be like without paper to write on or bikes to ride? Those inventions have made life easier.
The Wright brothers invented the first airplane in December 1903. That makes 2003 the 100th anniversary! Before the airplane was invented, most people traveled by cars, boats, and trains. Today, airplanes help people travel faster. How do airplanes help you?
Alexander Graham Bell invented the telephone in 1876. Before the telephone was invented, people kept in touch by writing letters or talking in person. Today, the telephone makes it easier for people to talk to one another. How do telephones help you?
The first four-wheeled gas-powered car was invented by Karl Benz in 1891. Before people had cars, they couldn't travel easily. They walked or rode horses for short trips. They took trains or boats for long trips. Today, cars are one of the main ways people travel. How do cars help you?
What are some other inventions that have changed our world?
People worked for years to make the first computer. It was built in 1946. The first computer was called ENIAC. Today, computers are an important part of many people's lives. People use computers as tools to write, get information, and much more. How do computers help you?
measures published under license with MetaMetrics, Inc.
All trademarks and logos are property of Weekly Reader Corporation.
",0,WRLevel2,0,0.7253510355949402,0.18357256054878235,0.060499146580696106,0.016270490363240242,0.01430672500282526
211,"Large colorful globes are popping up around our planet. They are part of an art project called Cool Globes. Artists are creating the globes to remind people to take care of our planet.
The project began in 2007 in Chicago, Illinois. The exhibit then traveled to other U.S. cities. This month, the globes will be in London, England.
People can take simple actions to help Earth, says Wendy Abrams. She is the person who came up with the idea of Cool Globes. We all have the power to do something, and together we can have an
, she says. An impact is the power of something to cause changes.
All trademarks and logos are property of Weekly Reader Corporation.
",0,WRLevel2,0,0.6311644911766052,0.2753589451313019,0.06963523477315903,0.011706001125276089,0.012135271914303303
106,"The chart shows pictures of three rain forest frogs and facts about them. Read the chart. Circle the answer to each question below.
1.  Which frog on the chart is about 1 inch long?
     poison arrow           red-eyed tree
2.  What does the red-eyed tree frog eat?
     tree branches          insects
3.  Which frog can be blue, yellow, or red?
     Wallace's flying       poison arrow
4.  Which frog can fly or glide from one tree to another?
     red-eyed tree           Wallace's flying
All trademarks and logos are property of Weekly Reader Corporation.
",0,WRLevel2,0,0.7396396398544312,0.1488807499408722,0.07618673890829086,0.013938556425273418,0.021354330703616142
264,"Spring brings warmer weather. That weather melts any snow and ice left from winter. The melted water trickles through streams and rivers and into lakes and oceans. Trickling water is an important part of life for animals and plants.
Spring brings baby birds. Baby birds usually hatch during the spring. The birds chirp loudly to their mothers and fathers. When baby birds are chirping, they seem to be saying, ""Feed me!"" They must be hungry!
Spring brings whooshing winds. The wind blows clouds and kites in the sky. Wind also helps plants spread their seeds. When seeds land, they grow into new plants and flowers.
Spring brings new plants and flowers. Busy bees buzz from flower to flower to collect
. Nectar is a sweet liquid made by flowers. The buzzing bees collect nectar for food to eat.
Whoosh has the sh sound. List five other words with the same sound.
People have five senses: hearing, sight, smell, taste, and touch. We hear many sounds during spring. Our other senses also tell us about spring. The list below gives examples of the ways people use those senses in spring.
blooming flowers, such as tulips, in a field.
freshly cut green grass on a lawn.
What other examples can you think of for each sense above?
All trademarks and logos are property of Weekly Reader Corporation.
",0,WRLevel2,0,0.7793794274330139,0.14922106266021729,0.03855041041970253,0.019095642492175102,0.013753583654761314
556,"are events in which athletes from around the world compete in different sports. This February, the Winter Olympics will be held in Turin, Italy. One of the newest Winter Olympic sports is snowboarding.
The Winter Olympics take place every four years. Here are some popular Winter Olympic sports.
was added to the Winter Olympics in 1998. It is a lot like skateboarding and skiing. Snowboarders slide down a steep hill on a long, flat board. They do tricks in the air with their snowboards.
is dancing on ice. Skaters perform their moves to music. Some of those difficult moves include spinning in the air and flipping backward. Skaters are judged on those moves.
is a sport in which athletes push a sled down an icy track. Once the sled starts to slide, the riders jump inside. The bobsled can travel up to 90 miles per hour. Thats about the speed of a train!
(LOOJ) is the French word for ""sled."" Like bobsledding, it is one of the fastest Olympic sports. The sled races down an icy spiral track. It can also reach speeds up to 90 miles per hour.
is like running or walking on skis. Athletes use wax on the bottom of their skis to glide uphill, downhill, and across flat land smoothly. They can ski almost as fast as a car travels.
is a team sport played on an ice rink. Each team has six players on the ice. Players use long, curved sticks to hit a hard rubber disk called a puck into a goal.
What do all these Olympic athletes have in common?
measures published under license with MetaMetrics, Inc.
All trademarks and logos are property of Weekly Reader Corporation.
",0,WRLevel2,0,0.7032390832901001,0.2090902179479599,0.06090974062681198,0.012950269505381584,0.013810624368488789
145,"Each fall, monarch butterflies leave places that turn cold. The monarchs fly to warmer places. Turn the page to learn more about monarch butterflies.
The map to the right shows some places where monarch butterflies migrate for the winter.
means to move from one place to another. Monarchs migrate to warm places like California, Florida, and Mexico.
All trademarks and logos are property of Weekly Reader Corporation.
",0,WRLevel2,0,0.7993319034576416,0.1368120014667511,0.03299865499138832,0.01693391427397728,0.013923575170338154
46,"recently kicked Pluto out of the family of planets. Astronomers are scientists who study the universe beyond Earth.
What is a planet? Scientists finally decided on a definition. They said a planet must be almost round and must orbit the sun in its own path. Plutos orbit crossed Neptunes path, so scientists named Pluto a
That is the name they gave to a new group of small objects in space. ""These dwarf planets are popping up everywhere,"" says astronomer Alan Stern.
In January 2006, a spacecraft blasted off to explore Pluto. At that time, Pluto was the last unvisited planet. Now it may become the first visited dwarf planet. The spacecraft is scheduled to arrive in 2015. What might the scientists discover about Pluto?
measures published under license with MetaMetrics, Inc.
All trademarks and logos are property of Weekly Reader Corporation.
",0,WRLevel2,0,0.5325338244438171,0.3171789050102234,0.12666426599025726,0.011307076551020145,0.01231597550213337
121,"Constitution Day is September 17. That is the day our Constitution was signed.
for our country. A law is a rule.
Our country had many different rules. People wanted to have one set of rules.
A group of leaders worked together to write the Constitution. This painting is an artists idea of what that meeting looked like.
The leaders met in Independence Hall. That is a famous building in Philadelphia, Pennsylvania.
The Constitution was written in 1787. That was more than 200 years ago!
The Constitution has more than 4,000 words. A
(KWIL) was used to write those words. A quill is a pen made from a feather. It is dipped in ink.
measures published under license with MetaMetrics, Inc.
All trademarks and logos are property of Weekly Reader Corporation.
",0,WRLevel2,0,0.7285414934158325,0.18179331719875336,0.053834136575460434,0.018061183393001556,0.01776977628469467
615,"Constitution Day is September 17. That is the day our Constitution was signed. On that day, Americans will celebrate in different ways.
Students will learn about the Constitution at school. In some places, kids and adults will hear people read it aloud. Some kids will sign a copy of the Constitution. How will you celebrate this important day?
All trademarks and logos are property of Weekly Reader Corporation.
",0,WRLevel2,0,0.7595077753067017,0.1572197526693344,0.049221865832805634,0.016709355637431145,0.017341284081339836
69,"How can you be ready in case of a fire at home? Learn safety tips and practice! Here are four safety tips you should know.
Smoke alarms save lives. Have an alarm inside and outside each bedroom. You should also have a smoke alarm on every level of the home. Push the test button at least once a month. That will let you know whether the alarm is working.
Fire can spread quickly. Every family needs to be prepared. How? Have a home fire escape plan. Draw the plan and talk about it. The drawing should show two ways out of each room. Those may be doors or windows. Then practice the plan twice a year. Practice during the day and at night.
Choose a safe place outside where everyone will meet. Get out and stay out! Never go back inside a burning building.
Once you are outside, dial 9-1-1 or the number for your fire department.
Why is it important to have a home fire escape plan? How might practicing it help you?
measures published under license with MetaMetrics, Inc.
All trademarks and logos are property of Weekly Reader Corporation.
",0,WRLevel2,0,0.7828035354614258,0.14767423272132874,0.03744358941912651,0.017210131511092186,0.01486845314502716
369,"Welcome to the Firehouse!: Rooms in a Firehouse
waits in the radio room for calls. If a call comes in, the dispatcher tells the firefighters.
When firefighters are not busy, they take turns cooking and eating in the kitchen.
Some firefighters stay overnight in the firehouse. They sleep in beds called
Firefighters wear turnout gear to help them stay safe.
. Turnout gear is special clothing that helps them stay safe in flames, heat, and smoke.
There are different kinds of fire trucks. A
is used to rescue people from tall buildings.
This fire truck pumps water from hydrants.
All trademarks and logos are property of Weekly Reader Corporation.
",0,WRLevel2,0,0.7861688733100891,0.14591191709041595,0.039422690868377686,0.014016210101544857,0.014480391517281532
208,"When the sun goes down, some animals wake up! They are
They are active at night. They sleep during the day.
Many owls, bats, and snakes are nocturnal. They have special ways to find
in the dark. Prey is an animal that is hunted by another animal for food.
Owls can see well at night. They also have great hearing. The feathers on the edge of their wings are soft. That lets owls fly quietly. They can sneak up on their prey. Owls hunt mice and other small animals.
Bat: Delpho M/Photolibrary; Moth: Michael Durham/Minden Pictures
Most bats eat insects. Bats have a special way of finding food. They make high-pitched sounds. The sounds bounce off insects and return to the bats. That lets the bats know where to find the insects.
Pit vipers are snakes. They sense the heat of other animals. Their heat sensors are inside holes on their faces. The holes are called pits. They help the snakes find their prey in the dark. Pit vipers eat frogs and other small animals.
How might being nocturnal help animals survive?
measures published under license with MetaMetrics, Inc.
All trademarks and logos are property of Weekly Reader Corporation.
",0,WRLevel2,0,0.7702338099479675,0.15345579385757446,0.04331408441066742,0.019415030255913734,0.013581354171037674
510,"Goats are helping to prevent forest fires.
Goats are doing their part to help prevent forest fires. Goats eat tall grass, weeds, and small branches. Those plants often spread forest fires in places such as California and Florida.
Many states are using goats to eat plants on mountains and in fields close to people's houses. By eating plants in those areas, the goats leave a clear patch of land. That way, if a fire starts in the forest, it will not be able to spread to where people live.
In 1999, there were about 94,000 forest fires in the United States.
Forest fires in 1999 burned nearly 9,500 square miles of land in the United States.
Most forest fires are started by people. People are sometimes careless with cigarettes and campfires.
Lightning is another cause of forest fires. When the forest is very dry and lightning strikes it, a fire can start.
All trademarks and logos are property of Weekly Reader Corporation.
",0,WRLevel2,0,0.5318741202354431,0.29707467555999756,0.14525206387043,0.011079452931880951,0.014719688333570957
142,"The U.S. Mint will release the last five state quarters this year!
Many kids are checking their coins for new state quarters. This year, they can complete their collections. The
will release the last five of the 50 state quarters starting this month. The U.S. Mint is the place that makes coins.
The 50 State Quarters Program began in 1999. Since then, the U.S. Mint has made five new state quarters each year. The coins are released to the public in the order in which each state became part of the United States.
The front, or heads side, of each state quarter is the same. They all have a picture of George Washington. He was the first president of the United States. He became president in 1789.
The back, or tails side, of each state quarter is
(yoo-NEEK). That means one of a kind. The design shows something special about that state. ""The program teaches people about the rich history of the states,"" says Michael White. He is a spokesperson for the U.S. Mint.
Many kids and adults started collecting coins in 1999 because of the new state quarters. ""It is, by far, the most popular and successful program in U.S. Mint history,"" says White. ""More than 140 million Americans collect them.""
Until 1965, quarters were made of silver. Today, quarters are made of copper and nickel.
New Jersey's quarter has a picture of George Washington on each side.
Coins last for about 30 years. Paper money lasts only about 18 months.
The main office of the U.S. Mint is in Washington, D.C. Offices are also located in five other cities across the United States. Study the map to learn more.
The U.S. Mint in Philadelphia is the largest mint in the world!
If you could design your own state quarter, what would it look like? Why?
All trademarks and logos are property of Weekly Reader Corporation.
",0,WRLevel2,0,0.551769495010376,0.322183758020401,0.10246454924345016,0.00953034870326519,0.014051887206733227
536,"A Grand View of the Grand Canyon
Soon visitors to the Grand Canyon in Arizona will be able to step out onto a glass walkway to get a better view of one of the world's most beautiful canyons.
is a deep, narrow valley with steep sides. The Grand Canyon was cut into Earth over millions of years by the waters of the Colorado River.
The new walkway, called the Skywalk, is on the west
or edge, of the canyon. It juts out 70 feet. When it officially opens, visitors will be able to look down at deep rock formations.
The walkway was built on land owned by a Native American tribe called the Hualapai (WAH-luh-pigh). They want to attract more people to the west rim. ""It's a whole new way to experience the Grand Canyon,"" says spokesperson Sheri Yellowhawk.
measures published under license with MetaMetrics, Inc.
All trademarks and logos are property of Weekly Reader Corporation.
",0,WRLevel2,1,0.16903337836265564,0.466169536113739,0.342041939496994,0.009896868839859962,0.012858298607170582
