Index,Text,Grade,Type,bert.2.pred,bert.2.prob.1,bert.2.prob.2,bert.2.prob.3,bert.2.prob.4,bert.2.prob.5
472,"Experts hope 2006 will be the year the world is polio-free.
Will polio be declared a disease of the past?
World health groups are fighting a war
with a crippling and sometimes deadly diseasepolio. Their efforts are paying off. Polio has been wiped out in 10 African countries, according to a recent report.
Since mid-2003, nearly 200 children in those 10 western and central African countries were
for life, but no new cases have been reported since last June. When people are paralyzed, they are unable to move different parts of their bodies and may be unable to walk.
The disease raced across Africa and into Asia after people in Nigeria refused the polio
mainly for religious reasons. Vaccines are medications that protect people from getting certain diseases.
Officials are hopeful that polio will be eliminated in 2006. ""I think well get there. Things are looking better now,"" Carole Pandak told
She works for PolioPlus, a group that is part of the global effort to stop the disease. ""In the next six to eight months, all countries might be polio-free except Nigeria.""
Polio is a disease that affects the brain and spinal cord. Although polio can strike at any age, it mostly affects children under age 5. The highly
disease is passed through person-to-person contact, infecting those who havent been vaccinated. The virus enters the body through the mouth and paralyzes one out of every 200 victims.
With the help of modern medicine, polio has almost become a distant memory in the United States and other parts of the world. On April 12, 1955, the U.S. government approved the use of a vaccine that stopped people from getting the disease. Jonas Salk was the doctor who invented the first polio vaccine.
A boy in Africa receives an oral polio vaccine from a WHO (World Health Organization) worker.
Although polio has disappeared from much of the world thanks to Salk, it still threatens children in Africa and Asia. Major efforts were recently under way to
or provide children with vaccines. More than 100 million children received vaccinations across 28 African countries, including the 10 where the disease has been
Nearly all vaccines in those countries are given by mouth. Tireless volunteers and health-care workers organize National Immunization Days. On those days, they set up clinics in markets or go door to door.
To spread the word about the vaccinations in rural areas, volunteers hand out whistles, put up balloons, and give out candy. ""We will work from dusk to dawn to make sure that every child under the age of 5 is immunized,"" promised volunteer Bruce Howard from California before he left for Nigeria in November.
After children receive their vaccinations, their fingers are marked with ink. ""Its uplifting to help so many kids,"" says Pandak. ""The children are hungry, and there are worms in their water. This is one less thing that they have to worry about in their lives.""
Groups are making progress to eliminate polio forever. The number of cases worldwide has dropped from 350,000 in 1988 to 1,492, as of November 2005. ""This is the light at the end of the tunnel,"" says Bruce Aylward of the World Health Organization.
Think Critically If you could create a new cure for any disease, what would you want to wipe out? Why?
Jonas Salk inspects the vaccine that helped end polio.
From the early 1900s to the mid- 1950s, families in the United States were scared out of their wits. Some parents refused to let their kids go outside, out of fear they would contract polio. In 1938, President Franklin D. Roosevelt, whose legs had been paralyzed by the disease, declared a war on polio. He urged scientists to find a cure. Exactly 10 years after Roosevelts death, Salks vaccine was declared officially safe.
In October 2005for the first time in 26 years in the United Statesfive children in a small Amish community in central Minnesota developed polio. None of the children had been immunized against the disease. Health officials say that the general public isnt at risk. The only people at risk for contracting polio are those who have not been immunized against the disease and who come into direct contact with an infected person.
measures published under license with MetaMetrics, Inc.
All trademarks and logos are property of Weekly Reader Corporation.
",2,WRLevel4,2,0.046675652265548706,0.13921722769737244,0.7321119904518127,0.02362240105867386,0.05837274342775345
630,"The bald eagle is flying high! This majestic bird has clawed its way back from the edge of
About 40 years ago, the number of bald eagles in the United States was declining rapidly. Today, however, the bald eagle is returning to the skies. Wildlife officials hope to remove the bird from the list of threatened species by the end of the year.
In the early 1700s, bald eagles were a common sight. There were about half a million of those birds living in the United States.
Over time, their population fell dramatically. In the early 1960s, very few bald eagles remained.
What caused the number to drop? Hunting and the use of harmful chemicals sprayed on crops were largely to blame. Those chemicals poisoned the birds and their eggs.
Pollution also contributed to the problem. Bald eagles often became sick after eating fish from polluted waters.
was being destroyed as people cut down trees to build roads and homes. A habitat is a place in nature where an animal makes its home.
Although some threats still exist, the future looks hopeful for bald eagles. Today, there are about 20,000 bald eagles living in the United States. Thanks to laws that helped protect bald eagles and banned harmful chemicals, the birds are making a comeback.
, or protection, efforts have helped their survival. ""There is no doubt that it is the single best conservation story the United States has had,"" bald eagle expert Bryan Watts told
In 1782, the bald eagle was made the national bird of the United States. The nation's founders chose the bird because it symbolized freedom, strength, and courage. At the time, some people disagreed about the choice for the national bird. Benjamin Franklin, for example, thought the turkey would make a better choice because it was ""a much more respectable bird.""
measures published under license with MetaMetrics, Inc.
All trademarks and logos are property of Weekly Reader Corporation.
",2,WRLevel4,2,0.08017455041408539,0.242752343416214,0.6292647123336792,0.01598246581852436,0.031825896352529526
747,"Students are spending more time studying at home, but is that a good thing?
Homework is on the rise! Nine- to 12-year-olds are spending 20 percent more time studying at home than they spent in 1997, according to a recent study from the University of Maryland. ""Kids spend an average of 50 minutes to 75 minutes studying every day,"" says the studys author, Sandra L. Hofferth.
But is taking schoolwork home a good thing? Two recent books have education experts asking, is homework helpful?
writers Nancy Kalish and Sara Bennett write that homework keeps kids from participating in school sports and other after-school programs. ""Its the youngest kids who seem to be getting the most homework,"" Bennett told
""and theyre the least ready to do it.""
that ""no scientific studies have shown that kids
from homework in any way before high school."" (
means ""to receive help."") Kohn thinks that too much homework can take the fun out of learning.
Many education officials say homework is good for learning. ""Its important [for kids] to get used to doing homework,"" Harris Cooper of Duke University told
Cooper is one of the countrys leading researchers on homework. He says practicing homework now will help kids in high school. Cooper suggests that students should expect to do 40 minutes of homework each day.
Many teachers see the value of homework as well. ""I think homework is helpful to most kids. It gives them more responsibility,"" fourth-grade teacher Pepper Schrock of Orlando, Florida, told
""I try to give meaningful projects as homework.""
Does homework help students learn? Let us know what you think at
measures published under license with MetaMetrics, Inc.
All trademarks and logos are property of Weekly Reader Corporation.
",2,WRLevel4,2,0.05543220415711403,0.22454865276813507,0.6716011762619019,0.01793847046792507,0.03047945536673069
583,"Germany, Chile, and Liberia elect their first female leaders.
Germany, Chile, and Liberia dont seem to have much in common. The three countries lie on separate continents. They do not share a language, currency, culture, or history.
But a closer look shows that the three nations are more similar than they may appear to be. In the past six months, each country has elected a woman as its leader for the first time in its history.
Angela Merkel of Germany, Michelle Bachelet of Chile, and Ellen Johnson-Sirleaf of Liberia join a small but growing group of female heads of state. Only 11 of 193 countries in the world have women in charge.
Johnson-Sirleaf vows to unite Liberia and create jobs.
The three recently elected women have bold plans for their countries. Merkel, the first woman to serve as the chancellor of Germany, promised that the government would work to reduce
or joblessness, in her country. ""We want to give people hope of having jobs,"" she says.
As the first woman president of Chile, Bachelet plans to bridge the large gap between the countrys rich people and poor people. She says, ""Chile needs to unite behind the goals of reducing poverty and creating more equal opportunities so that everyone can benefit from what the country has to offer.""
Johnson-Sirleaf is not only Liberias first woman president. She is also the first elected female head of state in all of Africa. As president, she faces the huge task of rebuilding Liberia after 14 years of war.
Although the war ended more than two years ago, the country still has no regular electricity or running water. More than 80 percent of the people in Liberia do not have jobs.
or bring back together, her country. ""I am excited by the potential of what I representthe aspirations and expectations of women in Liberia, African women, and women all over the world,"" she said in her inauguration speech.
Those recent elections have made some Americans think about a woman president too. Nearly 80 percent of Americans are ready for a female commander in chief, according to a Roper Public Affairs poll.
Some people think Senator Hillary Rodham Clinton of New York and U.S. Secretary of State Condoleezza Rice will run for president in 2008. Time will tell if the United States will have two female front-runners in that presidential election.
measures published under license with MetaMetrics, Inc.
All trademarks and logos are property of Weekly Reader Corporation.
",2,WRLevel4,2,0.04569641873240471,0.19553804397583008,0.6990824937820435,0.01964973658323288,0.040033310651779175
743,"Simon is a rare red panda, like this one.
Simon, a rare red panda, now plays in the trees at a Jerusalem zoo. Jerusalem is a city in the Middle East. The small, bear-like animal likes to dine mainly on bamboo but also munches on fruits, acorns, and insects. Red pandas are excellent climbers and spend most of their time in trees. They are mainly found in Nepal and southern China. Habitat loss and illegal hunting have endangered red pandas in the wild.
All trademarks and logos are property of Weekly Reader Corporation.
",2,WRLevel4,0,0.47962144017219543,0.3383432626724243,0.15720485150814056,0.011468814685940742,0.013361639343202114
259,"Aochan, a rat snake, and Gohan, a dwarf hamster, are an unlikely pair of friends. The two share a cage at a zoo in Tokyo, Japan. Zookeepers placed the hamster, whose name is Japanese for ""meal,"" in the snakes cage as a tasty snack. Instead of chowing down on Gohan, the snake befriended the furry rodent. ""Ive never seen anything like it,"" says zookeeper Kazuya Yamamoto. ""Gohan sometimes even climbs onto Aochan to take a nap on his back.""
All trademarks and logos are property of Weekly Reader Corporation.
",2,WRLevel4,1,0.23221659660339355,0.4376266896724701,0.3043926954269409,0.012131775729358196,0.013632244430482388
427,"A NASA Spacecraft Lands on an Asteroid for the First Time.
On February 12, scientists on Earth fired rockets on the
spacecraft, turning it toward Eros. Eros is an
, or space rock that is orbiting the sun. As the spacecraft slowly descended, it bounced and scientists were afraid the craft would crash.
Shown is the location of the asteroid belt in our solar system, and the orbit of Eros.
: The planets and their orbits are not drawn to scale.
began its incredible space odyssey five years ago. NASA (National Aeronautics and Space Administration) launched the spacecraft in 1996. For the next four years,
sped toward Eros, covering nearly 2 billion miles.
After studying a few other space objects, the spacecraft settled into orbit around Eros on February 14, 2000. During the following year, the craft took more than 160,000 photos of the potato-shaped asteroid.
completed its mission orbiting Eros, NASA scientists decided to try to land the car-sized spacecraft on the asteroid. If the craft succeeded,
would become the first craft to land on an asteroid. Scientists knew that the odds were against a safe landing, but they thought it was worth trying. ""Chances [were] less than 1 percent for [
] to land intact,"" said scientist Helen Worth.
NASA scientists on Earth guided the spacecraft toward the surface of Eros by remote control. Descending at 4 miles per hour, the spacecraft landed after bouncing once.
Thinking that the spacecraft had crashed, scientists were surprised to learn that it was sending information from the asteroid's surface. ""It's working, and we are getting good information,"" said NASA scientist Jacob Trombka shortly after the landing. As a result of the successful landing, NASA continued the mission for an additional ten days.
Scientists already know that most asteroids orbit the sun between Mars and Jupiter in an area called the
. Eros, however, is a kind of asteroid that comes closer to Earth than most asteroids. Such asteroids are called
. Scientists believe that Eros may be similar to the near-Earth asteroid that slammed into Earth 65 million years ago, probably killing the dinosaurs.
About 350 near-Earth asteroids have been found. Scientists carefully map the orbits of those asteroids. They say those asteroids will not hit Earth anytime soon. However, one might hit someday, scientists say.
There may be another 1,000 near-Earth asteroids scientists haven't discovered. Scientists worry that one of the unknown asteroids might threaten Earth. Scientists will use the information they gathered from Eros to protect Earth from asteroids that come too close to the third rock from the sun.
Eros is about twice the length of Manhattan, New York.
Eros orbits the sun once every 21 months.
Eros has so little gravity that a baseball hit on its surface would fly into space.
A person weighing 200 pounds on Earth would weigh 2 ounces on Eros.
The daytime temperature on Eros is about 212 degrees Fahrenheit.
The nighttime temperature on Eros is about -238 degrees Fahrenheit.
All trademarks and logos are property of Weekly Reader Corporation.
",2,WRLevel4,2,0.046431463211774826,0.1584143042564392,0.7056679725646973,0.02751845493912697,0.06196780130267143
672,"""A day on, not a day off"" has been the motto of Martin Luther King Jr. Day since 1994.
On January 17, thousands of people around the country will honor King's work by participating in community service projects and taking part in parades. Martin Luther King Jr. Day became a holiday in 1986. King (1929-1968) was a civil rights leader who worked against
. That is the act of treating others unfairly. King dedicated his life to making sure that African Americans received the same treatment under the law as white people.
All trademarks and logos are property of Weekly Reader Corporation.
",2,WRLevel4,0,0.4278191328048706,0.34970515966415405,0.19593147933483124,0.011627166531980038,0.014917142689228058
429,"The $10 bill is the latest in the series to get a new design.
The $10 bill is getting a new look! To outsmart counterfeiters, the U.S. government is rolling out a newly redesigned $10 bill that has splashes of red, yellow, and orange.
are people who try to make fake bills that look like the real ones. Counterfeiting is a crime.
""The new $10 note design continues the U.S. government's efforts to make our currency safer, smarter, and more secure,"" says Dawn Haley of the Bureau of Engraving and Printing, which produces all U.S. paper money.
The $10 bill is the latest in the series to get a new design. The $50 bill was updated last year, and the $20 bill was given a makeover in 2003.
There are several colorful changes on the new bill. A red image of the Statue of Liberty's torch appears next to the portrait of Alexander Hamilton, the first secretary of the treasury. On the portrait's other side is the phrase ""We the People,"" also in bright red ink. The background is light orange, and small yellow 10s surround the torch. A new ink makes the numeral 10 in one of the corners change color from copper to green when the bill is tilted.
But don't expect to find the new $10 note in your wallet just yet. In January 2006, the U.S. government will begin to circulate the new bills. The government plans to redesign the currency every seven to 10 years to stay ahead of counterfeiters.
measures published under license with MetaMetrics, Inc.
All trademarks and logos are property of Weekly Reader Corporation.
",2,WRLevel4,2,0.08376583456993103,0.2679654359817505,0.6144924759864807,0.012667551636695862,0.021108629181981087
562,"Spencer Breslin may be only 8 years old, but he has already worked as much as many adult actors. Spencer has starred in 40 commercials, a TV miniseries, and two movies! You might have seen Spencer recently in the Disney movie
Spencer began his acting career when he was about 3 years old. A
, a person who looks for actors, saw Spencer at a playground in New York City, where Spencer lives. The agent told Spencer's mom that Spencer could probably act in commercials. Shortly after that, he began his acting career.
What does Spencer want to do when he grows up? Spencer plans on doing lots of different things. ""I'd like to be a cop or a secret agent--maybe even a [movie] director, but I will always love acting,"" he said in a recent interview.
All trademarks and logos are property of Weekly Reader Corporation.
",2,WRLevel4,2,0.1030617207288742,0.38688430190086365,0.4648287296295166,0.018887758255004883,0.026337377727031708
501,"Just in time for Black History Month, President George Bush has signed a law to build a national museum honoring African Americans.
The National Museum of African American History and Culture will be part of the Smithsonian Institution in Washington, D.C. It will include exhibits on slavery and other important periods in black history.
Getting approval for the museum was no easy task.In fact, politicians and leaders worked for almost 100 years to get the bill signed. ""This has been a long, hard effort, but we're here today,"" one government official told
. Planners estimate that building the museum will take about ten years.
All trademarks and logos are property of Weekly Reader Corporation.
",2,WRLevel4,2,0.13363759219646454,0.3805689811706543,0.4587225019931793,0.010938676074147224,0.01613224670290947
610,"History in the Making: Japan Invades Hong Kong
War broke out between China and Japan in 1937. An undeclared war was fought until 1941, when China, as well as the United States, the United Kingdom, and the Soviet Union, declared war on Japan, Germany, and Italy. In 1941, Japan invaded the British colony of Hong Kong, which is part of present-day China. Connie interviewed her grandfather, Locksley Siu, who was in Hong Kong during the Japanese invasion.
How old were you when World War II began?
World War II in Hong Kong was from 1941 to 1945. The Japanese army occupied the former British colony when I was 11 years old.
Where did you live, and did you have a car?
Altogether, eight people lived in [an] apartment of 500 square feet. Our apartment was in Wan Chai, on Hong Kong Island. Most people did not have cars. My dad had an old bicycle.
Did you still go to school during the Japanese occupation?
Yes, I continued to go to school for the first year. Later the school was closed because the school ran out of money. During the occupation, students were required to learn Japanese. Japanese teachers taught us Japanese.
Did you have enough food to eat every day?
No, we did not have enough food. We only ate vegetables, beans, and potatoes, but no rice at all. Meat was very costly and in short supply. When we were really hungry, we drank water. Sometimes we had to pick up grass and leaves from trees to eat.
How did the Japanese soldiers treat the Chinese people?
They were rude, and they hated Chinese people. We had to salute the Japanese soldiers when they passed by. Otherwise they would kick [us] in the back.
How was life affected by the occupation?
There was little freedom. The Japanese forbade people to go out after 11 at night. There was no traffic during the curfew. There was a lack of electricity for lighting; instead, we used candles. The only entertainment at night was the radio. The Japanese government took all Hong Kong dollars away. The Japanese government forced us to use Japanese yen. Roads such as Queen's Road and King's Road were changed to Japanese names.
Do you have any comments about the occupation?
More than 60 years after [the end of] World War II, there are still many people  who live in fear, hunger, and poverty because of wars. I hope that you will think more of those less fortunate.
I learned that there was little freedom under the occupation. I should be grateful that I live in a country where I am not forced to do things that I don't want to do. I'm going to do something for the less fortunate, just as my grandpa told me.
All trademarks and logos are property of Weekly Reader Corporation.
",2,WRLevel4,2,0.04937083646655083,0.17449168860912323,0.6393934488296509,0.03483887389302254,0.1019052043557167
38,"You're probably familiar with this saying: An apple a day keeps the doctor away. There has been a lot of health advice in the news lately about what is good for your body. Sometimes it becomes difficult to tell what is true and what is considered a myth.
is a made-up story that is passed down from generation to generation. Myths often become accepted as the truth. Weekly Reader spoke with a few health experts to find out the truth behind some common beliefs.
: An apple a day keeps the doctor away.
: Although eating this fruit won't cure an illness, apples are a healthful food choice. ""[Apples] are good for you,"" said nutrition expert Dr. Melvin Heyman. ""They contain nutrients.""
are vitamins and minerals that your body needs to stay healthy. Apples are also a good source of fiber, which can decrease the risk of heart disease later in life.
: You should let a cut breathe.
: Contrary to popular belief, cuts do not need to breathe. ""The open cut or scrape should be covered,"" said skin expert Dr. Amy Harned. According to Dr. Harned, it's important to wash the wound first. Then, apply an antibiotic ointment and cover the cut with a bandage. Leaving a cut uncovered can allow germs to infect it.
: Eating carrots will improve your eyesight.
: Carrots are rich in vitamin A, which helps keep your eyes healthy. According to eye expert Dr. Timothy Wingert, ""Eating carrots will not improve your eyesight. But eating carrots is part of a well-balanced diet. Carrots have nutrients that help your eyes to function properly."" Carrots also make a tasty snack.
: You can hurt your eyes by sitting too close to the TV.
: There is some truth to this advice. According to Dr. Wingert, sitting too close to the television for long periods of time makes eyes tired and can cause eyestrain. ""Generally, it is more comfortable on your eyes to view the television from at least 5 feet from the screen,"" he says. So, back up from that television or, better yet, turn it off!
All trademarks and logos are property of Weekly Reader Corporation.
",2,WRLevel4,2,0.11695893853902817,0.39677271246910095,0.45889902114868164,0.011045178398489952,0.01632419042289257
