Index,Text,Grade,Type,bert.2.pred,bert.2.prob.1,bert.2.prob.2,bert.2.prob.3,bert.2.prob.4,bert.2.prob.5
125,"Read the sentences below. Think about what you have learned from
. Choose true if the sentence is correct or false if it is incorrect.
All trademarks and logos are property of Weekly Reader Corporation.
",0,WRLevel2,0,0.669935941696167,0.17566952109336853,0.08398114144802094,0.04606782644987106,0.024345511570572853
474,"Sue has small holes in her jaw. For years, people have tried to find out why.
Now scientists think they have found the answer. They say a
may have caused the holes. A parasite is a tiny creature that lives on another living thing.
How did scientists find the answer? They studied bird bones. They found a bird jaw that had holes in it. They knew that when the bird was alive, it had a parasite.
Scientists say a parasite could have made the dinosaur sick. That is what may have killed Sue.
All trademarks and logos are property of Weekly Reader Corporation.
",0,WRLevel2,0,0.6021256446838379,0.24819274246692657,0.08977596461772919,0.03894536569714546,0.020960263907909393
261,"The map shows Ohio and the states that touch it.
The map shows Ohio and the states that touch it. Use the map to answer the questions. Fill in the circle in front of the correct answer.
Which of these states is west of Ohio?
Which city shown on the map is the farthest north?
All trademarks and logos are property of Weekly Reader Corporation.
",0,WRLevel2,0,0.6526390314102173,0.18664464354515076,0.0830368921160698,0.05362772196531296,0.024051660671830177
97,"Animals build safe places to sleep, eat, and raise their young. Some animals build homes that have different rooms, tunnels, and much more! Look inside to learn about some awesome animal builders and their homes.
Termites are insects that live in large groups called
. Some termites build mounds as their homes. Termite mounds are made with dirt and saliva. Termites build tunnels inside the mound. Termites travel through the tunnels.
The tunnels help keep the termite mound cool. Some mounds can be more than 20 feet tall!
Some beavers build lodges in rivers or ponds as their homes.
Cliff swallows are birds that live in large groups called
. Cliff swallows build nests with thousands of tiny balls of mud. They build their nests on the steep sides of cliffs or under bridges. It is hard for other animals to reach the nests in those places. So the nests are safe places to lay eggs and to raise young.
Prairie dogs are rodents that live in big groups called
as their homes. Burrows are underground tunnels. Prairie dogs sleep and raise their young in small rooms inside the burrows. Some prairie dog towns are many miles wide and are home to millions of prairie dogs!
Beavers are rodents that live in small groups called
. Some beavers build lodges in rivers or ponds as their homes. They use logs, tree branches, and mud to build a lodge. A beaver lodge has one room that is above water. Beavers have to swim underwater to get inside their lodge.
All trademarks and logos are property of Weekly Reader Corporation.
",0,WRLevel2,0,0.5990579724311829,0.23233553767204285,0.11810503154993057,0.0292762890458107,0.021225083619356155
14,"Firefighters are ready to fight fires every day. They work hard to keep people and pets safe. What do firefighters need to do their job well?
Firefighters need fire trucks to get to a fire quickly. They use ladders, hoses, and other tools to put out fires and save lives. In this picture, two firefighters are in a bucket at the top of the ladder. They are spraying water on fire that is at the top of the building.
It keeps them safe from flames, heat, and smoke. Turnout gear includes a helmet, a mask, a jacket, pants, and boots.
Fire experts say that most fires start in the kitchen. Using a stove carelessly is the number-one cause of house fires.
Read about some ways to stay SAFE in a fire:
Practice a fire escape plan with your family.
When a fire starts, get out and stay out.
Stay away from matches, lighters, and stoves.
Test smoke alarms in your home once a month.
Why might it be important to get out and stay out when a fire starts?
measures published under license with MetaMetrics, Inc.
All trademarks and logos are property of Weekly Reader Corporation.
",0,WRLevel2,0,0.534573495388031,0.2753726840019226,0.14651232957839966,0.023718908429145813,0.019822509959340096
467,"Students recently planted trees in Brechtel Park. It is in New Orleans, Louisiana. The park lost thousands of trees in 2005. A big hurricane hit the area then. Its name was Hurricane Katrina.
The students worked hard. They raised money to buy the trees. How? They sold T-shirts and had an art fair. The group planted about 100 trees.
The event was a great success, says Brad Philipson. He is a teacher at Metairie Park Country Day School. One day, these kids will come back and see how the trees have grown.
Courtesy of Metairie Park Country Day School
All trademarks and logos are property of Weekly Reader Corporation.
",0,WRLevel2,0,0.49636492133140564,0.3278946280479431,0.13015350699424744,0.02386178821325302,0.02172520011663437
428,"Kids are helping keep track of monarchs. The kids are putting tags on the butterflies. The tags are tiny stickers. Each tag has a number on it. The number shows when and where each monarch was found.
Scientists look for monarchs with the tags. They want to keep track of them. Why? The number of monarchs is getting smaller. People are cutting down plants and trees where the butterflies live. Scientists want to learn more about monarchs so they can save them.
Why might scientists want to save monarch butterflies?
All trademarks and logos are property of Weekly Reader Corporation.
",0,WRLevel2,0,0.617552638053894,0.24298620223999023,0.07785776257514954,0.039762143045663834,0.021841254085302353
52,"Lava is flowing out of a volcano in Hawaii. The volcano is named Kilauea (kee-lah-WAY-ah). It is one of the worlds most active volcanoes. It has been erupting for more than 25 years!
Scientists are keeping a close watch on Kilauea. They want to make sure people living nearby are safe.
The lava from Kilauea goes into the Pacific Ocean. The lava cools. Then, it hardens into rock. The rock forms new land over time.
Many people visit Kilauea each year. This is one of the few places in the world where you can get really close to an actively erupting volcano, says scientist Jim Kauahikaua (koh-wah-hee-KOH-wah). Its really cool.
How might scientists know when a volcano is going to erupt?
All trademarks and logos are property of Weekly Reader Corporation.
",0,WRLevel2,0,0.4627286195755005,0.37195882201194763,0.12281347811222076,0.021469416096806526,0.021029718220233917
526,"George W. Bush Is Running for President
George W. Bush is running for U.S. President. Bush is a member of the
. The Republican Party is a political group.
When he was a kid, George W. Bush dreamed of becoming a baseball player. Now that he is grown up, Bush's dream is to be the next United States president.
George W. Bush grew up in Midland, Texas. His childhood friends remember him as a class clown.
Since 1995, Bush has been the governor of Texas. Now Bush is running for president. He has chosen Richard Cheney to run for vice president.
Together, Bush and Cheney want to lead our country. On Election Day, voters will decide whether they will get the job.
asked George W. Bush some questions about himself. Here's what he had to say.
Why do you think you would be a good president?
Because I will do what I have promised to do. I [will] bring people together to achieve common goals.
What was your favorite subject in school?
What was your favorite book as a kid?
Do you have any advice for young Americans?
Set high goals and work hard to [reach] them. You can be anything you want to be.
Married to Laura. Twin daughters Barbara and Jenna are 18.
Three cats, named Cowboy, Willie, and Ernie. A dog named Spot.
George W. Bush Is Running for President
All trademarks and logos are property of Weekly Reader Corporation.
",0,WRLevel2,0,0.4562152028083801,0.27843284606933594,0.21272605657577515,0.021228788420557976,0.03139706328511238
506,"The map shows how many Black Bears live in some states.
In which state so 50 to 150 black bears live?
About how many black bears live in Alaska?
In which state would you not find black bears?
About how many black bears live in Florida?
In which state dod 3,000 to 6,000 black bears live?
All trademarks and logos are property of Weekly Reader Corporation.
",0,WRLevel2,0,0.6548131108283997,0.19080506265163422,0.08694905787706375,0.04533418267965317,0.022098563611507416
94,"In North Dakota, Saje Beard rides to school every morning on Ruth, her pet mule. Saje hitches Ruth to a tree while she attends classes in a one-room schoolhouse. Look inside to learn about some unusual ways kids go to school!
helps people get from one place to another. Check out some different types of transportation that kids in the United States take to school.
In South Naknek, Alaska, kids fly to school on an airplane! The flight lasts two minutes and carries the children across a river. In winter, their flight to school is sometimes delayed because it is so dark outside.
In New York City, many students ride a
to school. A subway is an underground train. New York City has one of the worlds longest subway systems.
Some kids in Seattle, Washington, take a
to school. A ferry is a boat that carries cars, trucks, people, and goods across a small body of water. These students go to school in a two-room schoolhouse on a tiny island. The ferry ride lasts more than one hour. On the way, the kids see ducks, whales, and seagulls.
Leadville, Colorado, is sometimes called ""Cloud City."" That is because it is located in the mountains, high in the sky. It is so cold in Leadville that it can snow during the summer. When the snow is deep, kids ski and ride snowmobiles to school.
1807: Robert Fulton invented the first practical
1897: The first subway in the United States began running in Boston, Massachusetts.
1903: The Wright Brothers made the worlds first
1908: Henry Ford built the first practical
How is the Model T car different from cars today?
All trademarks and logos are property of Weekly Reader Corporation.
",0,WRLevel2,0,0.406839519739151,0.33027926087379456,0.2185404747724533,0.019733179360628128,0.024607501924037933
369,"Welcome to the Firehouse!: Rooms in a Firehouse
waits in the radio room for calls. If a call comes in, the dispatcher tells the firefighters.
When firefighters are not busy, they take turns cooking and eating in the kitchen.
Some firefighters stay overnight in the firehouse. They sleep in beds called
Firefighters wear turnout gear to help them stay safe.
. Turnout gear is special clothing that helps them stay safe in flames, heat, and smoke.
There are different kinds of fire trucks. A
is used to rescue people from tall buildings.
This fire truck pumps water from hydrants.
All trademarks and logos are property of Weekly Reader Corporation.
",0,WRLevel2,0,0.567371666431427,0.26755544543266296,0.1215805634856224,0.025276269763708115,0.018216121941804886
145,"Each fall, monarch butterflies leave places that turn cold. The monarchs fly to warmer places. Turn the page to learn more about monarch butterflies.
The map to the right shows some places where monarch butterflies migrate for the winter.
means to move from one place to another. Monarchs migrate to warm places like California, Florida, and Mexico.
All trademarks and logos are property of Weekly Reader Corporation.
",0,WRLevel2,0,0.6605958342552185,0.1848793476819992,0.0877794623374939,0.04408707842230797,0.022658227011561394
117,"There are many schools around the world. These children live in Africa. Some students in Africa read from boards called
. Check out some other schools around the world.
There are many kinds of schools in our world.
Here is what a day is like at some schools on different continents.
In some schools in North America, students sit at benches, not desks. Three or four students share each bench.
Some school buildings have only one room. Students of all ages go to school in the same classroom.
. A uniform is a set of clothes that is worn every day. Boys and girls wear different uniforms.
Some students in Asia sit on the floor while they read. They have special book holders. Sometimes girls and boys sit in separate places.
Whom do you sit with in your classroom?
Some children in Australia go to school at an
. Classes are held outdoors at some outstation schools. Students might gather in a circle and listen to a man play the guitar while they learn about music. Their teacher might wear shorts and sit with them on the ground.
All trademarks and logos are property of Weekly Reader Corporation.
",0,WRLevel2,0,0.5527148246765137,0.2883228063583374,0.11493518203496933,0.021159755066037178,0.022867349907755852
339,"Students from across the country are raising money to help build the National World War II Memorial. The memorial will honor the men and women who served in World War II (1939-1945). It will be located in Washington, D.C.
The memorial is expected to cost $100 million. So far, kids from 1,200 schools have raised more than $600,000. Students have held bake sales and penny collections. Some have even given their allowances to the memorial fund!
All trademarks and logos are property of Weekly Reader Corporation.
",0,WRLevel2,0,0.48685720562934875,0.29322779178619385,0.17630021274089813,0.022549040615558624,0.021065764129161835
338,"Animals that are too old to perform in zoos or circuses now have special places to live. They can live in retirement homes. Both Nevada and California have special places for retired animals. The animals have plenty of room to run and play. The animals have pools to swim in and trees to climb. Volunteers take care of the animals.
All kinds of animals live in the retirement homes. At one home, an ostrich and a buffalo spend lots of time together!
All trademarks and logos are property of Weekly Reader Corporation.
",0,WRLevel2,0,0.6326791644096375,0.21393771469593048,0.0898551195859909,0.04153873026371002,0.021989284083247185
304,"The Statue of Liberty is a symbol of the United States. It was a gift to our country from the people of France.
Read each question, and fill in the letter next to the best answer.
1.  The Statue of Liberty is a symbol of __________.
3.  There are__________ steps inside the Statue of Liberty.
4.  The seven spikes on the crown stand for __________.
To help you remember the names of the continents, just think of this silly sentence:
Nine smart elephants are always adding apples.
All trademarks and logos are property of Weekly Reader Corporation.
",0,WRLevel2,0,0.5879701375961304,0.2503225803375244,0.09780334681272507,0.041515104472637177,0.022388741374015808
246,"When snow first falls, it is usually soft and fluffy. But tightly packed snow is very strong, and it is almost as hard as ice. Tightly packed snow is so strong that some people use it to build homes called igloos. Some Inuit (IN-oo-it) people in Canada use blocks of snow to build igloos.
Snow is a good insulator. An insulator holds heat inside. Sometimes people, such as campers and hikers, dig a hole in the snow or make a snow cave to stay warm.
The largest snowflake ever measured was almost a foot across.
Stampede Pass, Washington, is called the snow capital of the United States!
Snow only looks white! It is actually clear.
All trademarks and logos are property of Weekly Reader Corporation.
",0,WRLevel2,0,0.4333401918411255,0.33523285388946533,0.18876592814922333,0.021595332771539688,0.021065786480903625
2,"Which animal was a big part of Native American life long ago? The horse, of course! That is what a new museum
is about. An exhibit is a show.
. It will have paintings, photos, and other objects showing horses and Native American life.
The exhibit opens in New York on November 14. Then it will go to Washington, D.C.
All trademarks and logos are property of Weekly Reader Corporation.
",0,WRLevel2,0,0.5797014236450195,0.2527495324611664,0.11541099846363068,0.031008776277303696,0.021129170432686806
61,"Native Americans keep their past alive in different ways. Look inside to learn more about Native American life long ago.
Native Americans used resources that were easy to find in their regions. Resources are useful things that come from nature, such as berries for food or trees for building homes.
Many Native Americans made their clothing from the skin or fur of animals. Deerskin was one of the most popular clothing materials in North America. Inuit people, from the Arctic, wore warm coats made of sealskin or caribou fur.
Each group of Native Americans had its own special beliefs. Many groups made carvings to show their beliefs. Native Americans from the Northwest made wooden carvings, called
from the large trees that grew there.
Native Americans ate different foods depending on where they lived. Some hunted and fished for food. Others, like those in the Southwest, made their food. Here, bread made from cornmeal was baked in clay ovens.
Native Americans in North America lived in different types of homes. In the Great Plains, they made cone-shaped homes called
People covered the tepees with tree bark or animal skin.
Many Native Americans made baskets and pottery for storage. In the Northeast, people made baskets from resources such as grass and branches. They used the baskets to store food and tools.
measures published under license with MetaMetrics, Inc.
All trademarks and logos are property of Weekly Reader Corporation.
",0,WRLevel2,0,0.5331165194511414,0.26927322149276733,0.1513071060180664,0.02177683264017105,0.024526311084628105
226,"Hurricanes are big storms. They bring lots of rain and strong winds. Most hurricanes happen in places near oceans. Hurricane season is from June to November.
Why might it be important to stay away from windows during a hurricane?
. The eye of a hurricane is the calm center of the storm. The storm clouds move around the eye. A lot of rain and strong winds are found inside storm clouds.
Hurricane winds spin around and around. In very strong hurricanes, the winds can blow more than 155 miles per hour. Hurricane winds can harm houses and trees. Those winds can also pick up cars and boats.
Hurricane hunters are scientists who fly planes into hurricanes. The hunters study those storms. Hunters measure the speed of the wind and the amount of rain in a hurricane. Their work helps people learn more about weather. The hunters let people know when a hurricane is on the way.
All trademarks and logos are property of Weekly Reader Corporation.
",0,WRLevel2,0,0.486615389585495,0.3304753005504608,0.13839952647686005,0.023258399218320847,0.021251386031508446
488,"Ann Bancroft and Liv Arnesen are trying to become the first women to ski across Antarctica. They plan to ski 4,200 miles in 100 days. That is the longest distance ever skied by women.
The women began their journey in November. That is spring in Antarctica. But the average temperature is 39 degrees below zero! Freezing winds blow at 100 miles per hour.
The wind is helping Arnesen and Bancroft. They attach themselves and the sleds that carry their supplies to sails, so the wind helps them ski faster. They hope to finish their trip later this month.
All trademarks and logos are property of Weekly Reader Corporation.
",0,WRLevel2,0,0.5407712459564209,0.2981863021850586,0.11033465713262558,0.028945887461304665,0.021761959418654442
177,"A Rhyming Poem by Mary Ann Hoberman
A Shape Poem by Mary Ann Hoberman
Hooray for Mary Ann Hoberman! She was recently chosen to be the Childrens
(LOR-ee-eht). A poet laureate is someone who is honored for his or her poetry. Hoberman has written more than 45 books of poetry for children.
A group called the Poetry Foundation gave Hoberman the honor. She will hold the title for two years. During that time, she will try to encourage kids to celebrate poetry.
I want to make sure that poetry is fun, says Hoberman. Its wonderful fun to play with language and enjoy language. I consider that my mission.
A Rhyming Poem by Mary Ann Hoberman
Most of Hobermans poems rhyme. In a
, the same sounds of two or more words repeat. The words that rhyme are often at the end of the line.
The Folk Who Live in Backward Town
The folk who live in Backward Town
They wear their hats inside their heads
And go to sleep beneath their beds.
And take their walks across the ceiling.
(HIGH-koo) is a poem with three lines that do not rhyme. The first line has five syllables. The second line has seven syllables. The third line has five syllables.
A Shape Poem by Mary Ann Hoberman
, the lines form a pattern. The pattern relates to the subject of the poem.
What are some ways you can play with language and enjoy language?
All trademarks and logos are property of Weekly Reader Corporation.
",0,WRLevel2,0,0.5912913084030151,0.2507270276546478,0.11478769034147263,0.01958930492401123,0.023604685440659523
306,"Eating foods that are good for you will help you feel great. What should you eat? Experts say a healthy diet is made up of foods from these groups.
help your heart and give you energy. Try whole-grain breads and crackers, oatmeal, and plain popcorn.
help your heart, eyes, skin, and teeth. Try apples, oranges, grapes, carrots, broccoli, and peppers.
build strong bones and teeth. Try low-fat milk, yogurt, and cheese.
Chicken: James BO Insogna/ Shutterstock; beans: Photodisc
build strong muscles. Try fish, chicken, kidney beans, lima beans, and nuts.
All trademarks and logos are property of Weekly Reader Corporation.
",0,WRLevel2,0,0.5312694311141968,0.29177823662757874,0.1261022984981537,0.028716344386339188,0.022133618593215942
508,"Mr. Fossal asked his class to take a summer-safety test. The table below shows each question of the test and the number of kids who answered yes or no. Use the table to answer the questions.
1. Do you always wear sunscreen when you are outdoors?
2. Do you always buckle your seat belt?
3. Do you always wear a bike helmet?
4. Do you swim only when a grown-up is around?
5. Do you always follow the pool rules?
How many kids always buckle their seat belts?
How many kids always follow the pool rules?
How many kids said they don't always wear sunscreen?
How many kids said they don't always wear a helmet?
Which summer-safety rule do the most kids follow?
: How many kids took Mr. Fossal's summer-safety test?
All trademarks and logos are property of Weekly Reader Corporation.
",0,WRLevel2,0,0.5585634708404541,0.2963656187057495,0.10064695030450821,0.023318126797676086,0.021105827763676643
406,"November 4 is Election Day. On that day, Americans will vote for the person to be the countrys top leader. They will
, or choose, the next president of the United States. John McCain and Barack Obama are running for president. Learn more about them below.
McCain with wife and dogs: courtesy of JohnMcCain.com
John McCain and his wife, Cindy, sit with their two dogs, Coco and Sam.
He is married to Cindy McCain. They have four sons and three daughters.
If John McCain wins, he will be the oldest person to become president.
John McCain has many petsthree parakeets, two dogs, two turtles, a cat, a ferret, and 13 fish. He loves watching sports. His favorites are basketball, football, and baseball.
Barack Obama, his wife, Michelle, and their daughters, Malia and Sasha, wave to a crowd.
He is married to Michelle Obama. They have two daughters.
If Barack Obama wins, he will be the first African American to become president.
Barack Obama is left-handed. He loves hot sauce. His favorite meal to cook is chili. He exercises every morning. He likes to jog and play basketball.
Why is it important for people to vote?
All trademarks and logos are property of Weekly Reader Corporation.
",0,WRLevel2,0,0.5290775895118713,0.289536714553833,0.13698874413967133,0.01938874088227749,0.0250081866979599
553,"Can dogs help children read? Two dogs are doing just that at a library in New Jersey! Children read aloud for 20 minutes as furry friends Emma and Sophie listen. Emma is an English Labrador, and Sophie is an English sheepdog.
or listeners, for beginning readers who may feel nervous. ""We hope that children find the program fun and that they want to come back,"" Ann Woodrow, youth services librarian, told
. She also said she hopes children connect reading with fun.
All trademarks and logos are property of Weekly Reader Corporation.
",0,WRLevel2,0,0.5299431085586548,0.2944416403770447,0.13386037945747375,0.020301807671785355,0.021453026682138443
384,"Do you have butterflies in your stomach about starting school? That means you are nervous. Don't worry!
You are heading in the right direction if you
That saying means you have a positive attitude. A good attitude helps you make friends and get along better with others.
These students are ready to learn and are paying attention in class.
at school? That saying means you are ready to learn and pay attention in class. You should always ask questions if you do not understand something.
that saying means the person needs your help. You should help out at home, school, and in your neighborhood. What are some ways you can help others?
That saying means you should get enough sleep. Sleeping helps you do your best. Second graders need about nine hours of sleep each night.
All trademarks and logos are property of Weekly Reader Corporation.
",0,WRLevel2,0,0.5565842390060425,0.2868463695049286,0.10541575402021408,0.029837122187018394,0.0213165283203125
