Index,Text,Grade,Type
94,"Scientists have made an atlas of the brain. It shows how the meanings of words are organized in different regions of the brain. The atlas uses rainbow colours to show how words and their meanings are grouped together in areas of the brain.
We wanted to build a giant atlas that shows how the meanings of words are represented in the brain, said Jack Gallant, a neuroscientist at the University of California, Berkeley.
No single brain region contains one word or idea. A single brain spot contains a number of related words. And, each single word appears in many different brain spots. Together, they form networks that represent the meanings of each word we use: life and love, death and taxes. All have their own networks. 
The atlas shows how modern imaging can completely change what we know about how the brain does some of its most important tasks. With further work, the technology could have an enormous effect on medicine and other areas of study.
It is possible that we could use this technology to decode information about what words a person is hearing, reading or possibly even thinking, said Alexander Huth, the main author of the study. One possible use would be a language decoder that could allow people who cant talk, because they have a serious illness, to speak through a computer.
To make the atlas, the scientists recorded peoples brain activity while they listened to stories. Then, they matched the transcripts o",1,Ele-Txt
95,"A new study shows that there are more and more brown bears, wolves and lynx in the forests and suburban areas of Europe. Rising human populations and use of resources have made many people believe that these animals could soon become extinct. But the study says that numbers of large predators are stable or rising in Europe. 
Brown bears, wolves and the Eurasian lynx are found in nearly one-third of mainland Europe (excluding Belarus, Ukraine and Russia). Most live outside nature reserves  this shows that changing attitudes and conservation methods are protecting these species very well. 
Bears are the most common large carnivore in Europe  there are around 17,000 bears. There are 12,000 wolves and 9,000 Eurasian lynx. Only Belgium, Denmark, the Netherlands and Luxembourg in mainland Europe have no breeding populations of at least one large carnivore species. Britain also has none. But the study said these animals live in regions of Europe where lots of people live and this shows that they could live even in the British countryside. 
Guillaume Chapron from Swedens University of Agricultural Sciences and researchers across Europe found wolves living in suburban areas with up to 3,050 people per square kilometre. On average in Europe, wolves live on land where there are 37 people per square kilometre, lynx in areas where there are 21 people per square kilometre and bears where there are 19 people per square kilometr",1,Ele-Txt
96,"A report by the World Health Organization (WHO) says that 35.6% of all women around the world will experience physical or sexual violence in their lifetime, usually from a male partner. The report says that 30% of women are attacked by their partners. It also says that a large percentage of murders of women  38%  are done by their partners. 
The highest levels of violence against women are in Africa, where nearly half of all women  45.6%  will experience physical or sexual violence. In poor and middle-income Europe, the percentage is 27.2%. But, richer countries are not always safer for women  a third of women in rich countries (32.7%) will experience violence. 42% of the women who experience violence have injuries, which doctors and nurses may notice. The report says that injuries are often the first opportunity to discover violence in the home and to offer the woman help. Violence has a big effect on womens health. Some come to hospital with broken bones and others have problems related to pregnancy and mental illness. 
The WHO has two reports  one report is on violence; the other report tells doctors and nurses how to help women. Dr Claudia Garcia-Moreno, of the WHO, and Professor Charlotte Watts, from the London School of Hygiene and Tropical Medicine, wrote the reports. 
For the first time we have compared data from all over the world on partner violence and sexual violence by non-partners and the effect of ",1,Ele-Txt
97,"Prince Harry has left Afghanistan at the end of a four-month tour. He spoke about the frustrations of being a royal who doesnt want a lot of public attention. 
He also talked about his feelings for some parts of the media and described how his father constantly told him to behave more like a member of the royal family. 
As a commander of an Apache helicopter, the prince said he had shot at the Taliban. He said he was only doing his job. 
In interviews during his time based at Camp Bastion in Helmand Province, the prince, known as Captain Wales in the army, explained his 'three mes'. One in the army, one socially in my own private time and one with the family. 
He admitted he sometimes disappointed people and also himself with his silly behaviour. He said he was probably too much army and not enough prince, but he said he was entitled to privacy, too. 
In another interview, he criticized the media, especially the Sun, the Daily Mail and the Daily Telegraph. He said he was very annoyed by articles that compare his role as an Apache co-pilot gunner to Spitfire crews during the second world war. No, its not like that at all, he said. 
The prince said he didnt like the media because of the treatment of his family when I was very small. He said that he read the stories written about him. Of course I read them, the prince said. If theres a story and somebody writes something about me, I want to know what they said. But ",1,Ele-Txt
98,"According to a new survey, there are more tigers in Nepal than at any time since the 1970s. The number of big cats has been decreasing in south Asia for 100 years, but conservationists now hope that we can save them. 
The number of wild royal bengal tigers in Nepal has increased to 198  a 63.6% increase in five years  the survey showed. This is very good news, said Maheshwar Dhakal, an ecologist with Nepals Department of National Parks and Wildlife Conservation. 
The survey looked at pictures from more than 500 cameras in five protected areas and three wildlife corridors. More than 250 conservationists and wildlife experts worked on the survey, which cost about 250,000. Dhakal said that there was a similar survey in India and the results from both countries will be published later in 2013. It will take a few more months for India, which now has 1,300 big cats in several huge protected areas, to finish the survey, he added. Nepal says it will double the population of tigers by the year 2022 from 121 in 2009 to 242. 
Some rich people want tiger skins. Tiger body parts are used in traditional Chinese medicine. International gangs pay poor local Nepali people large amounts of money to kill the cats. The skin and bones are taken through the border to India, where the big dealers are. 
One big problem is that some senior officials help the mafia who are involved in the illegal buying and selling. Conservation experts b",1,Ele-Txt
99,"The senior editor of The Atlantic magazine, James Hamblin, recently did an experiment. As part of his series, If Our Bodies Could Talk, Hamblin reduced the number of showers he had and did not use shampoo and soap when he had a shower.
He discovered what thousands of others have also discovered: the more we try to clean ourselves with soaps and body washes, the more our skin works to get back its balance. This means we have to begin the whole process again. Showering removes oil and bacteria from the skin. Many would say That is the reason I shower! But, it seems that this sometimes works too well, especially when you add hot water and soap products.
Our skin has millions of good bacteria. Showering destroys these bacteria. And when the bacteria return, they produce an odour  yes, showering too often may make you smell more. But, when you stop showering and using soap, your skin goes through a (probably gross) period of change. After this, the skin normally gets its balance back, it produces less oil and healthy bacteria flourish.
Hamblin realized that the human body, working on its own, is lovely. We will smell and look better  skin experts say that using less soap can improve skin problems. But, thats not the only advantage  reducing the number of showers we have (and the number of cleansing products we use) can help the environment. The average shower lasts seven minutes and uses 65 litres of water. Thats 65 l",1,Ele-Txt
100,"I got a degree in Spanish and this helped me get my rst job as a journalist, with an international press agency in Mexico City. But, the degree didnt stop me from making mistakes. 
I arrived in the Mexican capital after a bus journey all the way from New York. In my new job, I spent my days on the streets in political rallies and my nights alone in the ofce, where I coordinated the news from areas of ghting in El Salvador, Nicaragua, Guatemala and the rest of Central America. But, I also had to report on disasters: res, oods and explosions at  rework factories. 
While I was working as a reporter, I found out that I was bad at understanding numbers in Spanish. Once, when I wanted to phone the police, I got a Mexican grandmother out of bed at 2am because I had misunderstood a phone number. Even worse, there were too many victims in my stories  83 dead in a  re at 6pm become 38 dead by 7pm; 12 people injured in a coach crash soon became two and so it went on. Finally, I got a call from the main ofce in Washington. I dont know what training you have had, an editor shouted, but has no one ever told you a death toll cant go down?! 
Why are numbers in another language such a problem? Perhaps it is because of different numbering systems. In German, for example, 2.30pm is halb drei (half of three) and 21 is einundzwanzig (one and twenty). Different number systems can clearly cause confusion. 
Some experts believe there is",1,Ele-Txt
101,"More than 100,000 people went onto the streets in Brazil to show their anger at violent police, poor public services and high costs for the World Cup. 
The demonstrations in Rio de Janeiro, So Paulo, Brasilia, Belem, Belo Horizonte and Salvador started peacefully, but there were some clashes with police and people set fire to cars and buses. 
People complained that police used rubber bullets, tear gas and violent beatings. Happening at the start of the football Confederations Cup, the rallies brought together people who are angry with the high costs and poor quality of public services, the large amounts of money spent on international sporting events, low standards of health care, inequality and corruption. 
Most of the demonstrations were peaceful, but several police were hurt, at least one car was burned and windows were broken. 
People were demonstrating for different reasons. We are here because we hate the government. They do nothing for us, said Oscar Jos Santos, 19 years old. 
Im an architect but I have been unemployed for six months. There must be something wrong with this country, said Nadia al Husin. 
At a smaller rally in Brasilia, demonstrators entered the high-security area of the national congress. Several climbed onto the roof. 
In Belo Horizonte, police clashed with protesters who tried to get into a football stadium, where there was a Confederations Cup match between Nigeria and Tahiti. 
In Porto",1,Ele-Txt
102,"Europe is trying to reduce air pollution. Europe will become the first part of the world to force car makers to use 'real-world' emissions tests. New regulations will introduce tests that will demonstrate clearly what cars emissions are like when they are driving on roads and in traffic, not in ideal conditions, similar to a laboratory. 
The European Commission has approved the tests. The tests will make sure all cars meet a limit of 80mg of nitrogen oxide per kilometre. At present, only one car in 16 meets this limit. Other countries, such as China and Korea, are also considering real-world emissions tests. They will watch what happens next closely. 
In the UK, 29,000 people die every year because of pollution. Pollutants from diesel engines such as nitrogen oxide and carbon monoxide are responsible for at least one quarter of those deaths. 
The current laboratory test for measuring emissions is 25 years old and it needs to change. Car makers can cheat during the tests on their cars using various techniques. For example, they can tape up doors and windows to reduce air resistance, drive on really smooth roads and test at very high temperatures. 
The Commission will introduce a new emissions test that will properly check the cars in real driving, said Lucia Caudet, a Commission spokesperson. 
One key reason why air pollution kills 400,000 European citizens each year is that car makers cheat the tests for diesel c",1,Ele-Txt
103,"Not sleeping very much used to be a sign that you were busy and important. Sleep was for wimps. But now, Arianna Huffingtons The Sleep Revolution, a book that says we need to sleep more and promises to change your life, is a New York Times best-seller. 
Businesses have realized that they can make money from the sleep revolution. A whole range of businesses are interested in where, when and how we sleep and, also, how much we will pay for it. Luxury hotels give people sleep retreats; more than $1,000 gets you dinner and a movie about sleep. And, if youre staying home, you can improve your bedroom with a mattress cover with a sensor that monitors your sleep ($249) or a sleeping mask that monitors your brainwaves and lets you sleep more efficiently ($299). 
Sleep has not only become big business  it has also changed companies. Many companies already have sleeping areas and Huffington says that nap rooms in offices will become as common as conference rooms in the next two years. So, how did this happen? How did sleep suddenly become so fashionable? 
Many people these days find it normal to pay $10 for green juice and $34 for an indoor cycle class. And these people have made getting enough sleep a part of their lifestyle. Our bodies have become machines that we monitor for better efficiency and sleep is now another set of data for us to follow. 
Huffington does not say that sleep rests you; she says it restores you. S",1,Ele-Txt
104,"If we dont win, it doesnt mean anything, said billionaire Donald Trump in South Carolina. He hopes to be the Republican presidential nominee. He is worried he might not win but he shouldnt be worried because he has been at the top of the opinion polls for four months. I want to pick my date for the election. I want it next Tuesday, he told a crowd of 11,000 people. He needs their support to continue until March 2016 so he is chosen as the presidential candidate in November 2016s general election.
Strangely, recent controversy has only made him more popular.
First, he shocked prisoners of war when he said that he didnt believe Vietnam veteran John McCain was a hero because he allowed the enemy to capture him. Then, in the first television debate, he was rude to a woman who asked him difficult questions.
Trump has also insulted Mexican immigrants to the US and said that a Black Lives Matter protester who was violently thrown out of a political meeting deserved to be attacked. He seemed to laugh at a New York Times journalist for his disability and said Muslim Americans supported the 9/11 attackers.
Some people still hope that, eventually, even Trumps supporters will get tired of his attacks on minorities. One poll shows his support among Republicans has reduced by 12 points  although, at 31%, he is still winning.
Hes not a conservative, hes not a liberal  he believes in himself, former presidential rival, Bobby Jin",1,Ele-Txt
105,"American researchers say that a nasal spray containing the Love hormone oxytocin could help children with autism behave more normally in social situations. Scans of autistic children showed that the chemical made the brain respond better to faces. This could make social interactions easierfor them.
The researchers said oxytocin might help other treatments that are used to help people with autism in social situations. Over time, there would be more normal social responding. Autistic people would be more interested in interacting with other people; there would be more eye contact and more conversation, said Kevin Pelphrey, of Yale University.
Autism is a disorder that one in 100 people have. It affects people in different ways, but causes difficulties in social interaction and communication. So far, there is no effective treatment for the social problems that autism causes.
Researchers at Yale have studied the brain chemical oxytocin. They say it is a possible treatment for the social problems caused by autism because it plays an important role in bonding and trust. But not all results are positive: one recent study found no significant benefit for young people who took the chemical for several days. But Pelphrey said oxytocin might help the brain learn from social interactions; it would work best when used together with therapies that encourage people with autism to interact more socially, he said.
Scientists test",1,Ele-Txt
106,"Joseph Roche is on the shortlist of astronauts for Mars One, a private mission that plans to send humans to live on Mars from 2025. He is on the shortlist but he is sceptical about Mars One.
The selection process, Roche says, did not reach the standard of more traditional astronaut selection processes. He also says the Dutch
Mars One team are naive because they believe they can succeed alone in the $6 billion mission. He says they should now accept it will probably not happen. 
The group plans to send a lander and satellite to Mars in 2018, followed by a rover in 2020 and cargo missions starting in 2022. Humans will start arriving in 2025 and they will send more crews of four people every two years. The astronauts will not return to Earth.
Gerard t Hooft is a Dutch Nobel laureate in physics. He is a supporter of the project but he says he does not believe the Mars One plans are realistic. He said: It will take longer and be more expensive. When they asked me to be involved, I told them: You have to put a zero after everything.
Roche also said that there were not 200,000  people who applied to be astronauts, as Mars One said; there were only 2,761.
He talked about the selection process in more detail: I have not met anyone from Mars One. At first, they said there would be regional interviews; we would travel there, and they would interview and test us over several days. To me, that sounded like a proper astronaut ",1,Ele-Txt
107,"You probably know a vaper  someone who smokes e-cigarettes. But has vaping started to become less popular? Statistics suggest that smokers and recent ex-smokers (the majority of vapers) may already be using e-cigarettes less. The big e-cigarette companies will study the gures carefully because they have spent millions of pounds on a technology that they thought was becoming more popular.
E-cigarettes do not contain tobacco and produce vapour, not smoke. In 2014, the health charity Action on Smoking and Health published gures that showed that the number of British users of electronic cigarettes has increased three times from 700,000 users in 2012 to 2.1 million in 2014.
But gures from the Smoking Toolkit Study show vaping may be becoming less popular. The number of vapers who are smokers and ex- smokers rose until the end of 2013, when 22% of smokers and ex-smokers were vaping. But this percentage stopped rising in 2014. Then, it dropped to 19% at the end of the year. Professor Robert West, who collected the data for the Toolkit, described the gures as statistically important.
Smokers are the key group for e-cigarette companies because seven out of ten vapers are smokers. Only around 1% of people who have never smoked have tried an electronic cigarette. The number of people who use e-cigarettes while continuing to smoke is going down, West said. Weve only been studying vaping for just over a year, so its a short t",1,Ele-Txt
108,"Do you want your child to be good at sport, play for the school team and, maybe one day, even be in international competitions? Well, try to make sure that your child is born in November or October. A study by a top expert on childrens physical activity has found that schoolchildren born in November or October are fitter than everyone else in their class.
Children born in November or October were fitter, stronger and more powerful than children born in the other ten months of the year. They are especially fitter, stronger and more powerful than children with birthdays in April or June. Dr Gavin Sandercock of Essex University and his colleagues found that children born in the autumn had a clear physical advantage over their classmates.
The research involved 8,550 boys and girls aged between ten and 16 from 26 state schools in Essex. All were tested between 2007 and 2010 on three different things: stamina, handgrip strength and lower-body power. The results showed that a childs month of birth could make big differences to their levels of fitness, muscle strength and ability to accelerate, all of which predict how good someone is at sport.
November children were the fittest because they had the most stamina and power and were the second strongest. Children born in October were almost as fit  they scored highest for strength and came third for power, with December children close behind.
The gap in physical ability be",1,Ele-Txt
109,"Women have traditionally had a minor role in professional football but this may be changing. France has just employed its first female professional team manager. It did not matter that it was a second-division club. It did not matter if it was, as some people suggested, just a publicity stunt for a minor team, Clermont Foot 63. Clermont is 14th out of the 20 teams in its league at the moment. 
What mattered was that they gave Helena Costa the top job. This has made football history because she is the first female manager in the top two divisions of any professional European league. As a woman, its made me happy, said Vronique Soulier, president of the clubs supporters association. When I first heard the news, I was surprised, but, then, we all agreed that its good news. We all agree that a woman at the head of a group of men is no bad thing. 
The new manager of Clermont Foot 63 was born in Alhandra, Portugal and has a masters degree in sports science. She is also a UEFA-licensed coach. She previously coached Benficas male youth teams, the Qatar womens team and, more recently, the Iranian womens national team. 
The president of Clermont Foot 63, Claude Michy, gave Costa, 36, a two-year contract. Michy is very good at keeping his club in the news. In 2013, he told everyone the team had signed Messi. They had. Not the Argentinian and Barcelona striker Lionel Messi, but Junior Messi Enguene, a 20-year-old midfielder ",1,Ele-Txt
110,"Noise from ships may disturb animals such as killer whales and dolphins much more than we thought before. New research shows that underwater noise could stop these animals communicating and make it more difficult for them to find food. It is well known that noise from ships disturbs large whales. But, US researchers have found noise also disturbs smaller sea creatures such as killer whales, also known as orcas. Dolphins and porpoises may have the same problems. 
The main problem is that even a small increase in sound may make it more difficult for whales to find food using echo, said Scott Veirs, who led the research. Thats worrying because their food, a kind of salmon, is already quite scarce. Hearing a salmons click is probably one of the most difficult things a killer whale does. It is harder to hear that click if theres a lot of noise around you.
The researchers used underwater microphones to measure the noise made by about 1,600 ships as they passed through Haro Strait, in Washington State, USA. The two-year study recorded the sound made by 12 different types of ship, including cruise ships, container ships and military ships, that passed through the strait about 20 times a day.
Some ships are quieter than others but the average noise next to all the ships was 173 underwater decibels, the same as 111 decibels through the air  about the sound of a loud rock concert. Whales are not usually right next to ships ",1,Ele-Txt
