Index,Text,Grade,Type
48,"Intermediate 
Well-known British author David Mitchell is used to the critics analysing his novels in detail. So, its a relief, he says, that his latest work wont be seen by anyone until 2114. He completed it at 1am one Tuesday morning before a car arrived to take him to the airport to catch a flight to Norway.
Mitchell is the second contributor to the Scottish artist Katie Patersons Future Library project, for which 1,000 trees were planted in 2014 in Oslos Nordmarka forest. The first author, Margaret Atwood, handed over the manuscript of a text called Scribbler Moon in 2015. Each year for the next 100 years, an author will deliver a piece of writing that will only be read in 2114, when the trees are chopped down to make paper on which the 100 texts will be printed.
Each author  their names revealed year by year and chosen by a panel of experts and Paterson, while she is alive  will travel to the spot in the forest high above Oslo, where they will hand over their manuscripts in a short ceremony.
Its a little glimmer of hope in a season when there has been lots of very depressing news, which shows that we are in with a chance of civilization in a hundred years, said Mitchell. Everything is telling us that were doomed but the Future Library brings hope that we are more resilient than we think: that we will be here, that there will be trees, that there will be books and readers, and civilization.
Mitchell said he found writing the book quite liberating because I wont be around to take the consequences of this being good or bad. But, Im sandwiched between Margaret Atwood and no doubt some other brilliant writer. So, it had better be good. Id look such a fool if they opened it in 2114 and it wasnt any good.
Mitchell says that he usu",2,Int-Txt
49,"Intermediate 
The US Senate Intelligence Committee has approved a bill that would make the National Security Agencys bulk collection of US phone records more transparent but allow it to continue. Introduced by Chairwoman Dianne Feinstein, the bill lets the NSA continue to collect phone metadata of millions of Americans and allows the government to keep the data. The bill passed the committee by an 11-4 vote and will now be voted on by the full Senate.
The bill allows analysts to search through the data if they think there is a reasonable suspicion that someone is associated with international terrorism. The bill also allows the NSA to continue surveillance that is begun on foreigners outside the US if they enter the country, for a period of up to 72 hours.
The bill is a direct challenge to another bill introduced by Senator Patrick Leahy that would end domestic phone-records collection. It was also opposed by leading Intelligence Committee member Mark Udall, who said it did not go far enough. The NSAs surveillance of Americans private information does not respect our constitutional values and needs fundamental reform, Udall said.
Feinstein defended the NSA bulk collection programme, but said there was a need to rebuild public trust. The NSA call-records programme is legal, and I believe it contributes to our national security, she said in a statement. But more can, and should, be done to increase transparency and build public support for privacy protections in place.
Feinstein said the bill would also make a number of improvements to transparency and checks on the NSA  for example, someone who accesses data acquired under the Foreign Intelligence Surveillance Act (FISA) by the United States without permission could spend up to t",2,Int-Txt
50,"Intermediate 
Nelson Mandela, the towering figure of Africas struggle for freedom and a hero to millions around the world, has died at the age of 95.
South Africas first black president died with his family beside him at home in Johannesburg after years of illness, which had caused him to stop taking part in public life.
The news was announced to the country by the current president, Jacob Zuma. He said Mandela had departed around 8.50pm local time and was at peace.
This is the moment of our deepest sorrow, Zuma said. Our nation has lost its greatest son. What made Nelson Mandela great was exactly what made him human. We saw in him what we look for in ourselves.
Fellow South Africans, Nelson Mandela brought us together and it is together that we will bid him farewell.
Zuma announced that Mandela would receive a state funeral and ordered that flags fly at half-mast.
Barack Obama led tributes from world leaders, referring to Mandela by his clan name  Madiba. The US president said: Through his fierce dignity and strong will to sacrifice his own freedom for the freedom of others, Madiba transformed South Africa  and moved all of us.
UK prime minister David Cameron said: A great light has gone out in the world and described Mandela as a hero of our time.
FW de Klerk  the South African president who freed Mandela and shared the Nobel Peace Prize with him in 1993  said the news was deeply sad for South Africa and the world.
He lived reconciliation. He was a great unifier, de Klerk said.
People gathered in the streets of South Africa to celebrate Mandelas life.
In Soweto, people gathered to sing and dance near the house where he once lived. They sang songs from the anti-apartheid struggle. Some people were wrapped in South African flags",2,Int-Txt
51,"Intermediate 
Insects are not usually seen as food except in a few regions of the world  but now they are crawling closer and closer to our plates. In spring 2013 there will be an effort to show people that eating insects is not disgusting and also an attempt to put insects on supermarket shelves.
In April, there will be a festival in London, Pestival 2013, where the consumption of creepy-crawlies will be discussed. The festival will include a restaurant by the Nordic Food Lab, the Scandinavian team behind the Danish restaurant Noma, which brought dishes that included ants to Claridges hotel in Mayfair in 2012, an event that was mostly sold out.
Noma has been named the worlds best restaurant by Restaurant magazine for three years. Its chef, Ren Redzepi, says that ants taste like lemon, and a pure of fermented grasshoppers and moth larvae tastes like a strong fish sauce. Bee larvae make a sweet mayonnaise used instead of eggs and scientists are constantly finding new ways to use insects.
In March, a BBC documentary will show food writer Stefan Gates looking for and eating deep-fried locusts and barbecued spiders. But, behind all the jokes there is a very serious message. Many experts believe there is a clear environmental benefit to humans eating insects.
The UNs Food and Agriculture Organization (FAO) has been funding projects since 2011 that aim to promote the eating and farming of insects in south-east Asia and Africa, where an estimated two billion people already eat insects and larvae as a regular part of their diet. In 2012, the FAO published a list of 1,909 edible species of insect and plans a major international conference on this valuable food source in 2013.
there are 40 tonnes of insects  so there is not too much chanc",2,Int-Txt
52,"Intermediate 
The brand and logo of Apple are the most valuable in the world. They are worth nearly $119bn, or more than the gross domestic product of Morocco, Ecuador or Oman.
The brand value of the Silicon Valley firm, already the worlds biggest company, has increased by 21% in 12 months, according to the Interbrand Best Global Brands annual report.
Apple, which is recognized all over the world by its simple Apple with a bite missing logo, led an increase of technology companies in the 2014 report, which has pushed more traditionally valuable brands  such as Coca-Cola, McDonalds and Gillette  down the table.
Googles brand value rose by 15% to $107bn to take second place, followed by Coca-Cola, up 3% to $81.5bn, IBM ($72.2bn) and Microsoft ($45.5bn).
Facebook is the biggest riser in the chart, increasing its brand value by 86% to $14.3bn and taking 29th place in the table, ahead of longstanding global corporate names such as Volkswagen, Kelloggs and Ford.
Jez Frampton, chief executive of Interbrand, said: Benefitting immensely from the rise of digital and mobile technology, savvy brands like Apple grew stronger.
Apple, which former Chief Executive Steve Jobs founded in his Los Altos garage in 1976, only appeared in the top ten of the Interbrand annual study in 2011.
Its logo, created by advertising executive Rob Janoff in 1977, was designed with a bite taken out of it to avoid confusion with a cherry. Our logo is a symbol of lust and knowledge. It is an apple, bitten into, all crossed with the colours of the rainbow in the wrong order. You couldnt dream of a more appropriate logo, Janoff said.
Graham Hayles, Interbrands chief marketing officer, said it was not out of kilter that Apples brand could account for a fifth of the com",2,Int-Txt
53,"Intermediate 
Flappy Bird Be careful what you wish for, especially if you want to invent something new. Recently, Dong Nguyen, the designer of the mobile game Flappy Bird, removed it from app stores. He said its success  it had been downloaded more than 50 million times and was making him around 30,000 from advertising each day  had ruined his simple life. On his Twitter account, he said: I cannot take this anymore. OK, so regretting making Flappy Bird isnt quite the same as regretting making a rifl e, but Nguyen is just the latest inventor who wished he hadnt created a monster.
The labradoodle The labradoodle isnt a monster  its adorable. But whats monstrous is the way crossbreed dogs have been sold since the labradoodles inventor, Wally Conron, fi rst created the breed in the 1980s. Ive done a lot of damage, he told the Associated Press. Ive created a lot of problems. There are a lot of unhealthy and abandoned dogs out there. Conron came up with the labradoodle when he was working for the Royal Guide Dog Association of Australia to provide a dog for a blind woman whose husband was allergic to dog hair. What he didnt expect was that the labradoodle  and other types of poodle-cross dogs, many of which have health problems  would become so popular.
The AK-47 Six months before his death in December 2013, Mikhail Kalashnikov, the designer of the assault rifl e, wrote to the head of the Russian Orthodox Church: My spiritual torment is unbearable. If my rifl e killed people, does that mean that I, Mikhail Kalashnikov, 93 years of age, the son of a poor farmer, Christian and Orthodox by faith, am responsible for peoples deaths, even if they were enemies?
Electronic tagging The electronic tag was originally made in the 1960s as a way o",2,Int-Txt
54,"Intermediate 
Margaret Thatcher, the best known British prime minister since Winston Churchill in 1940 and a global supporter of free market economics, has died. The British government announced that she would receive a ceremonial funeral at St Pauls Cathedral.
The British prime minister, David Cameron, said: It was with great sadness that l learned of Lady Thatchers death. Weve lost a great leader, a great prime minister and a great Briton. He added: As our first woman prime minister, Margaret Thatcher succeeded against all the odds, and she didnt just lead our country, she saved our country. He added that he believed she would be remembered as the greatest British peacetime prime minister.
In a statement, President Barack Obama said, Here in America, many of us will never forget her standing shoulder to shoulder with President Reagan, reminding the world that we can shape the currents of history with our moral beliefs, courage and iron will.
The first woman elected to lead a major western state, Margaret Thatcher served 11 years at No 10 Downing Street before members of her own party removed her in 1990.
Thatcher, who was 87, had been in poor health for some years, suffering from dementia. When they heard of her death, politicians from all parties sent tributes.
Labour Party leader, Ed Miliband, said: She will be remembered as a unique figure. She reshaped the politics of a whole generation. She was Britains first woman prime minister. She moved the centre ground of British politics and was a huge figure on the world stage. The Labour Party disagreed with a lot of what she did and she will always be a controversial figure. But we can disagree and also greatly respect her political achievements and her personal strength.
The de",2,Int-Txt
55,"Intermediate 
I got a Dyson vacuum cleaner but I dont even know if I want it. I just picked it up, Louise Haggerty, a 56-year-old hairdresser and waitress, said at the end of her trip to the Black Friday sales at one oclock in the morning. It was mental in there. It was crazy. It was absolutely disgusting, disgusting.
Haggerty went to a 24-hour Sainsburys supermarket in north-east London with a friend. She hoped to buy a bargain flat-screen TV. But so many people pushed in the queue that we didnt have a chance, she said. The poor woman who was second in the queue was pushed out by a crowd of youths. She didnt get anything. People were behaving like animals  it was horrible, she said. I only saw two security guards.
Frustrated when she was unable to buy a 40 TV reduced from 299.99 to 149.99, Haggerty rushed to pick up a vacuum cleaner, reduced from 319.99 to 159.99. I dont even know how much it costs; I dont know even know if Im going to buy it. I just wanted something, she said. There are lads in there with three, four, five tellies. Its not fair.
One of those lads was Andy Blackett, 30, who had two trolleys full of bargains. I got two coffee makers, two tablets, two TVs and a stereo, he said. I couldnt tell you the prices but I know theyre bargains. But his friend Henry Fischer wasnt as successful. Someone snatched my telly from me  its because Im the smaller one.
Blackett, Fischer and some friends had driven to Sainsburys at 12.45am after leaving the bedlam of a Tesco 24-hour supermarket, where the Black Friday sale started at midnight. Tesco was scary so we came here instead, Blackett said.
More than a dozen police officers went to another Tesco store because scuffles began between eager and frustrated shoppers. Customers rem",2,Int-Txt
56,"Intermediate 
We asked five people who do some unusual jobs how much they are paid, what the worst parts are and why they enjoy their work.
1. Dog-food taster The job: Tasting dog food to make sure it meets a top brands quality standards
What it involves: Opening sample tins of each batch of dog (or cat) food, smelling it and eating it. Although dogs sense of taste is different from ours, tasting is an important quality check to ensure each different ingredient is perfectly balanced in just the right way, says Philip Wells, the chief taster for Lilys Kitchen pet food.
Typical salary: 20,000 for an entry-level job in the quality department. However, Wells says an experienced technical director can easily earn 50,000 or more.
Worst part of the job: The deadlines, for Wells, who admits he quite likes the food. The meat used in pet food has to come from animals that are fit for human consumption, under the Animal Feed Regulations 2010. He adds: There are some pretty terrible pet foods out there and, although I dont taste them, the smell is enough to turn the stomach.
Job satisfaction: No two days are ever the same. Wells finds it rewarding that a project he has worked on will help pets to become happier and healthier. However, he acknowledges that some of the credit must go to another key member of the tasting team: Lily, the border terrier.
2. Hygiene technician The job: Disinfecting areas that might have been exposed to bio-hazardous situations
What it involves: Cleaning up crime scenes, road accidents and suicides. Clearing houses full of rubbish, rats and excrement  among other things. The job is about keeping people safe, says Richard Lewis, a hygiene technician for Rentokil. We deal with some extremely dirty sites.
Typical sal",2,Int-Txt
57,"Intermediate 
The Chief Medical Officer for England has compared the problem of antibiotic resistance to the risks of international terrorism. But, in fact, each year the global number of deaths caused by bacterial resistance is far more than the number of deaths caused by terrorist attacks.
The World Health Organization estimates that, just for tuberculosis, multi-drug resistance kills more than 150,000 people each year. Antibiotic resistance is now a real risk: this is now a war.
In the past hundred years, our expectations of life and survival have changed beyond all recognition. At the beginning of the twentieth century, life expectancy in the UK was around 47 years of age for a man and 50 for a woman, a number heavily affected by the very high rate of infant mortality in those days. Around a third of all deaths were in children under the age of five, mostly because of infectious disease.
However, a child born in Britain today has more than a one in four chance of reaching their 100th birthday. For this we have public health systems, vaccination and antibiotics to thank. It is thanks to this  the prevention and treatment of illnesses caused by microorganisms  that the real war against disease is mainly won.
It is in intensive care, my specialist area, that antibiotic resistant organisms are most common. Here, powerful antibiotics, essential in the treatment of life-threatening illness, are used routinely. These drugs kill ordinary bacteria. But they leave behind strong bacteria that have begun to learn how to survive antibiotic drugs.
As a newly qualified doctor in the late 1990s, I learnt about Methicillin Resistant Staphylococcus Aureus  the infamous MRSA  a bacterial species resistant to methicillin and all other penicilli",2,Int-Txt
58,"Intermediate 
Every morning, before the temperatures in Indias capital start to rise, a handful of old friends gather. On the dry grass not far from the India Gate monument at the centre of Delhi, they stretch, breathe and meditate.
It is the only healthy way to start the day. Much better than an egg or a sandwich or a cup of tea, said Arvind Singh at 6.15am as he did his breathing exercises on a bench.
Singh, a 42-year-old salesman, and his friends are not alone. All across India, in the overcrowded cities, on whatever green space is left, you can see similar scenes.
On 21 June  the new International Day of Yoga  Narendra Modi, Indias prime minister, hopes the world will join in. On the grass near India Gate, up to 45,000 people will take part in a 35-minute class  they hope it will be the biggest yoga session ever.
The participants will include 64-year-old Modi, most of his government and, they hope, a range of celebrities.
Encouraging Indians, and others, to stretch has become a focus for Modi, who led his Bharatiya Janata Party to a landslide election victory in 2014. In May 2015, schools were told to make sure students attended yoga events at the same time as the big demonstration in Delhi, even though it is on a Sunday.
Indias police officers are well known for being out of shape. So, the government has said they want to introduce compulsory yoga for them. They have said, too, that daily yoga lessons will be offered free to three million civil servants and their families. Air India, the national airline, has also said it will introduce yoga for trainee pilots.
Modi, an ascetic who is a vegetarian and an enthusiastic yoga practitioner, suggested an international yoga day when he was speaking to the United Nations on a visit",2,Int-Txt
59,"Intermediate 
The Manchester United manager, Sir Alex Ferguson, will retire at the end of the season after 27 years as the most successful manager in British football. He will become a director of the club and someone will have to replace a man who has won 13 English Premier League titles, two Champions Leagues, the Cup Winners Cup, five FA Cups and four League Cups.
Talking about his decision, Ferguson said: The decision to retire is one that I have thought a great deal about. It is the right time. It was important to me to leave an organization in the strongest possible condition and I believe I have done so. The quality of this squad, and the balance of ages within it, bodes well for continued success at the highest level. The structure of the youth set-up will ensure that the long-term future of the club remains a bright one.
Our training facilities are amongst the best in world sport and our home, Old Trafford, is regarded as one of the leading venues in the world. I am delighted to take on the roles of both director and ambassador for the club. With these activities, along with my many other interests, I am looking forward to the future. I must pay tribute to my family; their love and support has been essential.
As for my players and staff, past and present, I would like to thank them all for a staggering level of professional conduct and dedication that has helped to deliver so many memorable triumphs. Without their contribution, the history of this great club would not be as rich. In my early years, the support of the board of directors gave me the confidence and time to build a football club, not just a football team.
Over the past ten years, the Glazer family have made it possible for me to manage Manchester United to ",2,Int-Txt
60,"Intermediate 
There comes a time in some mens lives when the days seem darker, death more certain, and the only sensible response is to blow the life savings on a sportscar.
Radical and often ill-advised changes in lifestyle are typical for the midlife crisis but, if it is more than a myth, then humans may not be the only animals to experience it.
Now an international team of scientists claims it has found evidence for a slump in well-being among middle-aged chimpanzees and orangutans. The lull in happiness in the middle years, they say, is the ape equivalent of the midlife crisis.
The findings of the study, which was published in the journal Proceedings of the National Academy of Sciences, suggest that the midlife crisis may have its roots in the biology humans share with our closest evolutionary cousins.
Theres a common understanding that theres a dip in well-being in middle age, Alex Weiss, a psychologist at Edinburgh University, told the Guardian.
He said that they took a step back and asked whether its possible that the midlife crisis is not just something human.
The team from the US, Japan, Germany and the UK asked zookeepers and others who worked with male and female apes of various ages to complete questionnaires on the animals.
The forms included questions about each apes mood, the enjoyment they got from socializing, and their success at achieving certain goals. The final question asked how zookeepers would feel about being the ape for a week. They scored their answers from one to seven.
More than 500 apes were included in the study in three separate groups. The first two groups were chimpanzees, with the third made up of orangutans from Sumatra or Borneo. The animals came from zoos, sanctuaries and research centres in",2,Int-Txt
61,"Intermediate 
Organic food has more of the antioxidants linked to better health than regular food, and lower levels of toxic metals and pesticides, according to the most comprehensive scienti c analysis so far. The international team behind the work suggests that switching to organic fruit and vegetables could give the same bene ts as adding one or two portions of the recommended  ve a day fruit and vegetables.
The team, led by Professor Carlo Leifert, concludes that there are statistically signi cant differences, with a range of antioxidants being substantially higher  between 19% and 69%  in organic food. It is the  rst study to demonstrate clear differences between organic and conventional fruits, vegetables and cereals.
The researchers say the increased levels of antioxidants are equivalent to one to two of the  ve portions of fruits and vegetables recommended to be consumed daily and would therefore be signi cant in terms of human nutrition.
The  ndings will add to the controversy over organic food and whether it is better for people. Tom Sanders, a professor of nutrition at Kings College London, said the research did show some differences. But the question is are they within natural variation? And are they nutritionally relevant? I am not convinced. He added, Leifert has had a lot of disagreements with a lot of people. He also said that research showed organic cereals have less protein than conventional crops.
The results of the research are based on an analysis of 343 studies from around the world  more than ever before  which examine differences between organic and conventional fruit, vegetables and cereals. The important thing about this research is that it shatters the myth that how we farm does not affect the quality ",2,Int-Txt
