Index,Text,Grade,Type
131,"The Virunga National Park, home to rare mountain gorillas but targeted for oil exploration by a British company, could earn trouble-torn DR Congo $400m a year from tourism, hydropower and carbon credits, said a WWF report. 
But, if the UNESCO World Heritage Site that straddles the equator is exploited for oil, as the Congolese government and exploration firm SOCO International are hoping, it could lead to devastating pollution and permanent conflict in an already unstable region, says the conservation body. 
SOCO International is the only company seeking to explore inside the boundaries of the Virunga park. SOCO insist that their operations in Congo would be confined to an area in the park known as Block V, and would not affect the gorillas. 
SOCO Chairman Rui de Sousa said: Despite the views of WWF, SOCO is extremely sensitive to the environmental significance of the Virunga National Park. It is irrefutable that oil companies still have a central role in todays global energy supply and a successful oil project has the potential to transform the economic and social well-being of a whole country.
He added: The park has sadly been in decline for many years, officially falling below the standards required for a World Heritage Site. The potential for development just might be the catalyst that reverses this trend. 
However, Raymond Lumbuenamo, country director for WWF Democratic Republic of the Congo, based in Kinshassa, said that security in and around the park would deteriorate further if SOCO went ahead with its exploration plans. 
The security situation is already bad. The UN is involved with fighting units and the M23 rebel force is inside the park. Oil would be a curse. It always increases conflict. It would attract human sabotage. The park might become like the Niger Delta. Developing Virunga for oil will not make anything better. 
The population there is already very dense, with over 350 people per squa",3,Adv-Txt
132,"A few months before he died, Carl Sagan recorded a message of hope to would-be Mars explorers, telling them: Whatever the reason youre on Mars is, Im glad youre there. And I wish I was with you. 
Seventeen years after the pioneering astronomer set out his hopeful vision of the future in 1996, a company from the Netherlands is proposing to turn Sagans dreams of reaching Mars into reality. The company, Mars One, plans to send four astronauts on a trip to the Red Planet to set up a human colony in 2023. But there are a couple of serious snags. 
Firstly, when on Mars their bodies will have to adapt to surface gravity that is 38% of that on Earth. It is thought that this would cause such a total physiological change in their bone density, muscle strength and circulation that voyagers would no longer be able to survive in Earths conditions. Secondly, and directly related to the first, they will have to say goodbye to all their family and friends, as the deal doesnt include a return ticket. 
The Mars One website states that a return cannot be anticipated nor expected. To return, they would need a fully assembled and fuelled rocket capable of escaping the gravitational field of Mars, on-board life support systems capable of up to a seven-month voyage and the capacity either to dock with a space station orbiting Earth or perform a safe re-entry and landing. Not one of these is a small endeavour, the site notes, requiring substantial technical capacity, weight and cost. 
Nevertheless, the project has already had 10,000 applicants, according to the companys Medical Director, Norbert Kraft. He told The Guardian that the applicants so far ranged in age from 18 to at least 62 and, though they include women, they tended to be men. 
The reasons they gave for wanting to go were varied, he said. An American woman called Cynthia, who gave her age as 32, told the company that it was a childhood imagining of hers to go to Mars.",3,Adv-Txt
133,"Health warnings covering nearly two-thirds of cigarette packs and a ban on menthol cigarettes across the EU have come a step nearer following a vote in the European Parliament. Menthol and other flavours will be banned from 2022, but, in a blow to the UK government, MEPs decided that most electronic cigarettes, increasingly popular as alternatives to tobacco products, need not be regulated in the same way as medicines. 
Health officials and the e-cigarette industry in Britain are seeking to clarify what this mean  for instance, whether companies in the fast-expanding market face the same bans on sponsorship and promotion at sports events as tobacco firms. 
The Department of Health would not comment on the advertising issue until officials had studied the MEPs decisions. But, in a statement, the DH said: We are very pleased to see the move towards tougher action on tobacco, with Europe-wide controls banning flavoured cigarettes and the introduction of stricter rules on front-of-pack health warnings. However, we are disappointed with the decision to reject the proposal to regulate nicotine-containing products (NCPs), including e-cigarettes, as medicines. We believe these products need to be regulated as medicines and will continue to make this point during further negotiations. 
Figures show smoking levels in England are at their lowest since records began  19.5 per cent  but we are determined to further reduce rates of smoking and believe this important step will help. 
The UK e-cigarette industry, which broadly welcomed the parliaments vote, said it was already in talks with the Advertising Standards Authority, but added that it would not be sensible, proportionate, reasonable or useful to ban all advertising. 
MEPs decided e-cigarettes should only be regulated as medical products if manufacturers claimed they could prevent tobacco smoking  a decision criticized by the governments main medicines regulator. ",3,Adv-Txt
134,"The controversial auction of a Banksy mural that disappeared from the wall of a north London shop in mysterious circumstances was dramatically halted just moments before it was due to go under the hammer. 
Slave Labour, a spray-painted artwork depicting a child making Union Flag bunting and seen as a critical social commentary on last years diamond jubilee, was expected to sell for about $700,000 in a sale of street and contemporary art in Florida. 
But auctioneer Frederic Thut, the owner of the Fine Arts Auction Miami art house, who had refused all week to divulge the identity of the seller or how it came to be listed for sale through his gallery, announced that the piece, along with a second work by the secretive British street artist, had been withdrawn. 
He would not give a reason, but community leaders in Haringey, who led a vocal campaign to stop the sale of the artwork that was prised from the wall of a Poundland in Wood Green, were jubilant. 
One of our two demands was that it doesnt sell and the other was that we get it back again, so were halfway there, said Alan Strickland, a Haringey councillor. 
I will be writing to the auction house as a matter of urgency to clarify what happened and what will happen next, but for now we are really pleased that because of the pressure and the strong views of the people of Wood Green, a community campaign in London has had an impact in the US. Its a real victory for the people. 
Claire Kober, Leader of Haringey Council, wrote to Arts Council England and the Mayor of Miami, Toms Regalado, to ask them to intervene to stop the sale but it appears the decision to withdraw the item came from the gallery owners in consultation with their lawyers. The FBI refused to confirm reports they were asked to investigate. 
Several hours after the conclusion of the auction, the auction house issued a brief statement claiming it had persuaded the owners of the two Banksys to pul",3,Adv-Txt
135,"A major international row with wide-ranging implications for global drugs policy has erupted over the right of Bolivias indigenous Indian tribes to chew coca leaves, the principal ingredient in cocaine. Bolivia has obtained a special exemption from the 1961 Single Convention on Narcotic Drugs, the framework that governs international drugs policy, allowing its indigenous people to chew the leaves. 
Bolivia had argued that the convention was in opposition to its new constitution, adopted in 2009, which obliges it to protect native and ancestral coca as cultural patrimony and maintains that coca in its natural state  is not a narcotic. 
South American Indians have chewed coca leaves for centuries. The leaves reputedly provide energy and are said to have medicinal qualities. Supporters of Bolivias position praised it for standing up for the rights of indigenous people. The Bolivian move is inspirational and groundbreaking, said Danny Kushlick, Head of External Affairs at the Transform Drug Policy Foundation, which promotes drug liberalization. It shows that any country that has had enough of the war on drugs can change the terms of its engagement with the UN conventions. 
However, the UNs International Narcotics Control Board (INCB), which monitors implementation of the global drug treaties, has accused Bolivia of threatening the integrity of the international drug control regime. A number of countries  including the UK, the US, Italy, Sweden, the Netherlands and Russia  opposed Bolivias demands. 
The UKs submission to the UN, which oversees the convention, said that it acknowledges and respects the cultural importance of the coca leaf in Bolivia, but it adds: The United Kingdom is  concerned that the reservation could lead to increases in coca production and  crucially  the amount of coca diverted to the cocaine trade. As such, the reservation would weaken international law as it relates to the global effort ",3,Adv-Txt
136,"Brazils latest funk sensation, Anitta, has won millions of fans by taking the favela sound into the mainstream, but she is at the centre of a debate about skin colour. 
Anti-discrimination campaigners and social commentators say the music industrys fastest rising star has had to sacrifice her blackness to make it into the predominantly white middle- class market. 
The controversy was prompted by the publication of then-and-now photographs that show a dramatic lightening of Anittas skin tone since she signed a deal with Warner. 
In the first, when she was relatively unknown, she looked darker. In the second  a marketing shot after she became famous  she seems paler. Whether this was the result of whitening products and cosmetic surgery or  more likely  Photoshop tweaks, the contrast has rekindled discussion about whether you need to be pale to get ahead in Brazil. 
Jarid Arraes, a psychology student and blogger, wrote a post criticizing the latent discrimination in media and marketing that she felt Anittas image change represented. People refuse to accept that they are racist and they think they live in a multiracial democracy, but the statistics show that is far from the case. The whitening shows us a profoundly intolerant society that doesnt support diversity. White is the image of the rich, the nice, the successful, the good, while people see black as the opposite of all that. 
Born Larissa de Macedo Machado, the diva-to-be was a church chorister in her childhood. In her teens, she made a name for herself in Rio de Janeiros baile funk scene as a dancer and singer. 
She has now exploded into the public consciousness with an album and a huge hit single, Show das Poderosas , which topped the charts and attracted 52 million YouTube views. 
Though adored first and foremost as a pop idol with a strong message and some catchy tunes, her backers project her as a cultural bridge between the predominantly black and",3,Adv-Txt
137,"Although much of his work, and arguably nearly all the best of it, was firmly within the discipline of the blues, BB King was always open-minded and interested when he found himself in other settings, bridging musical and cultural differences with affability and skill. Perhaps it is premature to speak of the last of the bluesmen but it is hard to imagine any future blues artist matching Kings influence over musicians by the thousand and audiences by the million in a career spanning 65 years. 
Riley B King (the B did not seem to stand for a name) was born near Itta Bena, Mississippi and grew up with the limited prospects of an African-American agricultural worker, a barrier he gradually worked to overcome as he learnt the basics of guitar from a family friend and honed his singing with a quartet of gospel singers. In his early 20s, he moved to Memphis. 
Within a couple of years, he was playing regularly at a bar in West Memphis, Arkansas. He also became a disc jockey, presenting a show on a Memphis radio station. His billing, The Beale Street Blues Boy, was shortened to Blues Boy King and thence to BB. After a single session in 1949 for a Nashville label, King began recording for the West Coast-based Modern Records in 1950. 
He had his first hit in 1952, with a dramatic rearrangement of Three OClock Blues, which topped the R&B chart for 15 weeks; it was the first of a list of successes such as Please Love Me, You Upset Me Baby and Sweet Sixteen . On these and his dozens of other recordings, most of them his own compositions, King developed a style that was both innovative and rooted in blues history. He was always ready to praise the musicians who had influenced him and would usually mention T-Bone Walker first. 
Ive tried my best to get that sound, he told the Guitar Player magazine. I came pretty close but never quite got it. In an interview in 2001, he said: If T-Bone Walker had been a woman I would have ",3,Adv-Txt
138,"Sometimes life just isnt fair. Mark Zuckerberg created Facebook and is now worth an estimated $48bn. James Goodfellow also invented something used by millions of people around the world every day  the cash machine  but it didnt make him rich. In fact, he earned just 10 from the patent and has not made a penny more from it since. 
You can imagine how I feel when I see bankers getting 1m bonuses. I wonder what they contributed to the banking industry more than I did to merit a 1m bonus. It doesnt make much sense to me but thats the way of the world, Goodfellow says. 
It also annoys him that hes not seen as a good role model for inventors and engineers. He came up with a groundbreaking invention that generated billions of pounds and I got nothing, so whos going to want to follow in James Goodfellows footsteps and get 10 if they have a fantastic success? 
There have been arguments for years over who should officially go down in history as the inventor of the ATM and, in 2005, a man called John Shepherd-Barron received a UK honour for services to banking as the inventor of the automatic cash dispenser. But, the UK government is now saying it was Goodfellow who invented the ATM  so it would seem that, after all the squabbling, his place in history is now assured. 
Back in the mid-1960s, Goodfellow was working as a development engineer and had been asked to devise a way to enable customers to withdraw cash from banks on Saturdays. Most people working during the week couldnt get to the bank. They wanted a solution. The solution was a machine which would issue cash on demand to a recognized customer, he recalls. I set out to develop a cash-issuing machine and, to make this a reality, I invented the PIN [personal identification number] and an associated coded token. 
This token took the form of a plastic card with holes punched in it. The patent documents proposed a system incorporating a card reader and buttons moun",3,Adv-Txt
139,"Loneliness has finally become a hot topic  the Office for National Statistics has found Britain to be the loneliest country in Europe. British people are less likely to have strong friendships or know their neighbours than residents anywhere else in the EU and a relatively high proportion of them have no one to rely on in a crisis. Meanwhile, research by Professor John Cacioppo at the University of Chicago has found loneliness to be twice as bad for older peoples health as obesity and almost as great a cause of death as poverty. 
But, shocking as this is, such studies overlook the loneliness epidemic among younger adults. In 2010, the Mental Health Foundation found loneliness to be a greater concern among young people than the elderly. The 18- to 34-year-olds surveyed were more likely to feel lonely often, to worry about feeling alone and to feel depressed because of loneliness than the over-55s. 
Loneliness is a recognized problem among the elderly  there are day centres and charities to help them, says Sam Challis, an information manager at the mental health charity Mind, but, when young people reach 21, theyre too old for youth services. This is problematic because of the close relationship between loneliness and mental health  it is linked to increased stress, depression, paranoia, anxiety, addiction, cognitive decline and is a known factor in suicide. In a new essay, Paul Farmer, the chief executive of Mind, and Jenny Edwards, the chief executive of the Mental Health Foundation, say it can be both a cause and effect of mental health problems. 
But what can young people do to combat loneliness? Dr Grant Blank, a survey research fellow at the Oxford Internet Institute, points out that social media and the internet can be a boon and a problem. They are beneficial when they enable us to communicate with distant loved ones, but not when they replace face-to-face contact. People present an idealized version ",3,Adv-Txt
140,"To a master traditional navigator like Tua Pittman from Raratonga in the Cook Islands, a canoe is much more than just a means of transport. The canoe is our island, the crew members are the community and the navigator is the leader, Pittman says. He continues, explaining that the converse is also true. An island is our canoe, the community are the crew members and the politicians and leaders are the navigators. On a canoe, you are not just going from one destination to another using the stars, the moon, the sun and the birds. Navigation is using the philosophies of being a leader to show your crew members the light of life. 
It has been a whirlwind week for the crews of the flotilla of four sailing canoes since arriving in Sydney for the start of the World Parks Congress. Tuas journey began at the Cook Islands on 25 September. The first leg took the islanders to Samoa, then Fiji, Vanuatu and onto the Gold Coast, before heading south to Sydney. Around 100 crew members were involved in the various stages of the voyage and they aimed to travel using only traditional navigation techniques. Unfortunately, said Tua, the crews were forced to rely on modern navigation equipment on some occasions to reach Australia in time for the Congress. 
The official title of the expedition is the Mua Voyage and it is a partnership between the International Union for Conservation of Nature (IUCN) Oceania Regional Office and five Pacific Island countries: Samoa, Tonga, New Zealand, the Cook Islands and Fiji. The main goal of the 6,000-nautical-mile (11,000km) trip was to deliver a special message to the World Parks Congress. 
In part, the message said: We see the signs of overexploitation. We no longer see the fish and other marine creatures in the size, diversity or abundance of the past. We witness the change as foreign fishing fleets ply our waters in a race to strip our resources. Our coral reefs, the greatest in the world, a",3,Adv-Txt
141,"Setting aside epic disaster-movie moments such as volcanoes, hurricanes and earthquakes, there are two key natural factors that can make a city vulnerable to gradual disintegration or even total disappearance  water and sand. 
Were climate change making the planet colder rather than hotter, we could add ice to the list  for nothing obliterates a city like a billion-tonne glacier grinding its way down a valley. The impact of a rare ice tsunami in 2013 on the Canadian municipality of Ochre Beach was just a taster: a wall of melting iceberg on Dauphin Lake was blown by winds on to the shore, splintering every house in its path. 
But Ochre Beach was an anomaly. Elsewhere, the planets melting ice is making cities vulnerable by the less dramatic route of raising sea levels. A century ago, Venice  one of the most beautiful and low-lying cities in the world  used to flood around ten times a year. Nowadays, its lowest point, Piazza San Marco (only three feet above sea level) is inundated with water approximately 100 times annually. 
But rising sea levels are not entirely to blame. In many parts of the world, the land is also sinking  in Venices case, subsoil compaction (a result of industrial exploitation of the surrounding area) lowered the city by 20cm between 1950 and 1970. Ho Chi Minh City in Vietnam is also sinking by about 2cm a year  but thats nothing compared to Jakarta, which is dropping 10 to 20cm annually. In the past three decades, the city has sunk roughly four metres, rendering its 40-year-old seawall ever less effective. Unfortunately for the Indonesian capital, it has pumped out so much groundwater to support its population that the land above is drying out and compacting, thereby creating a bowl. Rivers that used to flow through the city down to the sea have had to be diverted because they cannot drain uphill. 
While there are many plans to save Venice  and Ho Chi Minh City and Jakarta are taking th",3,Adv-Txt
142,"They are the darkness seekers  and they are growing in number. On Black Fell, looking down on Northumberlands beautiful Kielder Water reservoir, a group of people wait in a car park next to a strange wooden building with a minimalist design beamed down from the future. This is Kielder Observatory, the centre of Britains nascent astrotourism industry. And those waiting outside were the lucky ones. Many more had applied for a night of stargazing at the observatory but numbers are strictly limited. 
Inside, next to a woodburner and under dimmed lights, the observatorys founder and lead astronomer, Gary Fildes, a former bricklayer with Tarzan hair, delivers a pep talk to his colleagues and volunteers. The team discusses the prospect of seeing the northern lights but Fildes is doubtful. Instead, they decide to train their powerful telescopes on Jupiter and Venus and later to pick out stars such as Capella and Betelgeuse. An additional attraction is the appearance of the International Space Station. 
Remember, Fildes tells his team, its about interaction, its about entertainment, its about inspiring people. He puts on some music. Pink Floyd, the Jam, the Pogues. By 9.30, the sky is going to be sexy, Fildes says. Its going to be epic. 
Fildes, 49, is at the forefront of the UKs burgeoning astrotourism industry. The pivotal moment for Northumberland came in 2013 when the entire national park housing Hadrians Wall, along with Kielder Water and Forest Park, some 1,500 sq km, was awarded Dark Sky Park status, the only one in England. Dark Sky Parks are rare. The 2013 Star Count revealed that only 5% of the UK population can see more than 31 stars on a good night. 
The Tucson, Arizona-based International Dark-Sky Association (IDA) confers the status only on places that take major steps to avoid light pollution. Recipients must also prove their night skies are sufficiently dark. In Northumberland Dark Sky Park, as the a",3,Adv-Txt
143,"There comes a time in some mens lives when the days seem darker, mortality more certain, and the only sensible response is to blow the life savings on a sportscar. 
Radical and often ill-advised changes in lifestyle have become the calling cards of the midlife crisis but, if it is more than a myth, then humans may not be the only animals to experience it. 
Now an international team of scientists claims to have found evidence for a slump in well- being among middle-aged chimpanzees and orangutans. The lull in happiness in the middle years, they say, is the ape equivalent of the midlife crisis. 
The study, which was published in the journal Proceedings of the National Academy of Sciences, has raised eyebrows among some scientists but, according to the authors, the findings suggest that the midlife crisis may have its roots in the biology humans share with our closest evolutionary cousins. 
Theres a common understanding that theres a dip in well-being in middle age, Alex Weiss, a psychologist at Edinburgh University, told the Guardian. 
We took a step back and asked whether its possible that instead of the midlife crisis being human-specific, and driven only by social factors, it reflects some evolved tendency for middle-aged individuals to have lower well-being, he said. 
The team from the US, Japan, Germany and the UK asked zookeepers, carers and others who worked with male and female apes of various ages to complete questionnaires on the animals. 
The forms included questions about each apes mood, the enjoyment they gained from socializing, and their success at achieving certain goals. The final question asked how carers would feel about being the ape for a week. They scored their answers from one to seven. 
More than 500 apes were included in the study in three separate groups. The first two groups were chimpanzees, with the third made up of orangutans from Sumatra or Borneo. The animals came from zoos, sa",3,Adv-Txt
