Index,Text,Grade,Type
42,"Some cities have pigeons. Lima has black vultures or gallinazos. They circle in groups overhead and perch on the citys most emblematic buildings  the decrepit, colonial-era churches and crumbling eighteenth-century piles in the city centre. 
In many ways, with their wrinkly heads and beady eyes, they remind Lima residents of the side of their city they would rather ignore: the neglect, poverty and filth. But these carrion-eaters natural affinity for dead and decaying things is being turned into a virtue. Environmental authorities are giving these much- maligned birds a PR makeover, kitting them out with GoPro action video cameras and GPS trackers, and giving them a new mission in the fight against fly-tipping and illegal dumping. Samuel is one of the projects ten certified disease- free Coragyps atratus that have been charged with doing what they do best: sniffing out rubbish. Fitted with his tracker, he is set free above the city, where he identifies clandestine dumps and records the GPS coordinates ona live map. 
His trainer at Limas Huachipa Zoo, Alfredo Correa, beams with admiration. They can eat dead animals because their metabolism protects them from viruses and bacteria, he says. Theyve got some of the strongest gut flora in the natural world. The effort is a collaboration between USAID and the Peruvian Environment Ministry to tackle Limas rubbish problem. 
Samuels other airborne companions have been given more evocative names: Capitan Huggin, Capitan Fenix (named after the mythological creature that rises from the ashes) and Capitana Aella ( Whirlwind). A tongue- in-cheek video adds a melodramatic voiceover, in which the noble carthatidae lineage  the vultures are pitted against pestilence and disease, while humanity is placidly ignoring the danger. The project makes a serious point. With just four landfills in a city of nearly ten million inhabitants, there are countless illegal dumps. A fifth of the rubbish ends up there, according to the Environment Ministry. Run-off from the waste contaminates Limas main water source, the Rimac river, as well as the Chillon and Lurin rivers, which flow into the Bay of Lima. 
The environmental supervision agency, OEFA, says that three poorer neighbourhoods, despite having only 12% of Limas population, have by far the most fly-tipped rubbish: Villa Maria del Triunfo (39.4%), Villa El Salvador (25.3%) and El Agustino (18.3%). The problem, in part, is unpaid taxes. Many residents, especially in the barrios , just dont pay. That means some of the 43 district municipalities lack the resources for basic services such as rubbish collection. 
It also means nobody is necessarily going to clean up where the vultures identify illegal rubbish. We share the vultures GPS coordinates with the municipalities, says Javier Hernandez, the project director. Its their job to collect the rubbish and to try and change the habits of their residents. 
The project aims to encourage citizens to be vultures on the ground : to report fly-tipping, cut back on their own waste and recycle. Some residents are responding, posting photos of illicit dumps on the Twitter feed and Facebook page. The idea was hatched at the 2014 United Nations Climate Change Conference, hosted in Lima. We were looking for ways to involve not just the authorities but also citizens to generate environmental awareness, Hernandez says. Artist Cristina Planas had placed huge, sculpted vulture heads on top of 25 dead palm trees in a wetland reserve in the south of the city. Rich residents hated it as an ugly imposition but Planas invited citizens to adopt a vulture in support of conservation and recycling. 
We are a little scared of the vultures appearance, she said. But in reality, he is out there sacrificing himself for us. He is out there recycling, in the last place we threw out our rubbish.  ",3,Adv-Txt
114,"It could be the best thing since Trevor Bayliss wind-up radio in the pre-internet 1990s  a cheap light that draws free power from gravity and could end the use of dangerous kerosene-fuelled lamps in Africa and India.
But when British designer, Patrick Hunt, went down the conventional route of bank or venture capital finance to get his invention kickstarted commercially, he hit a problem. We tried to get funding to make it happen, but its slow and complex and its unproven and nobody wants to take a risk, he said.
So he tried crowdfunding on a US website, Indiegogo, which had recently opened up in the UK. Within five days, he had hit his target and raised 36,200. So popular was his campaign at the end of 2012 to entice donations from the public that within 40 days he had raised a colossal 400,000.
The LED light is powered by a dynamo driven by the descent of a 10kg bag of rocks. The weight is attached to the light, lifted to a height of about 2m, and while it is allowed to slowly fall to the ground it will generate enough power for half an hour of light.
Hunt is preparing for production in China and will test the market again by delivering 1,000 of the lights to Africa before the full mass production of what he hopes will be millions of units.
He is one of a new wave of entrepreneurs turning to the fast-growing crowdfunding industry for finance. Another new site is InvestingZone, which matches wealthy individuals with start-up entrepreneurs.
Indiegogo does not offer shares but allows users to offer perks for different levels of donation  those helping to fund Hunts innovative light not only got to feel good about helping the less well off but also got their own light.
For Danae Ringelmann, co-founder of Indiegogo, the gravity light is a perfect example of how meritocratic crowdfunding can be and how it can test an entrepreneurs idea. It is the first time that finance has been fast, efficient and meritocratic, because it is not about 'How do I get access to the decision makers in that bank?' or 'Who do I know in that venture capital outfit?' This is all about proving your worth to your customers and fans, getting them to validateyour idea and fund it.
Even ideas that arent deemed worthy to get funding are worth testing, because you will have saved yourself a whole bunch of time finding out it wasnt a good idea and getting smarter faster, she says.
Ringelmann, who is based in the US, started her career as a Wall Street analyst. In 2008, she decided to quit and use her skills to try and help friends who worked in the arts to raise money.
The site was originally focused on the film business and launched at the Sundance Film Festival that year.
Five years on and it is raising about $2m a week for new businesses in start-up and growth stages. In December 2012, it launched a euro and a sterling service to get a foothold this side of the Atlantic and says Britain is its third biggest market. International activity is up 41% since December.
There is no shortage of competitors, be it Kickstarter, Seedrs or Funding Circle, but, unlike rivals, says Ringelmann, Indiegogo is the only crowdfunder where anyone can launch a campaign. No project is deemed too wacky.
The site levies a 4% fee for successful campaigns. For those that fail to raise their target amount, users have the option of either refunding all money to their contributors at no charge or keeping all money raised but with a 9% fee.
A British woman, Lauren Pears, raised 100,000 to open a cat caf in London through the site.
Known as Lady Dinahs Cat Emporium, it is yet to open but is billed as somewhere people can come in from the cold to a comfortable wingback chair, a hot cup of tea, a book and a cat.
Weve seen campaigns that go to venture capitalists get rejected because the venture guys say, 'Great idea but no idea if the market actually wants it; it could be a gadget that no one cares about,' said Ringelmann.
The entrepreneurs do an Indiegogo campaign  they dont even actually launch the project, but the campaign itself is enough market proof for venture capitalists to say there is a market for this. 
It allows you to test your market, test your pricing, test your features, discover new revenue streams, get vital feedback, says Ringelmann. 
With her Wall Street background and the experience of helping 100,000 businesses and services raise finance, Ringelmann has fine-tuned her advice for the budding entrepreneur. 
Ideas are a dime a dozen. Its all about the execution and, if you are afraid that your idea will be stolen by someone who could execute it better and faster than you, then you are not the right person to execute that idea. Its all about confidence to move fast and to learn, she says. 
For Ringelmann, the expansion into Europe and a deal with a web transaction provider, which will allow payments to be made through local card services like Maestro in the UK and Carte Bleue in France, as well as PayPal, are part of a dream to democratize finance. More than 7,000 campaigns for finance are live on the site. 
While crowdfunding as an alternative to banks has grown, it has limited appeal to big-bucks investors, who dont settle for anything less than a stake in a promising business. That could start to change in the UK with the launch of InvestingZone. 
",3,Adv-Txt
125,"The vast fortunes made by the worlds richest 100 billionaires are driving up inequality and hindering the worlds ability to tackle poverty, according to Oxfam. 
The charity said the accumulation of wealth and income on an unprecedented scale, often at the expense of secure jobs and decent wages for the poorest, undermined the ability of people who survive on aid or low wages to improve their situation and escape poverty. 
Oxfam said the worlds poorest could be lifted out of poverty several times over if the richest 100 billionaires would give away the money they made in 2012. 
Without pointing a finger at individuals, the charity argued that the $240bn net income amassed in 2012 by the richest 100 billionaires would be enough to make extreme poverty history four times over. 
It is rare for charities to attack the wealthy, who are usually regarded as a source of funding. Bill Gates and Warren Buffett are among a group of 40 US billionaires who have pledged much of their wealth to aid projects, but there is little detail about the level of their annual donations. Their actions have also not been matched by Russian, Middle Eastern or Chinese billionaires. 
In the report, The Cost of Inequality: How Wealth and Income Extremes Hurt Us All , published just before the World Economic Forum in Davos, the charity calls on world leaders to curb income extremes and commit to reducing inequality to at least 1990 levels. 
The report found that the richest 1% had increased their incomes by 60% in the past 20 years, with the financial crisis accelerating rather than slowing the process. 
Barbara Stocking, Oxfams Chief Executive, said extreme wealth was economically inefficient, politically corrosive, socially divisive and environmentally destructive. 
She said studies show that countries suffer low levels of investment and growth as workers are forced to survive on a smaller share of total incomes. 
She said: We can no longer pretend that the creation of wealth for a few will inevitably benefit the many  too often the reverse is true. 
The report said the issue affected all parts of the world. In the UK, inequality is rapidly returning to levels not seen since the time of Charles Dickens [the nineteenth-century novelist]. In China, the top 10% now take home nearly 60% of the income. Chinese inequality levels are now similar to those in South Africa, which is now the most unequal country on Earth and significantly more unequal than at the end of apartheid. 
In the US, the share of national income going to the top 1% has doubled since 1980 from 10 to 20%, the report says. For the top 0.01% the share of national income is above levels last seen in the 1920s. 
The World Bank and International Monetary Fund have argued that extreme income inequality undermines growth and both organizations have attempted to tie their loans to programmes that limit the growth of inequality. 
Members of the richest 1% are estimated to use as much as 10,000 times more carbon than the average US citizen. 
Oxfam said world leaders should learn from countries such as Brazil, which has grown rapidly while reducing inequality. 
Stocking said: We need a global new deal to reverse decades of increasing inequality. As a first step, world leaders should formally commit themselves to reducing inequality to the levels seen in 1990. 
She said closing tax havens, which the Tax Justice Network says hold as much as $31 trillion, or as much as a third of all global wealth, could yield $189bn in additional tax revenues.
",3,Adv-Txt
172,"A mirror that sends heat into the frigid expanse of space has been designed by scientists to replace air-conditioning units that keep buildings cool on Earth. 
Researchers believe the mirror could slash the amount of energy used to control air temperatures in business premises and shopping centres by doing away with power-hungry cooling systems. 
Around 15% of the energy used by buildings in the US goes on air conditioning, but the researchers calculations suggest that, in some cases, the mirror could completely offset the need for extra cooling. 
In a rooftop comparison of the device in Stanford, California, scientists found that, while a surface painted black reached 60C more than ambient temperature in sunlight and bare aluminium reached 40C more, the mirror was up to 5C cooler than the surrounding air temperature. 
If you cover significant parts of the roof with this mirror, you can see how much power it can save. 
You can significantly offset the electricity used for air conditioning, said Shanhui Fan, an expert in photonics at Stanford University, who led the development of the mirror. In some situations, the computations say you can completely offset the air conditioning. 
Buildings warm up in a number of different ways. Hot-water boilers and cooking facilities release heat into their immediate surroundings. In hot countries, warm air comes in through doors and windows. Then, there is visible light and infrared radiation from the sun, which also heat up buildings. 
The Stanford mirror was designed in such a way that it reflects 97% of the visible light that falls on it. But, more importantly, it works as a thermal radiator. When the mirror is warmed up, it releases heat at a specific wavelength of infrared light that passes easily through the atmosphere and out into space. 
To make anything cool requires what engineers call a heat sink: somewhere to dump unwanted heat. The heat sink has to be cooler than the object that needs cooling or it will not do its job. For example, a bucket of ice will cool a bottle of wine because it becomes a sink for heat in the liquid. The Stanford mirror relies on the ultimate heat sink: the universe itself. 
The mirror is built from several layers of wafer-thin materials. The first layer is reflective silver. On top of this are alternating layers of silicon dioxide and hafnium oxide. These layers improve the reflectivity but, also, turn the mirror into a thermal radiator. When silicon dioxide heats up, it radiates the heat as infrared light at a wavelength of around ten micrometres. Since there is very little in the atmosphere that absorbs at that wavelength, the heat passes straight out to space. The total thickness of the mirror is around two micrometres or two thousandths of a millimetre. 
The cold darkness of the universe can be used as a renewable thermodynamic resource, even during the hottest hours of the day, the scientists write in Nature. In tests, the mirror had a cooling power of 40 watts per square metre at ambient temperature. 
Writing in the journal, Fan puts the installed cost of mirrors at between $20 and $70 per square metre and calculates an annual electricity saving of 100MWh on a three-storey building. 
Fan said that the mirror could cool buildings  or other objects  simply by putting it in direct contact with them. Coating the roof of a building with the mirror would prevent heating from sunlight but do little to remove heat from its interior. More likely, the mirror would be used to cool water or some other fluid that would then be pumped around the building. 
He ruled out the idea of using the mirrors to slow down global warming. Roof space accounts for only a small portion of the Earths surface so, at this point, we dont think this would be a geoengineering solution. Rather, our contribution on the greenhouse-gas-emission issue is simply to reduce electricity consumption, he said. 
Im really excited by the potential it has and the applications for cooling, said Marin Soljai, a physicist at the Massachusetts Institute of Technology. You could use this on buildings so you have to spend much less on air conditioning or maybe you wouldnt need it at all. You could put it on top of shopping malls. With a large enough surface, you could get substantial cooling.

",3,Adv-Txt
95,"Valdevaqueros is one of the last remaining unspoilt beaches in southern Spain, where the sky above the golden sands is filled with kites hauling surfers over the waves. Currently the beach has little more than an access road lined with camper vans from Germany, France, Italy and Britain, filled with windsurfers and kitesurfers lured by the areas strong winds. 
For decades it has been a world apart from the concrete-lined beaches of Torremolinos and Marbella along the coast, yet on 29 May the local council in Tarifa approved plans to build a tourist complex right next to the beach, with 1,400 hotel rooms and 350 flats. Environmental and conservation groups have protested that the project will harm the habitats of protected species, but for most councillors here the issue is simple: jobs. In this town of 18,000 inhabitants, 2,600 are out of work as Spain faces its worst economic crisis in at least half a century, one that has cast doubt on the future of the euro. 
Traditional sources of income such as fishing are dying out, now that fleets are being dismantled and fish stocks are depleted, so tourism is the only way out, as long as it is sustainable, said Sebastin Galindo, a councillor from the Socialist Party, which is in opposition in Tarifa but voted with the governing Peoples Party to give the project the green light. 
Tarifas Mayor, Juan Andrs Gil, declined to comment on the project, but Galindo said it complies with environmental standards. 
The complex would be 800 metres from the coast, comfortably beyond the minimum of 200 metres stipulated by a law designed to prevent more ugly developments like those that blighted much of Spains coastline when mass tourism first descended on its shores in the 1960s and 1970s. 
Opponents of the complex say the last thing anyone needs is more housing in a country that already has a million empty homes, although the central government last week proposed a sell-off by granting non-Spaniards residency permits in return for buying property worth at least 160,000. 
The Socialist opposition in Madrid attacked the proposal, and Galindo said it discriminated against migrant workers who flocked to Spain during the boom years, many of them from Morocco, whose coastline is just 14km away and can be seen from Tarifa. It favours moneyed classes rather than those who came here to help Spain get ahead, he said. Surfers fear that new buildings in Valdevaqueros would reduce the strength of the famous local Levant wind but fail to lure traditional package holidaymakers. Its not really a family spot. Just wait until they see what a Levant is like, said Henning Mayer, who has regularly made the journey from Augsburg in Germany for 20 years. Ten years ago they said they would build a new highway here. It didnt happen, so I think it will be impossible to build new hotels. 
At the southernmost tip of Spain, Tarifa is the strategic crossroads between Africa and Europe, where the Mediterranean Sea meets the Atlantic. Campaigners say it also has a vital role in the animal world as a crossroads for migrating species. 
The campaign to save the beach was launched hours after the Tarifa council voted for the project. The campaign has a Facebook page and is supported by groups including Greenpeace, the World Wide Fund for Nature and the Spanish branch of conservation network Birdlife. Its the environmental equivalent of putting a shopping centre right in the middle of the Alhambra, said Noelia Jurado, who uses her multimedia expertise to campaign against the complex. She also noted that the resort would be near the ancient Roman town of Baelo Claudia. They could be building on top of more Roman ruins here. Nobody knows. 
Also joining the opposition to the planned resort is the Andalusian College of Geographers, which, in a preliminary study charted on its website, concluded that free areas , including car parks if not actual buildings, will overlap part of the Alcornocales National Park. The geographers also estimate that the site intrudes on two wildlife conservation areas. One of the areas in Valdevaqueros is home to two species of bat whose survival is threatened. 
Money is once again being put before urban laws and European environmental directives, said Ral Romeva, a member of the European Parliament who is Vice-President of the Greens group. In Romevas view, the project is also at fault because the proposed site has too little water in a town that already suffers from shortages in the summer weather that scorches the southern Spanish region of Andalusa. Lack of water recently led the Andalusa Supreme Court to uphold an appeal against plans to build a complex elsewhere in the region, which would have included golf courses, hotels and luxury homes. 
Many locals are also wondering why a resort should be built 10km away, rather than on wasteland near Tarifas picturesque old centre, with its typically Andalusian whitewashed walls and winding streets, dominated by a 10th-century Moorish castle. My opinion and that of catering workers is that we agree with the complex as long as it creates jobs in the town, which is what is needed, but we are against it being for the benefit of a few, said Cristbal Lobato, who has worked at the same beachside bar in Tarifa for 30 years. If they put it in the centre of Tarifa, where there is space, then clients could visit shops, tapas bars and restaurants. 
Overlooking the green fields earmarked for building, biologist Aitor Galn, who conducts environmental impact studies for a living, pointed at one of only two seaside breeding grounds for vultures in Europe. Anywhere else in Europe, this place would have the utmost protection, but here they want to get rid of it all and cover it with buildings, he said. What they want to do is turn this into Benidorm, but what draws people here is wildlife and the wind. But by taking advantage of the current crisis and unemployment, builders and mayors who agree with them can justify any amount of destruction.  
",3,Adv-Txt
74,"Legos profits rose strongly in the first half of 2014, helped by the success of its Lego Movie , which has stormed box offices in the US and UK. 
The Danish toy firms sales rose across Europe, the Americas and Asia as children snapped up products linked to the film. The film, released in February, took more than $250m in the US and 31m in the UK by the first weekend in April. 
The movie cost about $60m to make and has been described as a near-flawless piece of content marketing by creating entertaining content aimed at consumers who are likely to go out and buy the companys products. 
Legos finance director, John Goodwin, said: The strong performance of the Lego Movie products had a positive effect during the first half of 2014, and it remains to be seen how the line will continue to develop behind the highly anticipated launch of the movie on DVD in the second half of 2014. 
Operating profit for the first six months of Legos financial year increased by 12% to $630m. Sales rose by 11% to more than three times the figure six years before. 
Jrgen Vig Knudstorp, Legos chief executive, said: It is a very satisfactory result that shows our significant growth in recent years in a tough economic environment. The result for the first half of 2014 is an outcome of our ability to develop, launch and distribute Lego products, which children all over the world put at the top of their wishlists. 
Lego, based in the small town of Billund, started producing its plastic bricks in 1949 and became a staple childrens toy around the world by the 1970s. But the group lost its way and was on the brink of collapse in 2003. Knudstrop took over as chief executive, ending 70 years of family rule, and ditched hundreds of surplus products to refocus the business on its trademark bricks. 
The company opened its first factory in China in April and opened an office in Shanghai to spearhead expansion in the worlds second- biggest economy.",3,Adv-Txt
