Index,Text,Grade,Type
27,"It is not just the worlds biggest burger chain; it is also a global emblem of American consumer capitalism. But, these days, the golden arches of McDonalds are looking a little tarnished. After a decade of expansion, customers around the world dont seem to be 'lovin it' any more. McDonalds has revealed that worldwide sales dropped by 3.3% on 2013 in a set of results that were described as atrocious. 
Problems are piling up almost everywhere. In China, sales plunged by 23% after a food scare when local media showed workers apparently caught on camera at a local supplier claiming to use out-of-date beef and chicken in products destined for McDonalds and KFC. In Europe, sales are down by 4%, mostly because of unrest in Ukraine and the sour anti-western mood in Russia. Around 200 of McDonalds 450 restaurants in Russia are being investigated by health inspectors in apparently politically motivated food-safety checks. Ten have been closed. 
But it is in the US, where McDonalds has around 40% of its restaurants, where the crisis runs deepest. Almost 60 years after Ray Kroc opened his first restaurant in Des Plaines, Illinois, consumers are losing their appetite for a Big Mac and fries. 
McDonalds has seen 12 straight months of declining sales in its massive home market, with sales down 4.1% in the latest quarter. Younger diners are deserting the restaurant in droves to eat out at rivals such as Chipotle Mexican Grill. The number of 19-to-21-year-olds visiting McDonalds once a month has fallen by 13% since 2011, according to food analysts Technomic, while the number of 22-to-37-year- olds visiting has not grown. 
To add to the companys problems, McDonalds hamburgers were recently named the worst in America in a poll of more than 32,000 American diners, who said they would rather eat a burger at Five Guys, Smashburger or Fuddruckers. Fast-growing US-only chain Chick-fil-A was considered to be best for chicken. McDonalds is also widely perceived as less healthy than most of its rivals, especially Chipotle, which trumpets its antibiotic-free meat and locally sourced, seasonal produce  although 'local' for Chipotle can mean 350 miles away. 
The depth of consumer mistrust of McDonalds was exposed by a consumer outreach exercise the company launched in the US in October. Have you ever used pink slime in your burgers? was one question on the Our Food Your Questions website  referring to the controversial beef filler (gristle and fat) used for dog food that is sprayed with ammonia to make it fit for human consumption. The meat product, banned in Europe since the BSE crisis, was dropped by McDonalds in 2012. 
But pink slime has left doubts in US consumers minds. Does McDonalds beef contain worms? asked another person (No. Gross. End of story, replied the company). Others wanted to know whether it uses real eggs or whether the McRib is made with the same plastic contained in yoga mats. McDonalds Chief Executive Don Thompson acknowledged the company had a job to do in addressing misconceptions about the freshness, quality and integrity of its ingredients. 
Yet, just as McDonalds has been losing the customers who will pay a bit more for food perceived as fresher and healthier, it has also lost its edge in fast-food essentials: speedy service at low prices. Ever since it introduced $2 items on its dollar menu, it has gained a reputation for being more expensive than its rivals, while many consumers complain that service is slower. 
The expensive tag was unjustified, said Mary Chapman at Technomic. Prices have indeed gone up but they havent gone up as quickly as the rest of the fast-service chains in the US. Prices at McDonalds have increased by 4.8% since 2009, well below the quick service sector average (up 19.4%), while the cost of fast casual eating, a category that includes the much-hyped Chipotle, is up 16.9%, according to Technomics menu monitor. US consumer prices rose 11% over the same period. 
But critics have a point when it comes to longer queues. McDonalds has a bigger menu than some, with more complicated items  its chicken McWrap takes 60 seconds to make. I think it is worth waiting but the guy behind me who wants his double cheeseburger for a dollar might not, said Chapman. 
In the UK, McDonalds has turned around its business, making Britain a rare bright spot for the company. A competitive breakfast menu, improved coffee and free wi-fi had given McDonalds a broad appeal in the UK, said Peter Martin of consultancy CGA Peach whose figures show that 56% of British adults have visited a McDonalds restaurant at least once in the last six months. 
Executives are promising to tackle misconceptions about its food in its home market. Thompson has promised more organic food and custom-made burgers but, to cut down queues, he also wants to introduce simpler menus. Analysts are scratching their heads about how the company can square the circle of simpler menus and greater choice over fillings. 
They want to simplify the menu but enhance its ability to customize and that sounds tricky, said Mark Kalinowski at Janney Capital Markets. Only four out of McDonalds 14,000 US restaurants had so far tested build your own burger, he said, raising questions about how it could be scaled up. Right now, we are sceptical; we would like to see more detail. 
Meanwhile, despite the declining sales, the chain continues to expand globally: by the end of 2014, it expects to have opened 1,400 new restaurants. Kalinowski expects McDonalds market share will continue to shrink but he, too, warned against writing off the company. You can never really count McDonalds out. We think it will be number one in terms of total sales for not just years but decades to come.
",3,Adv-Txt
46,"From all across Rwanda, and even parts of neighbouring Burundi, people flock to the southern town of Butare to a little shop called Inzozi Nziza (Sweet Dreams). They come for a taste of the unknown, something most have never tasted  the sweet, cold, velvety embrace of ice cream. 
Here, at the central African countrys first ice- cream parlour, customers can buy scoops in sweet cream, passion fruit, strawberry and pineapple flavours. Toppings include fresh fruit, honey, chocolate chips and granola. Black tea and coffee are also on sale. 
The shop, which has ice cream, coffee, dreams across its signage, is milking local curiosity about the dessert  and changing lives in the process, says Inzozi Nzizas manager, Louise Ingabire. 
Ice cream is important, she says between mouthfuls of a honey-flavoured offering. Some Rwandans like ice cream, but its a new thing. We still have some work to do, to tell others that theyll enjoy it. 
True to Inzozi Nzizas motto, the shop can certainly make dreams come true. I didnt have a job before: I just stayed at home. Now, I have a vision for the future. I am making money and I can give some of it to my family, says the 27-year-old. 
Butare, which has 89,600 residents and is located 135km south of the capital, Kigali, is the home of the National University of Rwanda. Inzozi Nziza has become a hub for tired students looking to treat themselves to something cool and different. 
Its something uniting people here, Kalisa Migendo, a 24-year-old agriculture student, says. If you need to go out and talk to a friend, a girl or a boy, you come to Inzozi Nziza for an ice cream. 
Most of the ingredients are sourced locally and the milk comes from a depot in nearby Nyanza. The vanilla beans and cocoa are imported. 
Inzozi Nziza was opened by the theatre director Odile Gakire Katese. She met Alexis Miesen and Jennie Dundas, co-founders of Blue Marble Ice Cream in Brooklyn, New York, and formed a partnership to open the shop in 2010. 
An ice-cream shop, Katese proposed, might help to put the human pieces back together by rebuilding spirits, hopes and family traditions, Miesen says. 
At the start, Miesen and Dundas owned the shop in partnership with its staff and had shares in the business, which is a cooperative and non-profit. They did not set financial targets, but waited for 18 months before they transferred their shares to the women, who had by then proved their business credentials. 
The shops success is no exception, says Fatuma Ndangiza, deputy chief executive of the Rwanda Governance Board. Small businesses are mostly managed by women but when it comes to big business where you have to compete for big tenders, very few women are there. Women are newcomers to big business, she points out. We have more women entrepreneurs. Its an area where women are taking an interest, both in and outside Kigali. 
Though ice cream is somewhat new to Rwanda, Ndangiza is enthused by the idea of the shop. I think its great. It requires a lot of skills and changing peoples mindsets because selling and eating ice cream is not part of our culture. I think being able to innovate and introduce this on the market, and the process of making it, is quite interesting. 
The Butare shop employs nine women, who spend their spare time practising with Ingoma Nshya, Rwandas first and only female drumming troupe, which was established by Katese ten years ago. 
The musicians are Hutu and Tutsi women, some survivors of the 1994 genocide, during which almost a million Tutsis and moderate Hutus were killed. 
Some members of Ingoma Nshya are widows, some orphans. Others have been affected by the massacre in different ways. 
Historically, says Ingabire, Rwandan women were forbidden to drum and many people considered the drums too heavy for women to carry. But its something which brings unity. 
Ingabires father, two siblings and many cousins were killed in the genocide. Some of us are survivors; some know someone who was killed, she says. When Im drumming with them, it gives me power because were still alive and survivors. 
The popular eatery features in a documentary by Rob and Lisa Fruchtman, sibling film-makers. Sweet Dreams, which tells the story of how the women have forged a promising post-genocide future, also includes the female drummers. 
The film, which has been screened in more than a dozen countries, including the US, UK and several African states, premieres in Rwanda in 2014. We feel the film is about resilience, hope, bravery, resourcefulness and the ability to change the course of your own life, says Lisa Fruchtman, who won an Academy Award for film- editing in 1984.
",3,Adv-Txt
15,"On an average day its outlets are a hive of social activity, hosting everything from business meetings to reading groups looking for that all-important morning caffeine rush. But Starbucks should be careful what it wishes for. 
The direct action group UK Uncut plans to turn dozens of the coffee empires UK branches into crches, refuges and homeless shelters to highlight the chains tax avoidance tactics. 
The announcement of the action comes on the day a Starbucks executive faces questions from the House of Commons Public Accounts Committee over why the company paid no corporation tax in the UK during the past three years, despite senior US management trumpeting the companys profitable operations in Britain. 
In his appearance before the committee, Starbucks Chief Financial Officer, Troy Alstead, will attempt to repair the companys reputation, which continues to suffer because of the controversy. 
MPs accused HM Revenue & Customs (HMRC) officials of having cosy relationships with big businesses. Speaking about the arrangements with Starbucks, the Conservative MP Richard Bacon said: It smells. And it doesnt smell of coffee  it smells bad. 
The campaign group UK Uncut is attempting to draw a link between government cuts, in particular those that affect women, and tax avoidance by multinational businesses. 
Sarah Greene, a UK Uncut activist, said funding for refuges and rape crisis centres faced cuts unless companies paid their fair share of tax. HMRC estimates around 32bn was lost to tax avoidance in 2011. 
Greene said the government could easily bring in billions that could fund vital services by clamping down on tax avoidance. 
The group, which rose to prominence after staging a sit-in at Vodafone stores, Topshop and Fortnum & Mason, turned its attentions to Starbucks last month after an investigation by Reuters discovered the company had paid only 8.6m in corporation tax since launching in the UK in 1998, despite cumulative sales of 3bn. 
Longstanding Uncut campaigner Anna Walker said Weve chosen to really highlight the impact of the cuts on women. So there is going to be a real focus on transforming Starbucks into those services that are being cut by the government  [such as] refuges and crches. 
Starbucks is a really great target because it is on every high street across the country and thats what UK Uncut finds really important: people can take action in their local areas, she said. 
Several international organizations have faced criticism over their UK accounts, with Amazon, eBay, Facebook, Google and Ikea all paying little or no corporation tax despite large British operations. 
However, according to pollsters at YouGovs BrandIndex, Starbucks has suffered the deepest damage to its image. 
The coffee store chain insists it pays the correct level of taxes. The group Chief Executive, Howard Schultz, has said in a statement: Starbucks has always paid taxes in the UK despite recent suggestions to the contrary. 
Over the last three years alone, our company has paid more than 160m in various taxes, including National Insurance contributions, VAT and business rates. 
Margaret Hodge, who chairs the Public Accounts Committee, told parliament last month that Apple, eBay, Facebook, Google and Starbucks had avoided nearly 900m of tax. The Prime Minister, David Cameron, responded to the claim by saying: Im not happy with the current situation. I think [HMRC] needs to look at it very carefully. We do need to make sure we are encouraging these businesses to invest in our country as they are, but they should be paying fair taxes as well. 
A spokeswoman for Starbucks said: While the subject of tax law can be extremely complex, Starbucks respects and complies with tax laws and accounting rules in each of the 61 countries where we do business, including the UK  a market that we remain committed to for the long term. Weve posted the facts about our tax practices in the UK on our website. 
Starbucks economic impact in the UK goes far beyond our stores and partners [employees]. We spend hundreds of millions of pounds with local suppliers on milk, cakes and sandwiches, and on store design and renovations. When you take into account the indirect employment created by Starbucks investments in the UK, the companys extended economic impact to the UK economy exceeds 80m annually. 
We hope that UK Uncut will respect the wellbeing of our partners and customers, and recognize the value that we add to the economy, creating jobs and apprenticeships, as well as paying our fair share of taxes in the UK.  
",3,Adv-Txt
185,"Scientists have created an atlas of the brain that reveals how the meanings of words are arranged across different regions of the organ. Like a colourful quilt laid over the cortex, the atlas displays in rainbow hues how individual words and the concepts they convey can be grouped together in clumps of white matter.
Our goal was to build a giant atlas that shows how one specific aspect of language is represented in the brain, in this case semantics or the meanings of words, said Jack Gallant, a neuroscientist at the University of California, Berkeley.
No single brain region holds one word or concept. A single brain spot is associated with a number of related words. And, each single word lights up many different brain spots. Together, they make up networks that represent the meanings of each word we use: life and love, death and taxes, clouds, Florida and bra. All light up their own networks.
Described as a tour de force by one researcher who was not involved in the study, the atlas demonstrates how modern imaging can transform our knowledge of how the brain performs some of its most important tasks. With further advances, the technology could have a profound impact on medicine and other fields.
It is possible that this approach could be used to decode information about what words a person is hearing, reading or possibly even thinking, said Alexander Huth, the first author on the study. One potential use would be a language decoder that could allow people silenced by motor neurone disease or locked-in syndrome to speak through a computer.
To create the atlas, the scientists recorded peoples brain activity while they listened to stories read out on The Moth Radio Hour, a US radio show. They then matched the transcripts of the stories with the brain activity data to show how groups of related words triggered neural responses in 50,000 to 80,000 pea-sized spots all over the cerebral cortex.
Huth used stories from The Moth Radio Hour because they are short and compelling. The more enthralling the stories, the more confident the scientists could be that the people being scanned were focusing on the words and not drifting off. Seven people listened to two hours of stories each. Per person, that amounted to hearing roughly 25,000 words  and more than 3,000different words  as they lay in the scanner. 
The atlas shows how words and related terms exercise the same regions of the brain. For example, on the left-hand side of the brain, above the ear, is one of the tiny regions that represents the word victim. The same region responds to killed, convicted, murdered and confessed. On the brains right-hand side, near the top of the head, is one of the brain spots activated by family terms: wife, husband, children, parents.
Each word is represented by more than one spot because words tend to have several meanings. One part of the brain, for example, reliably responds to the word top, along with other words that describe clothing. But, the word top activates many other regions. One of them responds to numbers and measurements, another to buildings and places. The scientists have created an interactive website where the public can explore the brain atlas.
Strikingly, the brain atlases were similar for all the participants, suggesting that their brains organized the meanings of words in the same way. The scientists only scanned five men and two women, however. All are native English speakers and two are authors of the study published in Nature. It is highly possible that people from different backgrounds and cultures will have different semantic brain atlases.
Armed with the atlas, researchers can now piece together the brain networks that represent wildly different concepts, from numbers to murder and religion. The idea of murder is represented a lot in the brain, Gallant said. 
Using the same data, the group has begun work on new atlases that show how the brain holds information on other aspects of language, from phonemes to syntax. A brain atlas for narrative structure has so far proved elusive, however. Every time we come up with a set of narrative features, we get told they arent the right set of narrative features, said Gallant.
Uri Hasson, a neuroscientist at Princeton University, praised the work. Unlike many studies that looked at brain activity when an isolated word or sentence was spoken, Gallants team had shed light on how the brain worked in a real- world scenario, he said. The next step, he added, was to create a more comprehensive and precise semantic brain atlas. Ultimately, Hasson believes it will be possible to reconstruct the words a person is thinking from their brain activity. The ethical implications are enormous. One more benign use would see brain activity used to assess whether political messages have been effectively communicated to the public. There are so many implications and we are barely touching the surface, he said. 
Lorraine Tyler, a cognitive neuroscientist and head of the Centre for Speech, Language and the Brain at Cambridge University, said the research was a tour de force in its scope and methods. But, the brain atlas in its current form does not capture fine differences in word meanings. While this research is path-breaking in its scope, there is still a lot to learn about how semantics is represented in the brain. 
",3,Adv-Txt
144,"Organic food has more of the antioxidant compounds linked to better health than regular food, and lower levels of toxic metals and pesticides, according to the most comprehensive scientific analysis to date. The international team behind the work suggests that switching to organic fruit and vegetables could give the same benefits as adding one or two portions of the recommended 'five a day'. 
The team, led by Professor Carlo Leifert at Newcastle University, concludes that there are statistically significant, meaningful differences, with a range of antioxidants being substantially higher  between 19% and 69%  in organic food. It is the first study to demonstrate clear and wide-ranging differences between organic and conventional fruits, vegetables and cereals. 
The researchers say the increased levels of antioxidants are equivalent to one to two of the five portions of fruits and vegetables recommended to be consumed daily and would therefore be significant and meaningful in terms of human nutrition, if information linking these compounds to the health benefits associated with increased fruit, vegetable and wholegrain consumption is confirmed. 
The findings will add to the controversy over organic food and whether it is better for people, with one expert saying that the findings were exaggerated. Tom Sanders, a professor of nutrition at Kings College London, said the research did show some differences. But the question is are they within natural variation? And are they nutritionally relevant? I am not convinced. He said Leiferts work had caused controversy in the past. Leifert has had a lot of disagreements with a lot of people. Sanders added the research showed organic cereals have less protein than conventional crops. 
The results of the research are based on an analysis of 343 peer-reviewed studies from around the world  more than ever before  which examine differences between organic and conventional fruit, vegetables and cereals. The crucially important thing about this research is that it shatters the myth that how we farm does not affect the quality of the food we eat, said Helen Browning, chief executive of the Soil Association, which campaigns for organic farming. 
Plants produce many of their antioxidant compounds to fight back against pest attacks, so the higher levels in organic crops may result from their lack of protection by chemical sprays. But, the scientists say other reasons may be important, such as organic varieties being bred for toughness and not being overfed with artificial fertilizers. 
Leifert and his colleagues conclude that many antioxidants have previously been linked to a reduced risk of chronic diseases, including cardiovascular diseases, neurodegenerative diseases and certain cancers. But, they also note that no long-term studies showing health benefits from a broad organic diet have yet been conducted. The researchers found much higher levels of cadmium, a toxic metal, in conventional crops. Pesticide residues were found on conventional crops four times more often than on organic food. The research was funded by the EU and an organic farming charity. 
The research is certain to be criticized: the inclusion of so many studies in the analysis could mean poor-quality work skews the results, although the team did sensitivity analyses and found that excluding weaker work did not significantly change the outcome. Also, the higher levels of cadmium and pesticides in conventional produce were still well below regulatory limits. But, the researchers say cadmium accumulates over time in the body and that some people may wish to avoid this, and that pesticide limits are set individually, not for the cocktail of chemicals used on crops. 
A further criticism is that the differences seen may result from different climates, soil types and crop varieties, and not from organic farming, though the researchers argue that combining many studies should average out these other differences. The greatest criticism, however, will be over the suggestions of potential health benefits. The most recent major analysis, which took in 223 studies in 2012, found little evidence. The published literature lacks strong evidence that organic foods are significantly more nutritious than conventional foods, it found. 
This was also the conclusion of earlier, smaller studies published in 2009 in a scientific journal and by the UK Food Standards Agency, though the latter considered just 11 studies. The 2012 study did note that eating organic food might help people avoid pesticide residues. Sanders said he was not persuaded by the new work. You are not going to be better nourished if you eat organic food, he said. What is most important is what you eat, not whether its organic or conventional. Its whether you eat fruit and vegetables at all. People are buying into a lifestyle system. They get an assurance it is not being grown with chemicals and is not grown by big business. 
Opinion polls show healthy eating (55%) and avoiding chemical residues (53%) are key reasons cited by shoppers for buying organic produce. But, many also say care for the environment (44%) and animal welfare (31%) are important, as is taste (35%). Browning said: This research backs up what people think about organic food. In other countries, there have long been much higher levels of support and acceptance of the benefits of organic food and farming. We hope these findings will bring the UK into line with the rest of Europe.  
",3,Adv-Txt
