Index,Text,Grade,Type
141,"Ninety-six people died at Sheffield Wednesdays Hillsborough Stadium in 1989. During an extraordinary day 23 years later at Liverpool Cathedral, where the families of the victims met to see a report on the disaster, the most important words were: the truth. This was the headline in The Sun newspaper. We now know that the story in the newspaper was false and that the police gave them the story. 
Margaret Aspinalls son James, then 18, died at the match between Liverpool and Nottingham Forest. She said the families had to fight for 23 years for the truth. She said that the families sadness will never go away, but she is very pleased that the Prime Minister said sorry for Hillsborough. 
An independent panel looked at 450,000 documents written by the police, Sheffield Wednesday and all the other groups involved. The panel then wrote a 395-page report. In the report they criticize official mistakes and say that the victims and other fans were not to blame. We already knew the cause of the disaster but we didnt know that the police cover-up was so big. It is shocking how the police blamed the football fans for the disaster. 
The panel found that the South Yorkshire Police, led by the Chief Constable, Peter Wright, told their story that drunken fans or those without tickets caused the disaster. They tested the victims blood for alcohol. When victims had alcohol in their blood, the police then checked to find if they had criminal records. The police said that many Liverpool fans were very drunk, were without tickets and were very violent, but the report found no evidence for this. 
The report said that Wright met with police in a Sheffield restaurant to prepare a defence and a story . The meeting happened just four days after the disaster. It was the day that The Sun newspaper published its headline The Truth and the story by four senior South Yorkshire police officers.
The panel found that officers statements were changed to remove criticism of the police and emphasize bad behaviour by fans. The panel found that 116 of 164 statements were changed to remove or change negative comments about South Yorkshire police. The police said this was done only to remove opinion from the statements, but the panel said they did more than that. It was done to remove criticism of the police, the report said. 
The original inquiry did not believe this propaganda. It decided in August 1989 that the police stories of fan drunkenness and violence were false, and it criticized the police for telling lies. It said that Sheffield Wednesdays stadium was unsafe, that the Football Association chose that stadium for the match without even checking if it had a safety certificate. It did not have a certificate. 
But the main cause of the disaster was the way the police controlled the crowd. The police lost control outside the stadium, where 24,000 Liverpool fans had to go through just 23 small entrance gates. So police opened a large exit gate and lots of people were allowed in. They did not close one of the tunnels and, the inquiry said, this was their big mistake. 
But the police still repeated their lies at the inquest. The coroner decided not to take evidence of what happened after 3.15pm on the day of the disaster, so he did not look at the chaotic behaviour of the police and the ambulance service. The panel found that if the police and ambulance service had done their jobs better, they could have saved 41 of the 96 lives lost. 
There may now be a new inquest. There may be prosecutions too, after all these years, of Sheffield Wednesday, South Yorkshire Police and Sheffield City Council, which was responsible for the safety of the stadium. Trevor Hicks, whose two daughters died in the disaster, said: The truth is out today, Hicks said. Tomorrow is for justice.
",1,Ele-Txt
129,"A new scientic study says that global warming might make temperatures rise more than people think. The scientist who led the research said that, if emissions of greenhouse gases are not reduced, the planet will be at least 4C warmer by 2100. This is twice the level the worlds governments consider to be dangerous. The research shows that fewer clouds form as the planet warms. This means that less sunlight reects back into space and this makes temperatures even higher. The way clouds affect global warming has been the biggest mystery in the study of future climate change.
Professor Steven Sherwood, at the University of New South Wales in Australia, who led the research, said that their work was new in two ways. First, it found what controls the cloud changes and, second, it did not accept the lowest estimates of future global warming; it believed the higher, more damaging estimates.
4C would be catastrophic, not simply dangerous, Sherwood said. For example, it would make life difcult, if not impossible, in much of the tropics and it would guarantee the eventual melting of the Greenland ice sheet and some of the Antarctic ice sheet. And, if the ice sheets melt, sea levels will rise by many metres.
The research helps to show how much warming is caused by rises in carbon emissions, say scientists who have commented on the study, published in the journal Nature. 
Experts at Japans National Institute for Environmental Studies said the explanation of how fewer clouds form as the world warms was a good one. They also agreed that this showed future climate change would be bigger than people think. To measure the effect of greenhouse gases on the Earths climate, scientists estimate what the rise in temperature would be with twice as much CO in the atmosphere as in the pre-industrial age  and this will probably happen within 50 years. For twenty years, those estimates have been from 1.5C to 5C: a wide range. The new research has reduced that range to between 3C and 5C, by studying the biggest cause of uncertainty: clouds.
Researchers use computer climate models to predict future temperatures and it was important to include the way clouds form in those models. When water evaporates from the oceans, the vapour can rise over nine miles to form rain clouds that reect sunlight; or, it may rise just a few miles and fall slowly back down without forming clouds. 
In reality, both things happen and climate models that include the second possibility predict much higher future temperatures than the models that only include the nine-mile-high clouds. Climate sceptics like to criticize climate models because they are sometimes wrong, and we know that they are not perfect, said Sherwood. But we are nding that the mistakes are being made by the models that predict less warming, not the models that predict more warming. He added: Sceptics may also point to the pause in the rise of temperatures since the end of the 20th century, but there is more and more evidence that we cannot see this pause in other measures of the climate system. 
And the pause is almost certainly temporary.  The worlds average air temperatures have increased quite slowly since a high point in 1998, which the ocean phenomenon El Nio caused. But, greenhouse gases are trapping more and more heat and over 90% disappears into the oceans. Also, a recent study suggested that it may seem there is a pause, but this is only because we did not have temperature readings from polar regions, where there is the most warming. Sherwood accepts that his teams work on the role of clouds does not mean for sure that temperature rises will be in the higher range. He added that a 4C rise in the worlds average temperatures would have a serious effect on the world and the economies of many countries if we do not reduce emissions.
",1,Ele-Txt
108,"Do you want your child to be good at sport, play for the school team and, maybe one day, even be in international competitions? Well, try to make sure that your child is born in November or October. A study by a top expert on childrens physical activity has found that schoolchildren born in November or October are fitter than everyone else in their class.
Children born in November or October were fitter, stronger and more powerful than children born in the other ten months of the year. They are especially fitter, stronger and more powerful than children with birthdays in April or June. Dr Gavin Sandercock of Essex University and his colleagues found that children born in the autumn had a clear physical advantage over their classmates.
The research involved 8,550 boys and girls aged between ten and 16 from 26 state schools in Essex. All were tested between 2007 and 2010 on three different things: stamina, handgrip strength and lower-body power. The results showed that a childs month of birth could make big differences to their levels of fitness, muscle strength and ability to accelerate, all of which predict how good someone is at sport.
November children were the fittest because they had the most stamina and power and were the second strongest. Children born in October were almost as fit  they scored highest for strength and came third for power, with December children close behind.
The gap in physical ability between children in the same class but born in different months was sometimes very wide. For example, we found that a boy born in November can run at least 10% faster, jump 12% higher and is 15% more powerful than a child of the same age born in April. This is a huge physical advantage, said Sandercock. These gaps could decide who became a top-level athlete because selection into elite sports may often depend on very small differences in a person s physical performance .
The study found that, when scores for the three kinds of fitness were put together, children born in April were the least fit, followed by children born in June. The findings seem to show that children born in the early months of the school year enjoy a double autumn advantage  we already know that they have an academic advantage and, now, they also seem to be better at sport, too.
The authors of the study believe that the most likely explanation is that children born in autumn get more vitamin D over the summer months towards the end of pregnancy. John Steele, chief executive of the Youth Sport Trust, said the quality of a young person s introduction to sport at school can be a major factor in their sporting development. Children that get a high-quality first experience will have greater agility, balance and coordination, and are more likely to develop an enjoyment of physical activity and be good at sport as they grow up, he said.
UK Sport could not say if a majority of the 1,300 athletes it gives money to were born in November and October. Natalie Dunman, its head of performance, said that the differences shown in the new study were true for teenagers in junior-level competitions, but that the differences disappear before sportspeople were in adult competitions. She said: With adult athletes, there are many factors that make a champion and we dont think that month of birth is one of the key ingredients.
",1,Ele-Txt
132,"There are bird droppings in one of Britains most expensive houses. Pigeon skeletons lie among broken mirrors and water is coming through the walls. This is The Tower, a 30m palace in Billionaires Row in north London. 
It is one of ten mansions in the middle of The Bishops Avenue that have been empty for many years. The Saudi Arabian royal family bought it. Their Grecian columns are cracking into pieces and mosaic-tiled swimming pools are filled with broken stones. Nature has taken control and owls have moved in. 
You see the same thing again and again on the avenue. Lloyds Bank says The Bishops Avenue is the second most expensive street in Britain. House prices in London are rising at 11.2% a year. More and more people find it difficult to buy a house, but 16 mansions on the most expensive part of The Bishops Avenue are empty. Their gates are locked and there are guard dogs in their overgrown gardens. 
Across the street stands another empty mansion worth 18m. It has broken windows and its walls are painted with anti-climb paint. Metal bars block the windows of another mansion, which has sold for 20m. 
For people who find it very difficult to keep a roof above their heads in one of the worlds most expensive cities, seeing the empty houses can be painful. One security guard who works on the avenue said it was annoying to see so many mansions  enough for many people to live in  falling apart. 
Rich royals from Nigeria and Saudi Arabia came to this road near Hampstead Heath first. Iranians came here after the fall of the shah. Now, Chinese house hunters are following Russians and Kazakhs who have spent millions to get an address that estate agents tell them is as world famous as the Champs Elyses and Rodeo Drive. Recently, two mansions have been on sale for 65m and 38m. 
But in the grounds of the empty mansions, stone fountains crumble. Inside one mansion, the ceiling has collapsed and water drips through a huge crystal chandelier onto a thick carpet, which is rotting. Moss grows through bricks and mirrored tiles are lying on a bathroom floor. The swimming pool is filled with dirty water and has flowers growing through its tiles. The wood in the sauna is coming off the walls. 
But it is the ruin of The Towers, a grand mansion, that is most dramatic. There are pigeons in its huge, high-ceiling halls and its walls are bright green with algae. 
Today, very few people live on The Bishops Avenue all the time. A security guard outside one mansion said that the owners were not there. Another guard outside Royal Mansion would not say if anyone was home and a member of staff at another mansion warned the Guardian about the guard dogs. 
Magdy Adib Ishak-Hannah, who has 45m, said he is one of the few residents who lives there all the time. 
I have never seen what my neighbours look like. Next door, a Saudi princess spent 35m on a new house and Ive never seen her. There are about three houses that are lived in 24/7 and half of the houses are lived in three to six months a year. The other half, who knows if they come or not? he said. 
The reason for the multimillion-pound ruins is that some of the worlds richest people see British houses as an investment. 
Anil Varma, who develops homes and then sells them, wants to build 5m apartments, instead of 50m mansions, to try to bring people back. 
He has decided to rebuild one of the most expensive sites on the avenue as a collection of 20 apartments with a concierge, maid service, 25-metre pool, spa and cinema.
",1,Ele-Txt
168,"It was a beautiful summer evening and I decided to go for a swim from Doolin Pier in County Clare, Ireland, where I moved in 2012. There was a woman in the water with Dusty, a dolphin who has a great relationship with a group of people she regularly swims with. Dusty arrived in Doolin in about 2008. Hundreds of people have swum with her, so everyone thinks that shes totally tame. 
That evening, the woman was tickling Dustys tummy and it looked so nice in the water. There were about 20 tourists and locals on the pier. They were looking at this lovely sight. Just after I got into the water, Dusty left the woman she was with and went crazy  I found out afterwards that shes very territorial when she is with somebody. Her tail was flapping wildly and, at first, I thought it was a display but, then, I realized she was angry. I knew I had to get out of the water so I swam towards the pier. But, within seconds, Dusty crashed into me with her nose. It was very powerful and painful, and the speed was amazing. 
All the people on the pier were staring at me with their mouths open. Dusty was still in the water beside me, her tail flapping crazily. That was the most frightening thing: I thought, if she hits me with her tail, I could go under the water and drown. 
I was at the pier but I couldnt get out because of my injuries. I was terrified. I shouted for help and a man put his arm in and pulled me out of the water. Then, another man appeared and said he was a doctor. I was so cold and very worried  I didnt know how bad my injuries were and my biggest fear was internal bleeding. The doctor said he didnt think I had internal bleeding but he thought I probably had broken bones. I found out later that I had six spinal fractures, three broken ribs and a damaged lung. 
I was in hospital for five days and I couldnt work for five months. I couldnt move normally and I was in pain. Then, doctors told me I had post- traumatic stress. My near-death experience made me anxious about everything. I felt that people were looking at me in the wrong way, I began to have problems with loud noises and I suffered from memory loss. I could no longer work. 
It was the hardest year ever but, now, things are better. I had therapy, osteopathy and massage. I work as an osteopath now. I understand how the patients feel because I have been a patient myself. 
I am grateful that I am healthy. I really want to prevent other people being injured. We think dolphins are lovely and we have faith in them  who would think a dolphin would ever attack a person? If you see a dangerous animal coming towards you with big teeth, its scary, but dolphins have this lovely, wide smile. 
I dont have any anger towards Dusty. I respect her. But I was in her territory and shes a wild, unpredictable animal. People need to know that. So many people come here to swim with her and they dont understand how dangerous it can be. Several other people were injured that summer. 
After the man pulled me out of the water, Dusty swam away but, then, she came back and looked at me. Our eyes met and I felt she was sorry for what she did to me. She was a totally different dolphin; the anger was gone. The people on the pier were amazed. When she had that little moment with me, that was the end of the terror. I forgave her. 
",1,Ele-Txt
163,"Nobody knows which came first: the economic crisis in Greece or shisha, the drug that is called the cocaine of the poor. But everyone agrees that shisha is a killer. And it costs only 2 or less. 
It is the worst drug. It burns your insides, it makes you aggressive and makes you go mad, said Maria, an ex-heroin addict. But it is cheap and it is easy to get, and everyone is taking it. 
This drug crisis is making problems for Athenss health authorities, who already have the problem of large financial cuts. 
Thousands of homeless Greeks, who live on the streets because of poverty and a loss of hope, are taking shisha. The drug is related to crystal meth. It is often mixed with battery acid, engine oil and even shampoo. It can make users become aggressive. And, even worse, it is easy to buy and easy to make. 
It is a killer, but it also makes you want to kill, Konstantinos, a drug addict, said. You can kill without understanding that you have done it. A lot of users have died. 
Charalampos Poulopoulos, the director of Kethea, Greeces anti-drug centre, said shisha is an austerity drug  it is made by dealers who have become clever at making drugs for addicts who can no longer afford heroin and cocaine. 
The crisis has given dealers the possibility to sell a new, cheap drug, a cocaine for the poor, said Poulopoulos. You can sniff or inject shisha and you can make it at home  you dont need any special knowledge. It is extremely dangerous. 
In all parts of Greece, there is a lot of depression, and drug and alcohol abuse. Crime has increased because austerity measures have cut the income of ordinary Greeks by 40%. Prostitution  the easiest way to pay for drugs  has also increased. 
There are more suicides and HIV infections, and drug addicts (around 25,000 people) have become more and more self- destructive. Sixty-four per cent of young people in Greece are unemployed  this is the highest youth unemployment in the EU. 
At the time when organizations such as Kethea need extra help, the Greek state has cut by a third the money it gives them. The European Commission, European Central Bank and International Monetary Fund asked them to do this to help save the Greek economy. 
Since the economic crisis began in 2009, Kethea has lost 70 of its 500 staff. They get less money, but studies show that for every euro the Greek state spends on anti-drug programmes such as Kethea, it saves about 6 because there is less crime and fewer health problems. The cuts are a huge mistake, said Poulopoulos. 
On the streets of Athens, there is a fear that austerity not only doesnt work  it kills.
",1,Ele-Txt
60,"BB King was most famous for blues music but he was always interested in other types of music and different cultures. Perhaps it is too early to say he is the last of the bluesmen but it is hard to imagine that any future blues artist will have the influence as BB King. He influenced thousands of musicians and millions of music fans in a career that lasted 65 years.
Riley B King was born in Mississippi, the son of African-American farm workers. He learnt the guitar from a family friend and learnt to sing with a quartet of gospel singers. In his early 20s, he moved to Memphis.
He was soon playing regularly at a bar in West Memphis and he also became a disc jockey, with a show on a local radio station. He was known as The Beale Street Blues Boy but this was shortened to Blues Boy King and then to BB. In 1950, King began recording for Modern Records.
He had his first hit in 1952 with Three OClock Blues. It was number one in the R&B chart for 15 weeks; it was the first of many hits. King developed a style that was new and different but had its roots in blues history. He often praised the musicians who influenced him and he usually mentioned T-Bone Walker first. He also mentioned the earlier blues guitarists Blind Lemon Jefferson and Lonnie Johnson and the jazz players Charlie Christian and Django Reinhardt. 
He once explained that his guitar technique was partly the result of his lack of skill: I started to bend notes because I could never play in the bottleneck style. I loved that sound but just couldnt do it. During the 1950s, King was the leading blues artist in many series of concerts. In 1956, he played 342 concerts. In 1962, he tried to change that working pattern by signing with a major label, ABC. But the first records under that contract were not very successful with his fans or with the record company.
But his 1965 album, Live at the Regal, has become famous and influenced many younger musicians. He had more R&B hits with blues songs and, in 1969, he was near the top of the pop charts  where no blues artist had been for many years  with a song called The Thrill Is Gone.
It was a long time before he became known to a rock audience but musicians who admired him brought him to the attention of rock fans. About a year and a half ago, he said in 1969, kids suddenly started saying to me, Youre the greatest blues guitarist in the world. And Id say, Who told you that? And theyd say, Mike Bloomfield or Eric Clapton. These young musicians made me popular again.
From then on, King was well known as a leading blues artist. He went on international concert tours to Japan, Australia, China and Russia. He also gave concerts to prisoners in Chicago and at San Quentin. 
In 1990, doctors told King he had diabetes and he reduced his touring. He now had to play sitting down but his singing and playing were almost as good as ever. The celebrations for his 80th birthday, in 2005, included an award-winning album with Clapton, Mark Knopfler, Roger Daltrey, Gloria Estefan and others, tributes from Bono, Amadou Bagayoko and Elton John, and a goodbye tour that was not a goodbye at all.
In 2009, King received a Grammy award, for best traditional blues album, for One Kind Favor. In 2012, he performed at a concert at the White House, where the US President, Barack Obama, joined him to sing Sweet Home Chicago. King was twice married and twice divorced. He is survived by 11 children by various partners; four others died before him.",1,Ele-Txt
