Index,Text,Grade,Type
81,"Intermediate 
According to a report by the World Health Organization (WHO), 35.6% of all women around the world will experience physical or sexual violence in their lifetime, usually from a male partner. The report reveals the shocking extent of attacks on women from the men with whom they share their lives, with 30% of women being attacked by partners. It also finds that a large proportion of murders of women  38%  are carried out by their partners.
The highest levels of violence against women are in Africa, where nearly half of all women  45.6%  will suffer physical or sexual violence. In low- and middle-income Europe, the proportion is 27.2%. However, wealthier nations are not always safer for women  a third of women in high-income countries (32.7%) will experience violence at some stage in their lives. 42% of the women who experience violence suffer injuries, which can bring them to the attention of healthcare staff. That, says the report, is often the first opportunity for violence in the home to be discovered and for the woman to be offered help. Violence has a significant effect on womens health. Some arrive at hospital with broken bones, while others suffer pregnancy-related complications and mental illness.
The two reports from the WHO  one is on the extent of violence, the other offers guidelines to healthcare staff on helping women  are the work of Dr Claudia Garcia-Moreno, lead specialist in gender, reproductive rights, sexual health and adolescence at WHO, and Professor Charlotte Watts, an epidemiologist who specializes in gender, violence and health, from the London School of Hygiene and Tropical Medicine.
For the first time, we have compared data from all over the world on the extent of partner violence and sexual violence by non-partners and the impact of these sorts of violence on health, said Garcia-Moreno. These included HIV and other sexually transmitted infections, depression, alcoholism, unwanted pregnancies and lowbirthweight babies.
There were variations in the rates of violence against women in different regions of the world but, said Garcia-Moreno, in whatever region we looked at, it is unacceptably high. Data from 81 countries shows that, even in high-income countries, 23.2% of women will suffer physical and/or sexual violence from a partner in their lives. The global figure for women attacked by partners was 30%.
More sexual assaults and rapes by acquaintances or strangers are reported in high-income countries than elsewhere  the report says that 12.6% of women in wealthy countries will be sexually attacked by a non-partner in their lives, which is higher than the African rate of 11.9%. But, the data on such crimes is not well collected in all regions.
The authors say that their previous research shows that better-educated women and working women are less likely to suffer violence, although not in all regions. There is a need to question social norms, said Watts. What is societys attitude concerning the acceptability of certain forms of violence against women? she asked. In some societies, it is not OK  but not all.
I think the numbers are a wake-up call for all of us to pay more attention to this issue, said Garcia-Moreno. Over the past ten years, there has been increasing recognition of the problem, she said, but we have to recognize that it is a complex problem. We dont have a vaccine or a pill.
The new WHO clinical and policy guidelines recommend healthcare staff should be trained to recognize the signs of domestic violence and sexual assault, but they do not recommend general screening  that is, asking every woman who arrives in a clinic whether she has been subjected to violence.
But, if you see a woman coming back several times with injuries she doesnt mention, you should ask about domestic violence, said Garcia-Moreno. When I was training in medical school, it wasnt something you learned or knew about. Years later, I was sometimes in a situation where I could tell there was something else wrong with the woman I was interviewing, but didnt know that domestic violence was the issue. Now, I think I would do the interview very differently.

",2,Int-Txt
82,"Intermediate 
The forests  and suburbs  of Europe are echoing with the growls and howls of large predators according to a new study. The study shows that brown bears, wolves and lynx are thriving on the crowded continent. Rising human populations and overconsumption make many people believe that such animals will soon become extinct. But the study has found that large-predator populations are stable or rising in Europe.
Brown bears, wolves and the Eurasian lynx are found in nearly one-third of mainland Europe (excluding Belarus, Ukraine and Russia), with most living outside nature reserves. This indicates that changing attitudes and conservation measures are successfully protecting species that have suffered massive persecution throughout human history.
Bears are the most abundant large carnivore in Europe  there are around 17,000 of them. There are 12,000 wolves and 9,000 Eurasian lynx. Only Belgium, Denmark, the Netherlands and Luxembourg in mainland Europe  like Britain  have no breeding populations of at least one large carnivore species. But the studys main author and other conservationists said that these animals now live in well-populated regions of Europe, so even the British countryside could support big predators.
Guillaume Chapron from Swedens University of Agricultural Sciences and researchers across Europe found wolves, in some cases, living in suburban areas alongside up to 3,050 people per square kilometre. On average in Europe, wolves live on land with a population density of 37 people per sq km, lynx in areas with a population density of 21 people per sq km and bears among 19 people per sq km. The population density of the Scottish Highlands is just nine people per sq km.
In order to have wolves, we dont need to remove people from the landscape, said Chapron. He adds that the big-carnivore revival shows the success of a land-sharing model of conservation  unlike the policy of keeping predators and people apart by fencing off wilderness areas, as occurs in North America and Africa.
Im not saying its a peace-and-love story  coexistence often means conflict  but its important to manage that conflict and resolve the problems it causes. Wolves can be difficult neighbours, said Chapron. We shouldnt be talking about people-predator conflict; we have conflict between people about predators. These animals are symbolic of difficult questions about how we should use the land.
According to the researchers, this land-sharing approach could be applied elsewhere in the world. The reasons for its success in Europe include political stability, growing populations of prey species such as wild deer, and financial support for nonlethal livestock protection such as electric fences, which mean that farmers do not have to shoot wild predators. Most crucial, said Chapron, has been the EU Habitats Directive, which has forced member states to protect and revive rare species.
Without the Habitats Directive, I dont think we would have had this recovery, he said. It shows that, if people are willing to protect nature and if politicians introduce strong legislation, its possible to achieve results in wildlife protection. The revival was welcomed by author George Monbiot, who is launching Rewilding Britain, a new charity to encourage the return of wild landscape and extinct species.
It is great to see this trend continuing but Britain is completely anomalous  weve lost more of our large mammals than any country except for Ireland, he said. Apart from the accidental reintroduction of wild boar, weve done almost nothing, whereas in much of the rest of Europe weve got bears, lynx and wolves coming back.
The survey found that the Eurasian lynx lives permanently in 11 population groups in 23 European countries and only five of these were native populations. This indicates the success of reintroduction efforts. According to Monbiot, support for the reintroduction of the lynx into the Scottish mountains is growing.
If it works in the rest of Europe, theres absolutely no reason why it cant work in the UK, he said. He points out that bears and wolves live within an hour of Rome. Theres no reason why we cant have a similar return of wildlife in the UK.
",2,Int-Txt
163,"Intermediate 
According to a top-secret document, the National Security Agency (NSA) has got direct access to the systems of Google, Facebook, Apple and other major US internet companies. The NSA access is part of a program called PRISM, which allows officials to collect material including search history, the content of emails, file transfers and live chats, the document says.
The document claims collection directly from the servers of major US service providers. Although the document claims that the program is run with the help of the companies, all the companies who responded to a request for comment denied knowledge of any such program.
In a statement, Google said: Google cares deeply about the security of our users data. We disclose user data to government in accordance with the law and we review all such requests carefully. From time to time, people allege that we have created a government back door into our systems, but Google does not have a back door for the government to access private user data.
Several senior tech executives insisted that they had no knowledge of PRISM or of any similar scheme. They said they would never have been involved in such a program. If they are doing this, they are doing it without our knowledge, one said. An Apple spokesman said he had never heard of PRISM.
The NSA access became possible because of changes to US surveillance law, introduced under President Bush and renewed under Obama in December 2012. The program facilitates a large amount of in-depth surveillance on live communications and stored information. The law allows for the targeting of any customers of participating companies who live outside the US, or those Americans whose communications include people outside the US.
The revelation of the PRISM program follows a leak of a top-secret court order that forced telecoms provider Verizon to give the telephone records of millions of US customers to the US government. The participation of the internet companies in PRISM will add to the debate about the level of surveillance by the intelligence services. Unlike the collection of those call records from Verizon, this surveillance can include the content of communications and not just the metadata.
It is claimed that some of the worlds largest internet companies are part of the information-sharing program, which was introduced in 2007. Microsoft  which is currently running an advertising campaign with the slogan Your privacy is our priority  was the first, with collection beginning in December 2007. It was followed by Yahoo in 2008; Google, Facebook and PalTalk in 2009; YouTube in 2010; Skype and AOL in 2011; and finally Apple, which joined the program in 2012.
Under US law, companies must comply with requests for users communications, but the PRISM program allows the intelligence services direct access to the companies servers. The NSA document notes that the operations have the help of communications providers in the US.
During the renewal of the FISA Amendments Act (FAA) in December 2012, several US senators warned about the high level of surveillance the law might allow and shortcomings in the safeguards it introduces. When the FAA was first introduced, its supporters argued that one safeguard would be the fact that the NSA could not get electronic communications without the permission of the telecom and internet companies that control the data. But the PRISM program makes that permission unnecessary, because it allows the agency to take the communications directly off the companies servers, communications that include email, video and voice chat, videos, photos, voice-over-IP (Skype, for example) chats, file transfers and social networking details.
The PRISM program allows the NSA, the worlds largest surveillance organization, to get targeted communications without requesting them from the service providers and without needing individual court orders. With this program, the NSA is able to reach directly into the servers of the companies and get both stored communications and live communications.
A senior administration official said in a statement: The Guardian and Washington Post articles refer to collection of communications under Section 702 of the Foreign Intelligence Surveillance Act (FISA). This law does not allow the targeting of any US citizen or of any person who is within the United States. The program is overseen by the Foreign Intelligence Surveillance Court, the Executive Branch and Congress. Only non-US persons outside the US are targeted. The program must limit the information it gets, keeps and disseminates about US citizens.
This program was recently reauthorized by Congress after a lot of debate. Information that is collected under this program is some of the most important and valuable intelligence information we collect and it is used to protect our nation from a wide variety of threats.

",2,Int-Txt
25,"Intermediate 
The problem with Google Glasses, says Takahito Iguchi, is that theyre not cool. He may be right. Theres already a website dedicated to people wearing them looking either ridiculous or smug or, more often, both. Search Google Images and one of the first hits is a picture of a large, naked man wearing them in the shower. And its this that Iguchi, a Japanese entrepreneur, hopes may be Googles Achilles heel. He is launching a competitor that is a bit more stylish. A bit more Blade Runner. A bit more Japanese.
Iguchis augmented reality glasses arent really glasses  they are more a single piece of metal with a camera and a tiny projector. They are called Telepathy One and, since they were presented to the public for the first time in Austin, Texas, they have attracted $5m of venture capital. Like Glass, Telepathy One is due to launch in 2014.
Its a simplified version of Google Glass. Glass has a range of uses  you can surf the internet, read emails, take photographs  but Telepathy will be more of a communication device. Connected via Bluetooth to your phone, it will focus on real-time visual and audio sharing. Youll be able to post photos and videos from your line of vision on Facebook or send them as an email, or see and speak to a video image of a friend.
It will help bring you close to your friends and family. We are very focused on the communication and sharing possibilities, says Iguchi, who has worked in the Japanese technology industry for 20 years.
Of course, not everyone wants to get closer to the man in the futuristic headset, I tell him. Iguchi shakes his head. Im a visionary. I have a dream that people will understand other people. When I go to London, I am a stranger. Sometimes I feel fear. But I believe that everyone wants to be understood and to understand each other. And, with this device, you can know more information about people before you even speak to them.
Compared to Google, Telepathy is a minnow, but Iguchi doesnt seem to worry. In his shared office space in San Francisco  a cool, converted warehouse  he quotes Sun Tzus The Art of War and says that even tiny armies can sometimes beat powerful forces. When he was growing up, Japanese technology ruled the world: the Sony Walkman was the iPhone of its day. Now, to compete, hes had to leave Tokyo and go to Silicon Valley.
Tokyo is very rich in fashion and culture but its still an island. Its isolated. There is not any way to expand. Whereas, in Silicon Valley, everyone is from everywhere. Its where you come to connect globally. The hardware will be made in Japan, and he is putting together a team of software engineers in the US to develop its applications.
Building the prototype of Telepathy One was easy, Iguchi says. We have every sort of technology in Tokyo. It is presenting it to the world that is the challenge. The top manufacturers all want to work with him, he says, because they have the technology, they just struggle to sell it. There needs to be a story to the product. Like Apple did with the iPod  1,000 songs in your pocket. And Steve Jobs was inspired by Akio Morita, the co-founder of Sony, and he inspired me, so maybe it will come in a circle.
Maybe. He certainly has the confidence of Jobs, but, with a thick Japanese accent, he sometimes struggles to make himself understood, a fact that may have contributed to his idea for Telepathy One. When he went to London to present the headset, he stayed in an Airbnb. The house owner was not my friend but I talked with him for three hours, and now he is my friend. That is how long it takes to understand each other, to share our feelings, and background, and career. Maybe Telepathy makes that quicker. If you are getting info from the cloud and social networks, that will happen more easily.
Iguchi hopes that seeing somebody elses I suddenly realized that everything is code. Everything is coded and is shareable between humans. And everything can be encoded and decoded. And, if code is exchangeable between humans, that will end all war. literal point of view will help you to see their metaphorical point of view. As a student, he explains, he studied philosophy by day and taught himself how to code by night. And, one day, I opened the door of my apartment and
",2,Int-Txt
101,"Intermediate 
An octopus has escaped from the National Aquarium in New Zealand by leaving its tank, sliding down a 50-metre drainpipe and disappearing into the sea. Inky  a common New Zealand octopus  escaped after the lid of his tank was accidentally left a bit ajar. Staff believe that in the middle of the night, while the aquarium was deserted, Inky climbed to the top of his glass enclosure, down the side of the tank and travelled across the floor of the aquarium.
Rob Yarrell, national manager of the National Aquarium of New Zealand in Napier, said: Octopuses are famous for their ability to escape. I dont think he was unhappy with us, or lonely, because octopuses are solitary creatures. But, he is such a curious boy. He wanted to know what was happening on the outside. Thats just his personality.
One theory is that Inky slid across the aquarium floor  a journey of three or four metres  and, then, into a drainpipe that led directly to the sea. The drainpipe was 50 metres long and led to the waters of Hawkes Bay, on the east coast of New Zealands North Island.
It is also possible that Inky escaped by squeezing into an open pipe at the top of his tank, which led under the floor to the drain. When we came in the next morning and his tank was empty, I was really surprised, said Yarrell, who has not launched a search for Inky. The staff and I have been pretty sad. But then, this is Inky and hes always been a bit of a surprise octopus.
Reiss Jenkinson, exhibits keeper at the National Aquarium, said he was absolutely certain Inky was not stolen. I understand octopus behaviour very well, he said. I have seen octopuses on boats escape through bilge pumps. And, the security here is too tight for anyone to take Inky and why would they?
Because octopuses have no bones, they are able to fit into extremely small spaces and can squeeze through gaps the size of coins. They are also extremely intelligent and can use tools. At the Island Bay Marine Education Centre in Wellington, an octopus used to visit another tank during the night to steal crabs, then return to its own tank. Another at the centre, Ozymandias, broke a world record for opening a jar.
Inky was brought to the National Aquarium several years ago by a local fisherman who found him caught in a fishing pot. He was rough looking, with very short arms, said Yarrell. He had been living on the reef and fighting with fish so he wasnt in the best shape. According to Yarrell, Inky  who is about the size of a rugby ball  was an unusually intelligent octopus. He was very friendly and a popular attraction here. We have another octopus, Blotchy, but he is smaller than Inky and Inky had the personality.
The aquarium has no plans to step up security as a result of the escape because they dont think it will happen again. But, the staff are more and more aware of what octopuses can do. Although the aquarium is not looking for a replacement for Inky, if a fisherman brought in another octopus, it might accept it. You never know, said Yarrell. Theres always a chance Inky could come home to us.

",2,Int-Txt
137,"Intermediate 
You can see a thick layer of bird droppings inside one of Britains most expensive properties. Pigeon skeletons lie among shattered mirrors and water streams through broken walls. This is The Tower, a 30m palace in Billionaires Row in north London, whose spectacular ruin has been kept secret until now.
It is one of ten mansions in the middle of The Bishops Avenue that have stood almost completely vacant since they were bought a quarter of a century ago, it is believed for members of the Saudi Arabian royal family. Their Grecian columns are cracking into pieces and mosaic-tiled swimming pools are filled with rubble. Nature has taken over and owls have moved in.
It is a sad scene repeated up and down the avenue that Lloyds Bank has calculated is the second most expensive street in Britain. While more and more people struggle to get on to Londons property ladder as house prices rise at 11.2% a year, 16 mansions on the most expensive part of The Bishops Avenue are empty, many behind locked gates, their overgrown grounds guarded by dogs.
Across the street stands another derelict mansion, worth 18m, with smashed windows and walls painted with anti-climb paint. Metal grilles block the windows of another, which has been sold for 20m.
The sight of the derelict properties can be agonizing for people who are struggling to keep a roof above their heads in one of the worlds most expensive cities. One security guard who works on the avenue said it was exasperating to see so many properties  enough to house dozens of people  falling apart.
Oil-rich royals from Nigeria and Saudi Arabia were among the first to come to this road near Hampstead Heath. Iranians fled here after the fall of the shah. Now, Chinese house hunters are following Russians and Kazakhs who have spent millions to get an address that estate agents tell them is as world famous as the Champs Elyses and Rodeo Drive. Recently, two mansions have been on sale for 65m and 38m, promising endless Italian marble, leather-padded lifts and luxury panic rooms.
However, in the gardens of the empty mansions, stone fountains crumble. Inside one mansion, water drips through a huge crystal chandelier onto a thick carpet rotting under sections of collapsed ceiling. Moss grows through shattered bricks and mirrored tiles are lying on a bathroom floor. The swimming pool is filled with dirty water and has flowers growing through its tiles. The wood in the sauna is coming off the walls.
But it is the ruin of The Towers, a grand mansion set among acres of trees, that is most dramatic. Its huge, high-ceiling halls are occupied by pigeons and its walls have been turned bright green by algae. Unopened wooden boxes marked bullet-proof glass show the security fears of the previous owners.
Today, very few people live on The Bishops Avenue full time. A security guard patrolling the pavement outside one mansion said that the owners were not there. Another, outside Royal Mansion, would not say if anyone was home, while a member of staff at another mansion simply warned the Guardian about the guard dogs. Magdy Adib Ishak-Hannah, whose personal wealth is 45m, said he was in the minority of permanent residents.
Its not a neighbourly place, where you can chat over the fence, he said. To be honest, I have never seen what my neighbours look like. Next door, a Saudi princess spent 35m on a new house and Ive never seen her. There are about three houses that are lived in 24/7 and half of the properties are occupied three to six months a year. The other half, who knows if they come or not?
The multimillion-pound ruins are evidence of a property culture in which the worlds richest people see British property as investments.
Nevertheless, the talk on the avenue is about building 5m apartments, instead of 50m mansions, in an effort to bring people back.
Anil Varma, a local property developer, has decided to rebuild one of the most valuable sites on the avenue as a collection of 20 apartments with a concierge, maid service, 25-metre pool, spa and cinema.
If you build a big house and try and sell for 30m to 40m, it wont sell, he said. Locals wont buy and so you have to bring in overseas buyers.
But nobody plans to use the avenues empty property to help solve the housing crisis. Andrew Harper, a local Conservative politician, laughed when he was asked whether some of the derelict housing could become cheap homes. He said the price of the land is far too high.


",2,Int-Txt
